Date,Title,URL,URL_selector
2026-03-04,Is your TPAR overdue? Lodge now to avoid penalties,https://www.ato.gov.au/businesses-and-organisations/small-business-newsroom/is-your-tpar-overdue-lodge-now-to-avoid-penalties,section:nth-of-type(1)
2026-03-03,Climate resilience adds revenue options for Australia’s farmers,https://www.climatechangeauthority.gov.au/climate-resilience-adds-revenue-options-australias-farmers,main:nth-of-type(1)
2026-03-05,Carlsberg Raises Climate Ambition With Updated Brewing Tomorrow ESG Programme,https://esgnews.com/carlsberg-raises-climate-ambition-with-updated-brewing-tomorrow-esg-programme/,div:nth-of-type(2)
2026-03-04,KPMG Appoints Gauthier Acket As Head Of Global ESG,https://esgnews.com/kpmg-appoints-gauthier-acket-as-head-of-global-esg/,div:nth-of-type(2)
2026-03-05,State of the energy transition: Your technology playbook,https://www.csiro.au/en/news/All/Articles/2026/March/State-of-the-Energy-Transition,main:nth-of-type(1)
2026-03-05,Taking quantum science to the outback,https://www.csiro.au/en/news/All/Articles/2026/March/Remote-schools-quantum-visit,main:nth-of-type(1)
2026-03-03,CSIRO backs Australian startups tackling some of humanity's biggest challenges,https://www.csiro.au/en/news/All/News/2026/March/On-Accelerate-program,main:nth-of-type(1)
2026-03-05,Consultation begins on Gender Equity Charter for aviation sector,https://www.infrastructure.gov.au/department/media/news/consultation-begins-gender-equity-charter-aviation-sector,main:nth-of-type(1)
2026-03-03,Construction begins on Stage 1 of Melbourne Airport Rail Link,https://www.infrastructure.gov.au/department/media/news/construction-begins-stage-1-melbourne-airport-rail-link,main:nth-of-type(1)
2026-03-03,AFC Women’s Asian Cup 2026 has kicked off,https://www.infrastructure.gov.au/department/media/news/afc-womens-asian-cup-2026-has-kicked,main:nth-of-type(1)
2026-03-02,REAL Program launches supporting transitions from the justice system,https://www.indigenous.gov.au/news/real-program-launches-supporting-transitions-from-justice-system,main:nth-of-type(1)
2026-03-05,"For Somalia, Building Climate Resilience is Key to Unlocking Long-Term Growth and Jobs",http://www.worldbank.org/en/news/press-release/2026/03/05/for-somalia-building-climate-resilience-is-key-to-unlocking-long-term-growth-and-jobs,main:nth-of-type(1)
2026-03-05,World Bank Backs South Africa’s Credit Guarantee Vehicle to Enable Infrastructure Finance and Boost Job Creation,http://www.worldbank.org/en/news/press-release/2026/03/05/world-bank-backs-south-africas-credit-guarantee-vehicle-to-enable-infrastructure-finance-and-boost-job-creation,main:nth-of-type(1)
2026-03-05,New World Bank Group Financing Supports Angola’s Economic Reforms to Promote Inclusive Growth and Job Creation,http://www.worldbank.org/en/news/press-release/2026/03/06/new-world-bank-group-financing-supports-angola-s-economic-reforms-to-promote-inclusive-growth-and-job-creation,main:nth-of-type(1)
2026-03-04,Tunisia Scales Up Urban Flood Protection Efforts with World Bank Support,http://www.worldbank.org/en/news/press-release/2026/03/04/tunisia-scales-up-urban-flood-protection-efforts-with-world-bank-support,main:nth-of-type(1)
2026-03-03,Ethiopia: A New Phase of Support for Safety Nets will Foster Resilience and Create Pathways to Decent Jobs,http://www.worldbank.org/en/news/press-release/2026/03/03/ethiopia-a-new-phase-of-support-for-safety-nets-will-foster-resilience-and-create-pathways-to-decent-jobs,main:nth-of-type(1)
2026-03-03,Export Finance Australia and Standard Chartered partner to expand finance for Australian exporters,https://www.exportfinance.gov.au/newsroom/export-finance-australia-and-standard-chartered-partner-to-expand-finance-for-australian-exporters/,div:nth-of-type(1)
2026-03-04,Economic recovery is welcome but rebalancing still needed,https://www.australianindustrygroup.com.au/news/media-centre/2026/economic-recovery-is-welcome-but-rebalancing-still-needed/,div:nth-of-type(2)
2026-03-03,Innes Willox statement on WGEA gender pay gaps,https://www.australianindustrygroup.com.au/news/media-centre/2026/innes-willox-statement-on-wgea-gender-pay-gaps/,div:nth-of-type(2)
2026-03-03,WFH legislation will cost Victoria,https://www.australianindustrygroup.com.au/news/media-centre/2026/wfh-legislation-will-cost-victoria/,div:nth-of-type(2)
2026-03-03,APRA statement on gender pay gap,https://www.apra.gov.au/news-and-publications/apra-statement-on-gender-pay-gap,main:nth-of-type(1)
2026-03-02,APRA revokes Bank of Nova Scotia’s authorised deposit-taking institution licence,https://www.apra.gov.au/news-and-publications/apra-revokes-bank-of-nova-scotia%E2%80%99s-authorised-deposit-taking-institution,main:nth-of-type(1)
2026-03-09,"Why data centre energy use is just scratching the surface AI expert Luis Gonzalez sees a future where energy equals intelligence, but if Australia is to be an AI hub without coal, our policy settings need to change",https://theenergy.co/article/why-data-centre-energy-use-is-just-scratching-the-surface,article:nth-of-type(1)
2026-03-09,"How big can batteries get? Why safety, not chemistry, sets the limit As the size of batteries becomes grid-scale, the lack of mandatory, nationally harmonised safety standards needs to be addressed",https://theenergy.co/article/how-big-can-batteries-get,article:nth-of-type(1)
2026-03-06,Call for rethink on retail energy comparison tools The Energy Made Easy site may be in for a funding boost but some say a lot more is needed to inform consumers as energy products evolve,https://theenergy.co/article/call-for-rethink-on-retail-energy-comparison-tools,article:nth-of-type(1)
2026-03-06,Australian LNG not the answer to missing Qatari supply Will the Middle East conflict provide an opportunity for Australian LNG producers to step up in place of QatarEnergy?,https://theenergy.co/article/lng,article:nth-of-type(1)
2026-03-06,New South Wales races to plug storage gap The Energy Security Corporation is talking to battery developers to finance the next slate of battery projects to shore up the grid's post-Eraring future,https://theenergy.co/article/new-south-wales-races-to-plug-storage-gap,article:nth-of-type(1)
2026-03-05,Time to give up on VPPs?,https://theenergy.co/article/time-to-give-up-on-vpps,article:nth-of-type(1)
2026-03-04,WA clocks six months of majority renewables Near miss for the NEM over spring and summer,https://theenergy.co/article/wa-clocks-six-months-of-majority-renewables,article:nth-of-type(1)
2026-03-04,Developers view government offtakes with rose coloured glasses Project developers say the void that erstwhile long-term state government power purchase agreements left has not fully been filled by the Capacity Investment Scheme,https://theenergy.co/article/developers-view-government-off-takes-with-rose-coloured-glasses,article:nth-of-type(1)
2026-03-03,Renewables investment outpacing net zero requirements,https://theenergy.co/article/renewables-investment-is-outpacing-net-zero-requirements,article:nth-of-type(1)
2026-03-03,AER questions higher fixed charges assumptions,https://theenergy.co/article/aer-questions-higher-fixed-charges-assumptions,article:nth-of-type(1)
2026-03-05,Update on Norfolk Island air freight arrangements,https://www.infrastructure.gov.au/department/media/news/update-norfolk-island-air-freight-arrangements-0,main:nth-of-type(1)
2026-03-06,Status of Women Report Card,https://www.pmc.gov.au/news/status-women-report-card,main:nth-of-type(1)
2026-03-04,Identity verification made simpler for scheme participants,https://cer.gov.au/news-and-media/news/2026/march/identity-verification-made-simpler-scheme-participants,main:nth-of-type(1)
2026-03-02,New solar battery photo requirements now in place,https://cer.gov.au/news-and-media/news/2026/march/new-solar-battery-photo-requirements-now-place,main:nth-of-type(1)
2026-03-08,Design contract signals decisive step in Henderson Defence Precinct consolidation,https://www.minister.defence.gov.au/media-releases/2026-03-08/design-contract-signals-decisive-step-henderson-defence-precinct-consolidation,main:nth-of-type(1)
2026-03-04,Parliament passes legislation to establish Defence committee,https://www.minister.defence.gov.au/media-releases/2026-03-04/parliament-passes-legislation-establish-defence-committee,main:nth-of-type(1)
2026-03-02,Product of Concern Summit for Collins class sustainment,https://www.minister.defence.gov.au/media-releases/2026-03-02/product-concern-summit-collins-class-sustainment,main:nth-of-type(1)
2026-03-06,New grant funding open for industry-led research collaborations,https://www.industry.gov.au/news/new-grant-funding-open-industry-led-research-collaborations,main:nth-of-type(1)
2026-03-06,$53 million in grants to help create a critical metal refining industry,https://www.industry.gov.au/news/53-million-grants-help-create-critical-metal-refining-industry,main:nth-of-type(1)
2026-03-05,Australia and Canada agree to strengthen cooperation on AI safety,https://www.industry.gov.au/news/australia-and-canada-agree-strengthen-cooperation-ai-safety,main:nth-of-type(1)
2026-03-03,Four new major projects to strengthen Australia’s supply chains,https://www.industry.gov.au/news/four-new-major-projects-strengthen-australias-supply-chains,main:nth-of-type(1)
2026-03-03,George Medicines designs a ‘triple pill’ to better manage hypertension,https://www.industry.gov.au/news/george-medicines-designs-triple-pill-better-manage-hypertension,main:nth-of-type(1)
2026-03-02,Launch your STEM career as a graduate in 2027,https://www.industry.gov.au/news/launch-your-stem-career-graduate-2027,main:nth-of-type(1)
2026-03-02,Fuel pump audit will ensure you get what you pay for at the bowser,https://www.industry.gov.au/news/fuel-pump-audit-will-ensure-you-get-what-you-pay-bowser,main:nth-of-type(1)
2026-03-09,New Indigenous Healing Service for FDV impacted youth in Midland,https://www.wa.gov.au/government/media-statements/Cook%20Labor%20Government/New-Indigenous-Healing-Service-for-FDV-impacted-youth-in-Midland--20260309,article:nth-of-type(1)
2026-03-08,Walk trail to acknowledge remarkable women at Fremantle Cemetery,https://www.wa.gov.au/government/media-statements/Cook%20Labor%20Government/Walk-trail-to-acknowledge-remarkable-women-at-Fremantle-Cemetery-20260308,div:nth-of-type(1)
2026-03-07,$1 million in grants for WA research program to boost 'water smart' farms,https://www.wa.gov.au/government/media-statements/Cook%20Labor%20Government/$1-million-in-grants-for-WA-research-program-to-boost-'water-smart'-farms--20260307,div:nth-of-type(1)
2026-03-07,$5.5 million in Marine Rescue vessel upgrades delivered,https://www.wa.gov.au/government/media-statements/Cook%20Labor%20Government/$5.5-million-in-Marine-Rescue-vessel-upgrades-delivered-20260307,div:nth-of-type(1)
2026-03-07,WA tourism operators bring home gold at national awards,https://www.wa.gov.au/government/media-statements/Cook%20Labor%20Government/WA-tourism-operators-bring-home-gold-at-national-awards-20260307,article:nth-of-type(1)
2026-03-06,World's fastest track cyclists race into Perth,https://www.wa.gov.au/government/media-statements/Cook%20Labor%20Government/World's-fastest-track-cyclists-race-into-Perth-20260306,article:nth-of-type(1)
2026-03-06,Perth crowds help AFC Women's Asian Cup break attendance record,https://www.wa.gov.au/government/media-statements/Cook%20Labor%20Government/Perth-crowds-help-AFC-Women's-Asian-Cup-break-attendance-record--20260306,article:nth-of-type(1)
2026-03-06,Purpose-built paediatric therapy centre opens in Kalgoorlie-Boulder,https://www.wa.gov.au/government/media-statements/Cook%20Labor%20Government/Purpose-built-paediatric-therapy-centre-opens-in-Kalgoorlie-Boulder-20260306,div:nth-of-type(1)
2026-03-06,A free pass to adventures for WA foster and family carers,https://www.wa.gov.au/government/media-statements/Cook%20Labor%20Government/A-free-pass-to-adventures-for-WA-foster-and-family-carers-20260306,div:nth-of-type(1)
2026-03-06,Kimberley's unique landscape primed for bike riding opportunities,https://www.wa.gov.au/government/media-statements/Cook%20Labor%20Government/Kimberley's-unique-landscape-primed-for-bike-riding-opportunities--20260306,article:nth-of-type(1)
2026-03-06,Joint media statement - New interchange to support Pilbara's clean energy future,https://www.wa.gov.au/government/media-statements/Cook%20Labor%20Government/Joint-media-statement---New-interchange-to-support-Pilbara's-clean-energy-future-20260306,article:nth-of-type(1)
2026-03-06,WA is Stronger Together on International Women's Day,https://www.wa.gov.au/government/media-statements/Cook%20Labor%20Government/WA-is-Stronger-Together-on-International-Women's-Day-20260306,article:nth-of-type(1)
2026-03-06,Cottesloe comes alive with return of Sculpture by the Sea,https://www.wa.gov.au/government/media-statements/Cook%20Labor%20Government/Cottesloe-comes-alive-with-return-of-Sculpture-by-the-Sea--20260306,div:nth-of-type(1)
2026-03-06,Tenders awarded to enhance care at Sir Charles Gairdner Hospital,https://www.wa.gov.au/government/media-statements/Cook%20Labor%20Government/Tenders-awarded-to-enhance-care-at-Sir-Charles-Gairdner-Hospital-20260306,div:nth-of-type(1)
2026-03-06,Community Housing Provider appointed to manage former Fraser Suites complex,https://www.wa.gov.au/government/media-statements/Cook%20Labor%20Government/Community-Housing-Provider-appointed-to-manage-former-Fraser-Suites-complex-20260306,article:nth-of-type(1)
2026-03-05,Western Australian agrifood and beverage businesses participating in North Asia trade events,https://www.wa.gov.au/government/media-statements/Cook%20Labor%20Government/Western-Australian-agrifood-and-beverage-businesses-participating-in-North-Asia-trade-events-20260305,article:nth-of-type(1)
2026-03-05,Western Australia welcomes the Qantas Australian Tourism Awards,https://www.wa.gov.au/government/media-statements/Cook%20Labor%20Government/Western-Australia-welcomes-the-Qantas-Australian-Tourism-Awards-20260305,article:nth-of-type(1)
2026-03-05,New concert series arrives at METRONET stations,https://www.wa.gov.au/government/media-statements/Cook%20Labor%20Government/New-concert-series-arrives-at-METRONET-stations-20260305,div:nth-of-type(1)
2026-03-05,$94 million Roebourne District High School redevelopment complete,https://www.wa.gov.au/government/media-statements/Cook%20Labor%20Government/$94-million-Roebourne-District-High-School-redevelopment-complete-20260305,article:nth-of-type(1)
2026-03-05,Grains genetic research alliance celebrates a decade of success,https://www.wa.gov.au/government/media-statements/Cook%20Labor%20Government/Grains-genetic-research-alliance-celebrates-a-decade-of-success-20260305,div:nth-of-type(1)
2026-03-02,Building Women’s Careers marks one year of impact across Australia,https://www.dewr.gov.au/newsroom/articles/building-womens-careers-marks-one-year-impact-across-australia,main:nth-of-type(1)
2026-03-09,Fast-Tracking Hundreds Of New Homes In A Sweet Location,https://www.premier.vic.gov.au/fast-tracking-hundreds-new-homes-sweet-location,main:nth-of-type(1)
2026-03-08,Violence Reduction Unit Deploying In Mernda,https://www.premier.vic.gov.au/violence-reduction-unit-deploying-mernda,main:nth-of-type(1)
2026-03-08,Record-Breaking F1 Hits Full Throttle,https://www.premier.vic.gov.au/record-breaking-f1-hits-full-throttle,main:nth-of-type(1)
2026-03-07,More Free Pads And Tampons To Save Time And Money,https://www.premier.vic.gov.au/more-free-pads-and-tampons-save-time-and-money,main:nth-of-type(1)
2026-03-06,Tones And I Show To Boost Bushfire Recovery Efforts,https://www.premier.vic.gov.au/tones-and-i-show-boost-bushfire-recovery-efforts,main:nth-of-type(1)
2026-03-06,Cost Of Living Support And A Growing Economy,https://www.premier.vic.gov.au/cost-living-support-and-growing-economy,main:nth-of-type(1)
2026-03-06,Let There Be Light – Bendigo Netball Receives New Lighting,https://www.premier.vic.gov.au/let-there-be-light-bendigo-netball-receives-new-lighting,main:nth-of-type(1)
2026-03-06,Get The Pill At Your Local Chemist Without A Script,https://www.premier.vic.gov.au/get-pill-your-local-chemist-without-script,main:nth-of-type(1)
2026-03-05,Supercars To Rev Up F1 Grand Prix For Years To Come,https://www.premier.vic.gov.au/supercars-rev-f1-grand-prix-years-come,main:nth-of-type(1)
2026-03-06,NSW Government Gives $20 Million Boost to Innovative Small Business,https://www.chiefscientist.nsw.gov.au/news/nsw-government-gives-$20-million-boost-to-innovative-small-business,main:nth-of-type(1)
2026-03-05,AEMO publishes ECMC governance review submission,https://www.aemo.com.au/newsroom/news-updates/aemo-publishes-ecmc-governance-review-submission,main:nth-of-type(1)
2026-03-09,Next steps for Wild Fallow Deer Management,https://www.premier.tas.gov.au/latest-news/2026/march/next-steps-for-wild-fallow-deer-management,main:nth-of-type(1)
2026-03-09,Helping Tasmanians to be work-ready,https://www.premier.tas.gov.au/latest-news/2026/march/helping-tasmanians-to-be-work-ready-,main:nth-of-type(1)
2026-03-09,Taking action to reform ‘good character’ references,https://www.premier.tas.gov.au/latest-news/2026/march/taking-action-to-reform-good-character-references,main:nth-of-type(1)
2026-03-08,Seven hundred tonnes of gantry coming together,https://www.premier.tas.gov.au/latest-news/2026/march/seven-hundred-tonnes-of-gantry-coming-together,main:nth-of-type(1)
2026-03-08,Agriculture Strategy consultation report released,https://www.premier.tas.gov.au/latest-news/2026/march/agriculture-strategy-consultation-report-released,main:nth-of-type(1)
2026-03-08,Growing local government collaboration,https://www.premier.tas.gov.au/latest-news/2026/march/growing-local-government-collaboration,main:nth-of-type(1)
2026-03-08,Granny flats to expand,https://www.premier.tas.gov.au/latest-news/2026/march/granny-flats-to-expand,main:nth-of-type(1)
2026-03-07,Long Course Swimming Championships making waves,https://www.premier.tas.gov.au/latest-news/2026/march/long-course-swimming-championships-making-waves,main:nth-of-type(1)
2026-03-07,Tasmania’s infrastructure pipeline nearing $40 billion,https://www.premier.tas.gov.au/latest-news/2026/march/tasmanias-infrastructure-pipeline-nearing-$40-billion,main:nth-of-type(1)
2026-03-07,New Northern Tasmania sport and recreation hub ready to open,https://www.premier.tas.gov.au/latest-news/2026/march/new-northern-tasmania-sport-and-recreation-hub-ready-to-open,main:nth-of-type(1)
2026-03-07,Tasmania shines at Australian Tourism Awards,https://www.premier.tas.gov.au/latest-news/2026/march/tasmania-shines-at-australian-tourism-awards,main:nth-of-type(1)
2026-03-07,New proposal on the table for teachers,https://www.premier.tas.gov.au/latest-news/2026/march/new-proposal-on-the-table-for-teachers,main:nth-of-type(1)
2026-03-06,Australia and Canada partner on safe and trustworthy AI,https://www.minister.industry.gov.au/ministers/charlton/media-releases/australia-and-canada-partner-safe-and-trustworthy-ai,main:nth-of-type(1)
2026-03-06,Australia and Canada partner on safe and trustworthy AI,https://www.minister.industry.gov.au/ministers/timayres/media-releases/australia-and-canada-partner-safe-and-trustworthy-ai,main:nth-of-type(1)
2026-03-06,Australia invests $53 million to help unlock the critical minerals of the future,https://www.minister.industry.gov.au/ministers/timayres/media-releases/australia-invests-53-million-help-unlock-critical-minerals-future,main:nth-of-type(1)
2026-03-06,Australia invests $53 million to help unlock the critical minerals of the future,https://www.minister.industry.gov.au/ministers/king/media-releases/australia-invests-53-million-help-unlock-critical-minerals-future,main:nth-of-type(1)
2026-03-02,Stocktake reinforces Australia's strength in critical minerals,https://www.minister.industry.gov.au/ministers/king/media-releases/stocktake-reinforces-australias-strength-critical-minerals,main:nth-of-type(1)
2026-03-03,"Novus on Victoria, Chatswood Build-To-Rent approved subject to conditions",https://www.ipcn.nsw.gov.au/news/novus-victoria-chatswood-build-rent-approved-subject-conditions,main:nth-of-type(1)
2026-03-09,Funding for Australian-first alliance boosting access to life-saving clinical cancer trials,https://www.nsw.gov.au/ministerial-releases/funding-for-australian-first-alliance-boosting-access-to-life-saving-clinical-cancer-trials,main:nth-of-type(1)
2026-03-09,$16 million boost to flood-proof central coast and mid north coast national park roads,https://www.nsw.gov.au/ministerial-releases/16-million-boost-to-flood-proof-central-coast-and-mid-north-coast-national-park-roads,main:nth-of-type(1)
2026-03-09,"Virtual support service delivers safer, more efficient care for WNSWLHD patients",https://www.nsw.gov.au/ministerial-releases/virtual-support-service-delivers-safer-more-efficient-care-for-wnswlhd-patients,main:nth-of-type(1)
2026-03-09,Innovative green hydrogen and ammonia project to cut emissions for Moree farms,https://www.nsw.gov.au/ministerial-releases/innovative-green-hydrogen-and-ammonia-project-to-cut-emissions-for-moree-farms,main:nth-of-type(1)
2026-03-09,Treasurer attends super investment summit,https://www.nsw.gov.au/ministerial-releases/treasurer-attends-super-investment-summit,main:nth-of-type(1)
2026-03-09,Billion-dollar distribution centre approval a first for Aerotropolis,https://www.nsw.gov.au/ministerial-releases/billion-dollar-distribution-centre-approval-a-first-for-aerotropolis,main:nth-of-type(1)
2026-03-09,"Built, finished, opening: toll-free M12 Motorway goes live on Saturday, 14 march",https://www.nsw.gov.au/ministerial-releases/built-finished-opening-toll-free-m12-motorway-goes-live-on-saturday-14-march,main:nth-of-type(1)
2026-03-09,Women’s Asian Cup highlights $275 million impact of sports tourism on NSW visitor economy,https://www.nsw.gov.au/departments-and-agencies/dciths/ministerial-media-releases/womens-asian-cup-highlights-275-million-impact-of-sports-tourism-on-nsw-visitor-economy,main:nth-of-type(1)
2026-03-09,Minns Labor Government to move on stronger protections for retail workers,https://www.nsw.gov.au/ministerial-releases/minns-labor-government-to-move-on-stronger-protections-for-retail-workers,main:nth-of-type(1)
2026-03-09,$50 million for building thriving regional communities,https://www.nsw.gov.au/ministerial-releases/50-million-for-building-thriving-regional-communities,main:nth-of-type(1)
2026-03-03,Joint media release: Canberra's third community battery powers up,https://minister.dcceew.gov.au/bowen/media-releases/joint-media-release-canberras-third-community-battery-powers,main:nth-of-type(1)
2026-03-02,Joint media release: Clean energy apprentices delivering our renewable future,https://minister.dcceew.gov.au/bowen/media-releases/joint-media-release-clean-energy-apprentices-delivering-our-renewable-future,main:nth-of-type(1)
2026-03-06,ASIC files Court action to wind up Liberty Bell Bay after failures to lodge financial reports,https://www.asic.gov.au/about-asic/news-centre/find-a-media-release/2026-releases/26-041mr-asic-files-court-action-to-wind-up-liberty-bell-bay-after-failures-to-lodge-financial-reports/,main:nth-of-type(1)
2026-03-06,Getting ready for Airport Rail,https://bigbuild.vic.gov.au/news/melbourne-airport-rail/getting-ready-for-airport-rail,main:nth-of-type(1)
2026-03-06,Newport link road to open in April,https://bigbuild.vic.gov.au/news/level-crossing-removal-project/newport-link-road-to-open-in-april,main:nth-of-type(1)
2026-03-02,Making progress in Melton,https://bigbuild.vic.gov.au/news/level-crossing-removal-project/making-progress-in-melton,main:nth-of-type(1)
2026-03-06,"Audits find State entities need to improve controls over portable assets to reduce the risk of items being misused, lost or stolen, and to strengthen cyber security measures",https://audit.wa.gov.au/wp-content/uploads/2026/03/Media-statement-Microsoft-365-and-Portable-Assets.pdf,
2026-03-05,Celebrate 50 years of Werrikimbe National Park at Mooraback Cabin | Media release,https://www.environment.nsw.gov.au/news/celebrate-50-years-werrikimbe-national-park-mooraback-cabin,main:nth-of-type(1)
2026-03-05,Protect your dam with a burnt netting,https://agriculture.vic.gov.au/about/media-centre/media-releases/2026-releases/protect-your-dam-with-a-burnt-netting,main:nth-of-type(1)
2026-03-05,Livestock tag prices lowest in Australia,https://agriculture.vic.gov.au/about/media-centre/media-releases/2026-releases/livestock-tag-prices-lowest-in-australia,main:nth-of-type(1)
2026-03-04,Get shearing done to prevent animal welfare issues,https://agriculture.vic.gov.au/about/media-centre/media-releases/2026-releases/get-shearing-done-to-prevent-animal-welfare-issues,main:nth-of-type(1)
2026-03-02,Victoria expands support for beekeepers,https://agriculture.vic.gov.au/about/media-centre/media-releases/2026-releases/victoria-expands-support-for-beekeepers,main:nth-of-type(1)
2026-03-04,Securing long-term investment in Northern Australia,https://minister.infrastructure.gov.au/m-king/media-release/securing-long-term-investment-northern-australia,main:nth-of-type(1)
2026-03-05,Proposed rules to protect life support customers during outages and extreme weather events,https://www.esc.vic.gov.au/media-centre/proposed-rules-protect-life-support-customers-during-outages-and-extreme-weather-events,section:nth-of-type(3)
2026-03-04,How the SBTi is meeting India’s corporate climate momentum,https://sciencebasedtargets.org/blog/how-the-sbti-is-meeting-indias-corporate-climate-momentum,main:nth-of-type(1)
2026-03-03,VIDEO: How is the EU fighting illegal trade in European eel?,https://environment.ec.europa.eu/news/video-how-eu-fighting-illegal-trade-european-eel-2026-03-03_en,main:nth-of-type(1)
