Date,Title,URL,URL_selector
2026-03-03,PRACTICAL SUPPORT - Continued collaboration on wolf impact on small scale extensive livestock | Italy,https://environment.ec.europa.eu/news/practical-support-continued-collaboration-wolf-impact-small-scale-extensive-livestock-italy-2026-03-03_en,main:nth-of-type(1)
2026-03-05,FRANCESCA: seeking your views on circular solutions for the furniture industry!,https://circulareconomy.europa.eu/platform/en/news-and-events/all-news/francesca-seeking-your-views-circular-solutions-furniture-industry,main:nth-of-type(1)
2026-03-04,Circular bioeconomy: a report on scaling up bio-based industries,https://circulareconomy.europa.eu/platform/en/news-and-events/all-news/circular-bioeconomy-report-scaling-bio-based-industries,main:nth-of-type(1)
2026-03-03,Assessing the climate mitigation potential of circular economy,https://circulareconomy.europa.eu/platform/en/news-and-events/all-news/assessing-climate-mitigation-potential-circular-economy,main:nth-of-type(1)
2026-03-02,Applications for EU Green Week 2026 partner events are now open!,https://circulareconomy.europa.eu/platform/en/news-and-events/all-news/applications-eu-green-week-2026-partner-events-are-now-open,main:nth-of-type(1)
2026-03-06,Meet the small businesses heading to the Australian Tourism Awards,https://business.vic.gov.au/news-and-updates/2026/meet-the-small-businesses-heading-to-the-australian-tourism-awards,main:nth-of-type(1)
2026-03-02,Celebrating extraordinary Victorian women,https://business.vic.gov.au/news-and-updates/2026/celebrating-extraordinary-victorian-women,main:nth-of-type(1)
2026-03-06,Middle East conflict,https://www.dfat.gov.au/crisis-hub/middle-east-conflict,div:nth-of-type(1)
2026-03-02,2027 Graduate Program Applications Now Open,https://www.dfat.gov.au/careers/dfat-aps-careers/graduate-program,main:nth-of-type(1)
2026-03-06,IMF Staff Concludes Visit to Gabon,https://www.imf.org/en/news/articles/2026/03/06/pr-26074-gabon-imf-staff-concludes-visit-to-gabon,main:nth-of-type(1)
2026-03-05,IMF Staff Concludes Visit to Zambia,https://www.imf.org/en/news/articles/2026/03/05/pr-26073-zambia-imf-staff-concludes-visit-to-zambia,main:nth-of-type(1)
2026-03-05,IMF to Close Resident Representative Office in Suriname,https://www.imf.org/en/news/articles/2026/03/05/pr-26072-suriname-imf-to-close-resident-representative-office-in-suriname,main:nth-of-type(1)
2026-03-05,IMF Staff Concludes Visit to Kenya,https://www.imf.org/en/news/articles/2026/03/05/pr-26071-kenya-imf-staff-concludes-visit-to-kenya,div:nth-of-type(1)
2026-03-05,Shaping Asia’s Future,https://www.imf.org/en/news/articles/2026/03/05/sp030526-shaping-asias-future,main:nth-of-type(1)
2026-03-04,IMF Staff Completes 2026 Article IV Consultation to Kiribati,https://www.imf.org/en/news/articles/2026/03/04/pr26070-kiribati-imf-staff-completes-2026-article-iv-consultation-to-kiribati,main:nth-of-type(1)
2026-03-04,"Joint Press Release by the Ministry of Finance of Thailand, the Bank of Thailand, and the International Monetary Fund on Progress in Preparations for the 2026 Annual Meetings",https://www.imf.org/en/news/articles/2026/03/04/pr-26069-joint-pr-progress-2026-annual-meetings,main:nth-of-type(1)
2026-03-03,IMF Statement on the Middle East,https://www.imf.org/en/news/articles/2026/03/03/pr-26068-statement-on-middle-east,main:nth-of-type(1)
2026-03-06,"The next wave of LED lighting: Smarter, circular and more efficient",https://www.iea.org/commentaries/the-next-wave-of-led-lighting-smarter-circular-and-more-efficient,main:nth-of-type(1)
2026-03-02,"Copper prices have hit record highs, but smelters face mounting strategic pressures",https://www.iea.org/commentaries/copper-prices-have-hit-record-highs-but-smelters-face-mounting-strategic-pressures,main:nth-of-type(1)
2026-03-05,Meeting with Canada’s Minister of Finance and National Revenue,https://ministers.treasury.gov.au/ministers/jim-chalmers-2022/media-releases/meeting-canadas-minister-finance-and-national-revenue,article:nth-of-type(1)
2026-03-04,National Accounts – December quarter 2025,https://ministers.treasury.gov.au/ministers/jim-chalmers-2022/media-releases/national-accounts-december-quarter-2025,article:nth-of-type(1)
2026-03-04,Submission on the Australian tyre industry,https://alga.com.au/submission-on-the-australian-tyre-industry/,main:nth-of-type(1)
2026-03-05,Consultation begins on options to stop family violence perpetrators accessing their victims’ super after death,https://ministers.treasury.gov.au/ministers/daniel-mulino-2025/media-releases/consultation-begins-options-stop-family-violence,article:nth-of-type(1)
