Date,Title,URL,md_file,ESG_or_not,Story_Type
2026-03-06,Torres Strait prepares for H5 bird flu,https://www.dcceew.gov.au/about/news/torres-strait-prepares-h5-bird-flu,117.md,Yes,Funding and Grant Announcements
2026-03-06,Australia and Canada sign first clean energy partnership,https://www.dcceew.gov.au/about/news/australia-canada-sign-first-clean-energy-partnership,118.md,Yes,"Ministerial, Diplomatic, and International Engagements"
2026-03-11,National Reconstruction Fund invests in Macquarie Technology Group to strengthen Australia’s sovereign cloud and cybersecurity capabilities,https://www.nrf.gov.au/news-and-media-releases/national-reconstruction-fund-invests-macquarie-technology-group-strengthen-australias-sovereign-cloud-and-cybersecurity-capabilities,119.md,Yes,Funding and Grant Announcements
2026-03-12,"Doorstop, Parliament House",https://www.foreignminister.gov.au/minister/penny-wong/transcript/doorstop-parliament-house-5,120.md,No,
2026-03-12,"Interview with Laura Jayes, Sky News Day",https://www.foreignminister.gov.au/minister/penny-wong/transcript/interview-laura-jayes-sky-news-day,121.md,No,
2026-03-11,"Interview with Sarah Abo, Today Show",https://www.foreignminister.gov.au/minister/penny-wong/transcript/interview-sarah-abo-today-show-4,122.md,No,
2026-03-11,"Interview with Natalie Barr, Sunrise",https://www.foreignminister.gov.au/minister/penny-wong/transcript/interview-natalie-barr-sunrise-5,123.md,No,
2026-03-11,"Interview with James Glenday, ABC News Breakfast",https://www.foreignminister.gov.au/minister/penny-wong/transcript/interview-james-glenday-abc-news-breakfast-6,124.md,No,
2026-03-11,Russia notifies launch of safeguard investigation on tinplate,https://www.wto.org/english/news_e/news26_e/safe_rus_11mar26_319_e.htm,CLEANED,NO FILE,
2026-03-11,Launch of third phase of EIF activities at MC14 high-level event,https://www.wto.org/english/news_e/news26_e/if_11mar26_318_e.htm,CLEANED,NO FILE,
2026-03-11,WTO chairpersons for 2026,https://www.wto.org/english/news_e/news26_e/gc_11mar26_315_e.htm,CLEANED,NO FILE,
2026-03-09,Uzbekistan commits to maintaining “strong momentum” to accede to WTO in 2026,https://www.wto.org/english/news_e/news26_e/acc_09mar26_316_e.htm,CLEANED,NO FILE,
2026-03-09,The value of the WTO: An economics viewpoint in six instalments,https://www.wto.org/english/news_e/news26_e/blgrs_09mar26_311_e.htm,129.md,No,
2026-03-09,"From field to factory, football and fashion: MC14 high-level event to spotlight cotton",https://www.wto.org/english/news_e/news26_e/cotpt_09mar26_310_e.htm,130.md,No,
2026-03-06,Coordinators of Plastics Dialogue ready ministerial statement and other outcomes for MC14,https://www.wto.org/english/news_e/news26_e/ppesp_06mar26_312_e.htm,CLEANED,NO FILE,
2026-03-06,"Chair of agriculture talks circulates revised draft text, as MC14 outline emerges",https://www.wto.org/english/news_e/news26_e/agng_06mar26_309_e.htm,CLEANED,NO FILE,
2026-03-06,DG Okonjo-Iweala urges members to explore new ways to revitalize WTO at South-South event,https://www.wto.org/english/news_e/news26_e/devel_06mar26_308_e.htm,CLEANED,NO FILE,
2026-03-06,"Ahead of Women’s Day, WEIDE Fund announces US$ 1.76-million grants to women-led businesses",https://www.wto.org/english/news_e/news26_e/women_06mar26_305_e.htm,CLEANED,NO FILE,
2026-03-06,"EU contributes EUR 75,000 to support LDC participation at MC14",https://www.wto.org/english/news_e/pres26_e/pr991_301_e.htm,CLEANED,NO FILE,
2026-03-10,Statement on David Littleproud,https://www.pm.gov.au/media/statement-david-littleproud,136.md,No,
2026-03-10,"Press conference - Parliament House, Canberra",https://www.pm.gov.au/media/press-conference-parliament-house-canberra-46,137.md,No,
2026-03-10,Australia to provide defensive military assistance to Gulf,https://www.pm.gov.au/media/australia-provide-defensive-military-assistance-gulf,138.md,No,
2026-03-06,Television interview - Sky Newsday,https://www.pm.gov.au/media/television-interview-sky-newsday-0,139.md,No,
2026-03-10,What the Nature Strategy Accelerator Unlocks: Turning Nature Data into Strategic Advantage,https://www.wbcsd.org/news/what-the-nature-strategy-accelerator-unlocks-turning-nature-data-into-strategic-advantage/,140.md,Yes,Corporate and Institutional ESG Actions
2026-03-10,Energy resilience: Australiaâ€™s alternative fuel opportunities,https://www.csiro.au/en/news/All/Articles/2026/March/Liquid-Fuels,141.md,Yes,"Environmental Protection, Biodiversity, and Nature Policy"
2026-03-10,Australia-India partnership takes step closer to green steel through world-first use of ag waste in steelmaking,https://www.csiro.au/en/news/All/News/2026/March/World-first-use-of-ag-waste-in-steelmaking,142.md,Yes,"Environmental Protection, Biodiversity, and Nature Policy"
2026-03-12,Why low-frequency spectrum is emerging as a quiet contender for future networks,https://www.csiro.au/en/news/All/Articles/2026/March/Low-frequency-spectrum,143.md,Yes,"Reports, Data Releases, and Analytical Insights"
2026-03-11,Turning crop complexity into practical insight,https://www.csiro.au/en/news/All/Articles/2026/March/James-Manson-farming-systems-research,144.md,Yes,Funding and Grant Announcements
2026-03-10,Statement on the Australian Health Review journal,https://www.csiro.au/en/news/All/News/2026/March/Statement-on-the-Australian-Health-Review-journal,145.md,No,
2026-03-13,Timor-Leste tunes into PacificAus TV,https://www.infrastructure.gov.au/department/media/news/timor-leste-tunes-pacificaus-tv,146.md,No,
2026-03-11,Australian Industry Group welcomes Infrastructure Australia's focus on future‑ready infrastructure,https://www.australianindustrygroup.com.au/news/media-centre/2026/australian-industry-group-welcomes-infrastructure-australias-focus-on-futureready-infrastructure/,147.md,Yes,"Infrastructure, Project Approvals, and EPBC Developments"
2026-03-09,Media Release - IPART reviews supply connection infrastructure regulation - 9 March 2026,https://www.ipart.nsw.gov.au/documents/media-release/media-release-ipart-reviews-supply-connection-infrastructure-regulation-9-march-2026,148.md,Yes,Consultation and Policy Design Opportunities
2026-03-12,Pillar Two: updated guidance and April information session,https://www.ato.gov.au/businesses-and-organisations/business-bulletins-newsroom/pillar-two-updated-guidance-and-april-information-session,CLEANED,NO FILE,
2026-03-12,Mining and petroleum: final taxation ruling TR 2017/1,https://www.ato.gov.au/businesses-and-organisations/business-bulletins-newsroom/mining-and-petroleum-final-taxation-ruling-tr-2017-1,CLEANED,NO FILE,
2026-03-12,"Lodging, paying and other obligations for Pillar Two",https://www.ato.gov.au/businesses-and-organisations/international-tax-for-business/in-detail/multinationals/global-and-domestic-minimum-tax/lodging-paying-and-other-obligations-for-pillar-two,CLEANED,NO FILE,
2026-03-12,Superannuation changes industry roadmap,https://www.ato.gov.au/tax-and-super-professionals/for-superannuation-professionals/apra-regulated-funds/apra-funds-services-systems-and-support/superannuation-changes-indsutry-roadmap,CLEANED,NO FILE,
2026-03-12,Specific issues for Pillar Two,https://www.ato.gov.au/businesses-and-organisations/international-tax-for-business/in-detail/multinationals/global-and-domestic-minimum-tax/specific-issues-for-pillar-two,CLEANED,NO FILE,
2026-03-12,Tax consolidated group lodgments for Pillar Two,https://www.ato.gov.au/businesses-and-organisations/international-tax-for-business/in-detail/multinationals/global-and-domestic-minimum-tax/pillar-two-interactions-with-consolidation/tax-consolidated-group-lodgments-for-pillar-two,CLEANED,NO FILE,
2026-03-12,Pillar Two interactions with other provisions,https://www.ato.gov.au/businesses-and-organisations/international-tax-for-business/in-detail/multinationals/global-and-domestic-minimum-tax/pillar-two-interactions-with-other-provisions,CLEANED,NO FILE,
2026-03-12,When and how the Pillar Two rules apply,https://www.ato.gov.au/businesses-and-organisations/international-tax-for-business/in-detail/multinationals/global-and-domestic-minimum-tax/when-and-how-the-pillar-two-rules-apply,CLEANED,NO FILE,
2026-03-10,Providing work vehicles or other perks to staff?,https://www.ato.gov.au/businesses-and-organisations/small-business-newsroom/providing-work-vehicles-or-other-perks-to-staff,157.md,No,
2026-03-10,How we're engaging with new businesses,https://www.ato.gov.au/businesses-and-organisations/small-business-newsroom/how-we-re-engaging-with-new-businesses,CLEANED,NO FILE,
2026-03-12,Strengthening Australia’s digital capability: New EVP launched,https://www.dta.gov.au/media-releases/strengthening-australias-digital-capability-new-evp-launched,159.md,Yes,Consultation and Policy Design Opportunities
2026-03-11,New guidance to support AI project success,https://www.dta.gov.au/media-releases/new-guidance-support-ai-project-success,160.md,No,
2026-03-12,Applications open for Australian Taxation Office Evergreen Program 12 March 2026,https://www.indigenous.gov.au/news/applications-open-australian-taxation-office-evergreen-program,161.md,Yes,Funding and Grant Announcements
2026-03-12,Victorians to see new lower retail prices,https://theenergy.co/article/victorians-to-breathe-a-sigh-of-relief-with-new-lower-retail-prices,162.md,Yes,Legislative and Statutory Developments
2026-03-11,New grid access standards on the cards for data centres,https://theenergy.co/article/new-grid-access-standards-on-the-cards-for-data-centres,163.md,Yes,Consultation and Policy Design Opportunities
2026-03-11,"Why did petrol prices jump so fast last week? The answer lies in the black box of retail petrol pricing in Australia, with a dose of opportunism thrown in",https://theenergy.co/article/why-did-petrol-prices-jump-so-fast-last-week,164.md,Yes,"Reports, Data Releases, and Analytical Insights"
2026-03-10,"Back to the drawing board on consumer pricing What value does the consumer electricity market really offer? Until this question is truly addressed, any attempt at reform can only be piecemeal writes Ron Ben-David in this guest post",https://theenergy.co/article/back-to-the-drawing-board-on-consumer-pricing,165.md,Yes,Consultation and Policy Design Opportunities
2026-03-10,Progress in the face of adversity: Cali style,https://theenergy.co/article/progress-in-the-face-of-adversity-cali-style,166.md,Yes,Consultation and Policy Design Opportunities
2026-03-09,"How big can batteries get? Why safety, not chemistry, sets the limit",https://theenergy.co/article/how-big-can-batteries-get,167.md,Yes,Consultation and Policy Design Opportunities
2026-03-09,"Why data centre energy use is just scratching the surface AI expert Luis Gonzalez sees a future where energy equals intelligence, but if Australia is to be an AI hub without coal, our policy settings need to change",https://theenergy.co/article/why-data-centre-energy-use-is-just-scratching-the-surface,168.md,Yes,Consultation and Policy Design Opportunities
2026-03-06,Call for rethink on retail energy comparison tools,https://theenergy.co/article/call-for-rethink-on-retail-energy-comparison-tools,169.md,Yes,Funding and Grant Announcements
2026-03-11,Export Finance Australia supports exporters through financing for Rio Tinto's Rincón Lithium Project,https://www.exportfinance.gov.au/newsroom/export-finance-australia-supports-exporters-through-financing-for-rio-tintos-rincon-lithium-project/,170.md,Yes,Funding and Grant Announcements
2026-03-12,PM&C Capability Review Action Plan,https://www.pmc.gov.au/news/pmc-capability-review-action-plan,171.md,No,
2026-03-11,Australia’s delegation to the 70th Session of the Commission on the Status of Women,https://www.pmc.gov.au/news/australias-delegation-70th-session-commission-status-women,172.md,Yes,"Ministerial, Diplomatic, and International Engagements"
2026-03-10,Nominate an Australian public servant for the Public Service Medal,https://www.pmc.gov.au/news/nominate-australian-public-servant-public-service-medal-0,173.md,No,
2026-03-06,Status of Women Report Card,https://www.pmc.gov.au/news/status-women-report-card,174.md,Yes,"Reports, Data Releases, and Analytical Insights"
2026-03-10,Phenix Trading’s registration permanently suspended,https://cer.gov.au/news-and-media/news/2026/march/phenix-tradings-registration-permanently-suspended,175.md,Yes,"Compliance, Oversight, and Enforcement Actions"
2026-03-12,No More Hassles Getting Pre-Sale Building Inspections,https://www.premier.vic.gov.au/no-more-hassles-getting-pre-sale-building-inspections-0,176.md,Yes,Legislative and Statutory Developments
2026-03-12,A Bundle Of Free Support For New Parents And Carers,https://www.premier.vic.gov.au/bundle-free-support-new-parents-and-carers,177.md,Yes,Funding and Grant Announcements
2026-03-11,Support Available Now For Mortgage Stress In Victoria,https://www.premier.vic.gov.au/support-available-now-mortgage-stress-victoria,178.md,Yes,Funding and Grant Announcements
2026-03-11,Victoria Leads The Nation In Cardiac Survival,https://www.premier.vic.gov.au/victoria-leads-nation-cardiac-survival,179.md,Yes,"Reports, Data Releases, and Analytical Insights"
2026-03-10,Labor Backs Aboriginal Kinship To Close Health Gaps,https://www.premier.vic.gov.au/labor-backs-aboriginal-kinship-close-health-gaps,180.md,Yes,Funding and Grant Announcements
2026-03-10,New President To Lead State Library Victoria’s Next Era,https://www.premier.vic.gov.au/new-president-lead-state-library-victorias-next-era,181.md,Yes,"Ministerial, Diplomatic, and International Engagements"
2026-03-10,Grampians Peaks Trail Open To Hikers,https://www.premier.vic.gov.au/grampians-peaks-trail-open-hikers,182.md,Yes,"Infrastructure, Project Approvals, and EPBC Developments"
2026-03-10,Daily Fuel Price Cap Now In Place To Stop Price Gouging,https://www.premier.vic.gov.au/daily-fuel-price-cap-now-place-stop-price-gouging,183.md,Yes,Legislative and Statutory Developments
2026-03-10,Permanent Memorial For Workers Who Didn't Come Home,https://www.premier.vic.gov.au/permanent-memorial-workers-who-didnt-come-home,184.md,Yes,Funding and Grant Announcements
2026-03-10,Finding her power: Rosemary’s journey to a brighter future,https://www.dewr.gov.au/newsroom/articles/finding-her-power-rosemarys-journey-brighter-future,185.md,Yes,"Community, First Nations, and Social Licence Initiatives"
2026-03-12,Securing more fuel for Australia's regions,https://minister.dcceew.gov.au/bowen/media-releases/securing-more-fuel-australias-regions,186.md,Yes,Consultation and Policy Design Opportunities
2026-03-11,Joint media release: Fair go for consumers at the bowser,https://minister.dcceew.gov.au/bowen/media-releases/joint-media-release-fair-go-consumers-bowser,187.md,Yes,Consultation and Policy Design Opportunities
2026-03-11,NACC publishes investigation report into Robodebt referrals,https://www.nacc.gov.au/news-and-media/nacc-publishes-investigation-report-robodebt-referrals,188.md,Yes,"Compliance, Oversight, and Enforcement Actions"
2026-03-12,Rolling on with north central wheel cactus management,https://agriculture.vic.gov.au/about/media-centre/media-releases/2026-releases/rolling-on-with-north-central-wheel-cactus-management,189.md,Yes,"Environmental Protection, Biodiversity, and Nature Policy"
2026-03-11,Conditions are ideal for flystrike,https://agriculture.vic.gov.au/about/media-centre/media-releases/2026-releases/conditions-are-ideal-forflystrike,190.md,Yes,"Environmental Protection, Biodiversity, and Nature Policy"
2026-03-10,Victoria cracks down further on aquatic pests,https://agriculture.vic.gov.au/about/media-centre/media-releases/2026-releases/victoria-cracks-down-further-on-aquatic-pests,191.md,Yes,"Environmental Protection, Biodiversity, and Nature Policy"
2026-03-10,"End Scourge of Islamophobia, Respect Every Person’s Dignity ‘No Matter Their Faith’, Secretary-General Stresses in International Day Message",https://press.un.org/en/2026/sgsm23043.doc.htm,192.md,Yes,"Ministerial, Diplomatic, and International Engagements"
2026-03-10,"‘You Are Foundation-Shakers’, Secretary-General Tells Women Civil Society Leaders, Stresses ‘We Will Never Give Up’ on Gender Equality",https://press.un.org/en/2026/sgsm23042.doc.htm,193.md,Yes,"Ministerial, Diplomatic, and International Engagements"
2026-03-09,"Activities of Secretary-General in Switzerland, 22-23 February",https://press.un.org/en/2026/sgt3457.doc.htm,194.md,Yes,"Ministerial, Diplomatic, and International Engagements"
2026-03-09,Secretary-General Congratulates Colombian People for Peaceful Participation in Congressional Elections,https://press.un.org/en/2026/sgsm23041.doc.htm,195.md,No,
2026-03-09,"‘Justice for Women, Girls Must Be Cornerstone of World We Seek to Build,’ Says Secretary-General, Opening Commission on Status of Women",https://press.un.org/en/2026/sgsm23040.doc.htm,196.md,Yes,"Ministerial, Diplomatic, and International Engagements"
2026-03-06,"Secretary-General Condemns Incident in Southern Lebanon Injuring Peacekeepers, Urges De-Escalation",https://press.un.org/en/2026/sgsm23039.doc.htm,197.md,No,
2026-03-06,"Activities of Secretary-General in India, 18-22 February",https://press.un.org/en/2026/sgt3456.doc.htm,198.md,Yes,"Ministerial, Diplomatic, and International Engagements"
2026-03-06,"‘It’s Time to Change the World for Women, Girls’, says Secretary-General in International Day Video Message",https://press.un.org/en/2026/sgsm23038.doc.htm,199.md,Yes,"Ministerial, Diplomatic, and International Engagements"
2026-03-06,"Secretary-General Appoints Monica Kathina Juma of Kenya Executive Director, United Nations Office on Drugs and Crime, and Director-General, UN Office at Vienna",https://press.un.org/en/2026/sga2398.doc.htm,200.md,Yes,"Ministerial, Diplomatic, and International Engagements"
2026-03-06,"Stop Fighting, Get to Serious Diplomatic Negotiations on Middle East, Secretary-General Urges, Stressing ‘Stakes Could Not Be Higher’",https://press.un.org/en/2026/sgsm23037.doc.htm,201.md,No,
2026-03-06,NSW Government Gives $20 Million Boost to Innovative Small Business,https://www.chiefscientist.nsw.gov.au/news/nsw-government-gives-$20-million-boost-to-innovative-small-business,202.md,Yes,Funding and Grant Announcements
2026-03-09,Burroway Solar Farm approved,https://www.ipcn.nsw.gov.au/news/burroway-solar-farm-approved,203.md,Yes,"Infrastructure, Project Approvals, and EPBC Developments"
2026-03-12,Victorian regulator publishes draft default electricity price,https://www.esc.vic.gov.au/media-centre/victorian-regulator-publishes-draft-default-electricity-price,CLEANED,NO FILE,
2026-03-11,Designs for the reinstated Watsonia Station car park on exhibition now,https://bigbuild.vic.gov.au/news/roads/designs-for-the-reinstated-watsonia-station-car-park-on-exhibition-now,205.md,Yes,"Infrastructure, Project Approvals, and EPBC Developments"
2026-03-10,"International Women’s Day: Three pathways, one shared impact",https://bigbuild.vic.gov.au/news/victorias-big-build/international-womens-day-2026,206.md,Yes,"Infrastructure, Project Approvals, and EPBC Developments"
2026-03-10,Temporary closure of Bulleen Park’s AFL and cricket sporting ovals and pavilions to fast-track upgrades,https://bigbuild.vic.gov.au/news/north-east-link/temporary-closure-of-bulleen-parks-afl-and-cricket-sporting-ovals-to-fast-track-upgrades,207.md,No,
2026-03-06,Getting ready for Airport Rail,https://bigbuild.vic.gov.au/news/melbourne-airport-rail/getting-ready-for-airport-rail,208.md,No,
2026-03-06,Newport link road to open in April,https://bigbuild.vic.gov.au/news/level-crossing-removal-project/newport-link-road-to-open-in-april,209.md,Yes,"Infrastructure, Project Approvals, and EPBC Developments"
2026-03-11,Albanese Government backing cooperative research with $66 million in grant funding,https://www.minister.industry.gov.au/ministers/charlton/media-releases/albanese-government-backing-cooperative-research-66-million-grant-funding,CLEANED,NO FILE,
2026-03-11,Albanese Government backing cooperative research with $66 million in grant funding,https://www.minister.industry.gov.au/ministers/timayres/media-releases/albanese-government-backing-cooperative-research-66-million-grant-funding,211.md,Yes,Funding and Grant Announcements
2026-03-06,Australia and Canada partner on safe and trustworthy AI,https://www.minister.industry.gov.au/ministers/charlton/media-releases/australia-and-canada-partner-safe-and-trustworthy-ai,212.md,Yes,"Ministerial, Diplomatic, and International Engagements"
2026-03-06,Australia and Canada partner on safe and trustworthy AI,https://www.minister.industry.gov.au/ministers/timayres/media-releases/australia-and-canada-partner-safe-and-trustworthy-ai,CLEANED,NO FILE,
2026-03-06,Australia invests $53 million to help unlock the critical minerals of the future,https://www.minister.industry.gov.au/ministers/timayres/media-releases/australia-invests-53-million-help-unlock-critical-minerals-future,CLEANED,NO FILE,
2026-03-06,Australia invests $53 million to help unlock the critical minerals of the future,https://www.minister.industry.gov.au/ministers/king/media-releases/australia-invests-53-million-help-unlock-critical-minerals-future,215.md,Yes,Funding and Grant Announcements
2026-03-06,"Audits find State entities need to improve controls over portable assets to reduce the risk of items being misused, lost or stolen, and to strengthen cyber security measures",https://audit.wa.gov.au/wp-content/uploads/2026/03/Media-statement-Microsoft-365-and-Portable-Assets.pdf,CLEANED,NO FILE,
2026-03-10,Commission launches call for interest in the European Bioeconomy Investment Deployment Group,https://environment.ec.europa.eu/news/commission-launches-call-interest-european-bioeconomy-investment-deployment-group-2026-03-10_en,217.md,Yes,Funding and Grant Announcements
2026-03-09,Commission invests over €103 million in infrastructure projects,https://ec.europa.eu/commission/presscorner/detail/en/ip_26_542,CLEANED,NO FILE,
2026-03-09,Young Europeans deliver guidance to protect pollinators,https://environment.ec.europa.eu/news/young-europeans-deliver-guidance-protect-pollinators-2026-03-09_en,219.md,Yes,"Environmental Protection, Biodiversity, and Nature Policy"
2026-03-09,"How olive waste can benefit soils, provide energy and support a sustainable economy",https://environment.ec.europa.eu/news/how-olive-waste-can-benefit-soils-provide-energy-and-support-sustainable-economy-2026-03-09_en,220.md,Yes,"Environmental Protection, Biodiversity, and Nature Policy"
2026-03-09,"Restoring nature-rich landscapes around villages is a matter of social and environmental justice, researchers suggest",https://environment.ec.europa.eu/news/restoring-nature-rich-landscapes-around-villages-matter-social-and-environmental-justice-researchers-2026-03-09_en,221.md,Yes,"Environmental Protection, Biodiversity, and Nature Policy"
2026-03-09,Do nanoplastic particles make up the majority of North Atlantic plastic pollution?,https://environment.ec.europa.eu/news/do-nanoplastic-particles-make-majority-north-atlantic-plastic-pollution-2026-03-09_en,222.md,Yes,"Reports, Data Releases, and Analytical Insights"
2026-03-06,Commission strengthens framework for safe and sustainable chemicals and materials to drive Europe’s clean industrial leadership,https://research-and-innovation.ec.europa.eu/news/all-research-and-innovation-news/strengthened-framework-safe-and-sustainable-design-chemicals-and-materials-drive-europes-clean-2026-03-06_en,223.md,Yes,Legislative and Statutory Developments
2026-03-12,Bus drought for Western Sydney communities to end in July,https://www.nsw.gov.au/ministerial-releases/bus-drought-for-western-sydney-communities-to-end-july,224.md,Yes,"Infrastructure, Project Approvals, and EPBC Developments"
2026-03-12,Design team appointed for $20.2 million Forbes Hospital operating theatre upgrade,https://www.nsw.gov.au/ministerial-releases/design-team-appointed-for-202-million-forbes-hospital-operating-theatre-upgrade,225.md,Yes,"Infrastructure, Project Approvals, and EPBC Developments"
2026-03-12,$5 million Nowra Workplace Hub a boost to South Coast,https://www.nsw.gov.au/ministerial-releases/5-million-nowra-workplace-hub-a-boost-to-south-coast,226.md,Yes,"Infrastructure, Project Approvals, and EPBC Developments"
2026-03-12,55 new social homes on the way for Goulburn amid regional building blitz,https://www.nsw.gov.au/ministerial-releases/55-new-social-homes-on-way-for-goulburn-amid-regional-building-blitz,227.md,Yes,Funding and Grant Announcements
2026-03-12,"$800,000 Social Cohesion grants to strengthen local communities and combat hate",https://www.nsw.gov.au/ministerial-releases/800000-social-cohesion-grants-to-strengthen-local-communities-and-combat-hate,228.md,Yes,Funding and Grant Announcements
2026-03-12,Minns Government powers ahead on public preschool for Tenambit,https://www.nsw.gov.au/ministerial-releases/minns-government-powers-ahead-on-public-preschool-for-tenambit,229.md,Yes,"Infrastructure, Project Approvals, and EPBC Developments"
2026-03-12,Central Coast invited to Koolewong Rebuilding Session with architectural expert,https://www.nsw.gov.au/ministerial-releases/central-coast-invited-to-koolewong-rebuilding-session-architectural-expert,230.md,Yes,Consultation and Policy Design Opportunities
2026-03-12,Problematic plastic to be phased out,https://www.nsw.gov.au/ministerial-releases/problematic-plastic-to-be-phased-out,231.md,Yes,"Environmental Protection, Biodiversity, and Nature Policy"
2026-03-12,Griffith Base Hospital’s new carpark and main entry set to open,https://www.nsw.gov.au/ministerial-releases/griffith-base-hospitals-new-carpark-and-main-entry-set-to-open,232.md,Yes,"Infrastructure, Project Approvals, and EPBC Developments"
