Date,Title,URL,md_file,ESG_or_not,Story_Type
2026-03-11,New bendy buses boost capacity on Sydney’s busiest routes,https://www.nsw.gov.au/ministerial-releases/new-bendy-buses-boost-capacity-on-sydneys-busiest-routes,233.md,No,
2026-03-10,16 million boost to flood-proof Central Coast and Mid North Coast national park roads | Media release,https://www.environment.nsw.gov.au/news/16-million-boost-flood-proof-central-coast-mid-north-coast-national-park-roads,234.md,Yes,"Infrastructure, Project Approvals, and EPBC Developments"
2026-03-12,Building futures in Tasmania,https://www.premier.tas.gov.au/latest-news/2026/march/building-futures-in-tasmania,235.md,Yes,"Reports, Data Releases, and Analytical Insights"
2026-03-11,Tasmania leads the nation in business confidence and conditions,https://www.premier.tas.gov.au/latest-news/2026/march/tasmania-leads-the-nation-in-business-confidence-and-conditions,236.md,No,
2026-03-10,Test rig shows no need to jump at shadows,https://www.premier.tas.gov.au/latest-news/2026/march/test-rig-shows-no-need-to-jump-at-shadows,237.md,No,
2026-03-09,Legislation to secure the future of Savage River tabled,https://www.premier.tas.gov.au/latest-news/2026/march/legislation-to-secure-the-future-of-savage-river-tabled,238.md,Yes,Legislative and Statutory Developments
2026-03-09,Improvements underway following Independent Network Outage Review,https://www.premier.tas.gov.au/latest-news/2026/march/improvements-underway-following-independent-network-outage-review,239.md,Yes,"Infrastructure, Project Approvals, and EPBC Developments"
2026-03-09,Next steps for Wild Fallow Deer Management,https://www.premier.tas.gov.au/latest-news/2026/march/next-steps-for-wild-fallow-deer-management,240.md,Yes,Consultation and Policy Design Opportunities
2026-03-09,Helping Tasmanians to be work-ready,https://www.premier.tas.gov.au/latest-news/2026/march/helping-tasmanians-to-be-work-ready-,241.md,Yes,Funding and Grant Announcements
2026-03-09,Taking action to reform ‘good character’ references,https://www.premier.tas.gov.au/latest-news/2026/march/taking-action-to-reform-good-character-references,242.md,Yes,Legislative and Statutory Developments
2026-03-08,Seven hundred tonnes of gantry coming together,https://www.premier.tas.gov.au/latest-news/2026/march/seven-hundred-tonnes-of-gantry-coming-together,243.md,No,
2026-03-08,Agriculture Strategy consultation report released,https://www.premier.tas.gov.au/latest-news/2026/march/agriculture-strategy-consultation-report-released,244.md,Yes,Consultation and Policy Design Opportunities
2026-03-08,Growing local government collaboration,https://www.premier.tas.gov.au/latest-news/2026/march/growing-local-government-collaboration,245.md,Yes,Consultation and Policy Design Opportunities
2026-03-08,Granny flats to expand,https://www.premier.tas.gov.au/latest-news/2026/march/granny-flats-to-expand,246.md,Yes,Legislative and Statutory Developments
2026-03-12,ASIC disqualifies Simon Raftery from managing corporations for two and a half years,https://www.asic.gov.au/about-asic/news-centre/find-a-media-release/2026-releases/26-047mr-asic-disqualifies-simon-raftery-from-managing-corporations-for-two-and-a-half-years/,247.md,Yes,"Compliance, Oversight, and Enforcement Actions"
2026-03-11,Charges discontinued in Capital Mining Limited matter,https://www.asic.gov.au/about-asic/news-centre/find-a-media-release/2026-releases/26-046mr-charges-discontinued-in-capital-mining-limited-matter/,248.md,Yes,"Compliance, Oversight, and Enforcement Actions"
2026-03-11,Remedy Housing officers sentenced for dishonesty offences,https://www.asic.gov.au/about-asic/news-centre/find-a-media-release/2026-releases/26-045mr-remedy-housing-officers-sentenced-for-dishonesty-offences/,249.md,Yes,"Compliance, Oversight, and Enforcement Actions"
2026-03-10,ASIC bans former MWL Financial Services Adviser Raluca Terheci for a period of 6 years,https://www.asic.gov.au/about-asic/news-centre/find-a-media-release/2026-releases/26-044mr-asic-bans-former-mwl-financial-services-adviser-raluca-terheci-for-a-period-of-6-years/,250.md,Yes,"Compliance, Oversight, and Enforcement Actions"
2026-03-09,ASIC bans former credit and financial services representative Neil Andrew Cato for 5 years,https://www.asic.gov.au/about-asic/news-centre/find-a-media-release/2026-releases/26-043mr-asic-bans-former-credit-and-financial-services-representative-neil-andrew-cato-for-5-years/,251.md,Yes,"Compliance, Oversight, and Enforcement Actions"
2026-03-09,"Brisbane financial advisor and auditor, Sunny Prakash, charged with multiple counts of stealing and fraud",https://www.asic.gov.au/about-asic/news-centre/find-a-media-release/2026-releases/26-042mr-brisbane-financial-advisor-and-auditor-sunny-prakash-charged-with-multiple-counts-of-stealing-and-fraud/,252.md,Yes,"Compliance, Oversight, and Enforcement Actions"
2026-03-06,ASIC files Court action to wind up Liberty Bell Bay after failures to lodge financial reports,https://www.asic.gov.au/about-asic/news-centre/find-a-media-release/2026-releases/26-041mr-asic-files-court-action-to-wind-up-liberty-bell-bay-after-failures-to-lodge-financial-reports/,253.md,Yes,"Compliance, Oversight, and Enforcement Actions"
2026-03-06,Copernicus Climate’s ERA6 reanalysis production starts,https://climate.copernicus.eu/copernicus-climates-era6-reanalysis-production-starts,254.md,Yes,"Reports, Data Releases, and Analytical Insights"
2026-03-12,9th International Seminar on Biopolymers and Sustainable Composites: what was discussed!,https://circulareconomy.europa.eu/platform/en/news-and-events/all-news/9th-international-seminar-biopolymers-and-sustainable-composites-what-was-discussed,255.md,Yes,Consultation and Policy Design Opportunities
2026-03-11,Course for Circular Economy Transition Managers in the furniture sector: take part in the pilot phase!,https://circulareconomy.europa.eu/platform/en/news-and-events/all-news/course-circular-economy-transition-managers-furniture-sector-take-part-pilot-phase,256.md,Yes,Corporate and Institutional ESG Actions
2026-03-11,Commission launches call for expressions of interest in the European Bioeconomy Investment Deployment Group,https://circulareconomy.europa.eu/platform/en/news-and-events/all-news/commission-launches-call-expressions-interest-european-bioeconomy-investment-deployment-group,257.md,Yes,Funding and Grant Announcements
2026-03-11,Applications for the ECESP's 2026 annual conference networking village are now open!,https://circulareconomy.europa.eu/platform/en/news-and-events/all-news/applications-ecesps-2026-annual-conference-networking-village-are-now-open,258.md,Yes,Consultation and Policy Design Opportunities
2026-03-10,European Commission publishes the Industrial Accelerator Act,https://circulareconomy.europa.eu/platform/en/news-and-events/all-news/european-commission-publishes-industrial-accelerator-act,259.md,Yes,Legislative and Statutory Developments
2026-03-12,Pakistan: End-of-Mission Statement on the Third Review of the 37-month Extended Arrangement under the Extended Fund Facility (EFF) and the Second Review of 28-month Arrangement Under the Resilience and Sustainability Facility (RSF),https://www.imf.org/en/news/articles/2026/03/11/pr-26075-pakistan-end-of-mission-statement-3rd-rev-37mo-ext-arrang-eff-2nd-rev-28mo-arrang-rsf,260.md,Yes,"Reports, Data Releases, and Analytical Insights"
2026-03-11,Unleashing Europe’s Economic Potential,https://www.imf.org/en/news/articles/2026/03/11/sp031126-ak-ie-university-paris,261.md,Yes,Consultation and Policy Design Opportunities
2026-03-11,Enhancing South Africa’s Business Environment to Boost Growth and Create Jobs,https://www.imf.org/en/news/articles/2026/03/11/cf-south-africa-enhancing-south-africas-business-environment-to-boost-growth-and-create-jobs,262.md,Yes,Consultation and Policy Design Opportunities
2026-03-10,Costa Rica: Staff Concluding Statement of the 2026 Article IV Mission,https://www.imf.org/en/news/articles/2026/03/10/mcs-03102026-costa-rica-staff-concluding-statement-of-the-2026-article-iv-mission,263.md,No,
2026-03-10,Reforming under pressure Europe’s agenda for robust growth and higher productivity,https://www.imf.org/en/news/articles/2026/03/11/sp031026-ak-ie-university-madrid,264.md,Yes,Consultation and Policy Design Opportunities
2026-03-09,Principality of Andorra: Staff Concluding Statement of the 2026 Article IV Mission,https://www.imf.org/en/news/articles/2026/03/09/cs-principality-of-andorra-staff-concluding-statement-of-the-2026-article-iv-mission,265.md,Yes,"Reports, Data Releases, and Analytical Insights"
2026-03-09,Coping and Thriving in a Fluid World,https://www.imf.org/en/news/articles/2026/03/09/sp030926-coping-and-thriving-in-a-fluid-world,266.md,No,
2026-03-06,IMF Staff Concludes Visit to Gabon,https://www.imf.org/en/news/articles/2026/03/06/pr-26074-gabon-imf-staff-concludes-visit-to-gabon,267.md,Yes,"Ministerial, Diplomatic, and International Engagements"
2026-03-06,Meet the small businesses heading to the Australian Tourism Awards,https://business.vic.gov.au/news-and-updates/2026/meet-the-small-businesses-heading-to-the-australian-tourism-awards,268.md,No,
2026-03-12,Susie Kropman Joins the Blue Economy CRC,https://blueeconomycrc.com.au/susie-kropman-joins-the-blue-economy-crc/,269.md,Yes,Corporate and Institutional ESG Actions
2026-03-11,Blue Economy CRC Hosts European Union Economic and Trade Delegation,https://blueeconomycrc.com.au/eu-economic-and-trade-delegation/,CLEANED,NO FILE,
2026-03-11,Fair go for consumers at the bowser,https://ministers.treasury.gov.au/ministers/jim-chalmers-2022/media-releases/fair-go-consumers-bowser,CLEANED,NO FILE,
2026-03-10,The government’s super reforms pass the parliament,https://ministers.treasury.gov.au/ministers/jim-chalmers-2022/media-releases/governments-super-reforms-pass-parliament,CLEANED,NO FILE,
2026-03-10,Government another step closer to delivering super reforms,https://ministers.treasury.gov.au/ministers/jim-chalmers-2022/media-releases/government-another-step-closer-delivering-super-reforms,273.md,Yes,Legislative and Statutory Developments
