Date,Title,URL,md_file,ESG_or_not,Story_Type
2026-03-11,Overextraction is high priority for the resources regulator,https://resources.vic.gov.au/about-us/news/overextraction-is-high-priority-for-the-resources-regulator,1.md,Yes,"Compliance, Oversight, and Enforcement Actions"
2026-03-12,New package of support for parents,https://www.gov.scot/news/new-package-of-support-for-parents/,2.md,Yes,Consultation and Policy Design Opportunities
2026-03-12,Glasgow Union Corner Fire response,https://www.gov.scot/news/glasgow-union-corner-fire-response/,3.md,Yes,"Ministerial, Diplomatic, and International Engagements"
2026-03-12,Strengthening additional support for learning,https://www.gov.scot/news/strengthening-additional-support-for-learning/,4.md,Yes,Consultation and Policy Design Opportunities
2026-03-11,King's Baton Relay funding,https://www.gov.scot/news/kings-baton-relay-funding/,5.md,Yes,Funding and Grant Announcements
2026-03-11,Independent Commission on the Criminalisation of the Purchase of Sex,https://www.gov.scot/news/independent-commission-on-the-criminalisation-of-the-purchase-of-sex/,6.md,Yes,Consultation and Policy Design Opportunities
2026-03-11,Cancer patients to benefit from expanded Single Point of Contact support,https://www.gov.scot/news/cancer-patients-to-benefit-from-expanded-single-point-of-contact-support/,7.md,Yes,Funding and Grant Announcements
2026-03-11,Progress on salmon farming reforms,https://www.gov.scot/news/progress-on-salmon-farming-reforms/,8.md,Yes,"Environmental Protection, Biodiversity, and Nature Policy"
2026-03-10,Families freed from school meal debt,https://www.gov.scot/news/families-freed-from-school-meal-debt/,9.md,Yes,Funding and Grant Announcements
2026-03-10,Â£2.2 million boost for volunteering across Scotland,https://www.gov.scot/news/2-2-million-boost-for-volunteering-across-scotland/,10.md,Yes,Funding and Grant Announcements
2026-03-10,Next phase of alcohol and drugs response,https://www.gov.scot/news/next-phase-of-alcohol-and-drugs-response/,11.md,Yes,Consultation and Policy Design Opportunities
2026-03-11,East Arm businesses invited to Northern Marine Complex information session,https://nt.gov.au/news/2026/east-arm-businesses-invited-to-northern-marine-complex-information-session,12.md,No,
2026-03-11,Have your say: Review of the Associations Act 2003,https://nt.gov.au/news/2026/have-your-say-review-of-the-associations-act-2003,13.md,Yes,Consultation and Policy Design Opportunities
2026-03-12,AEMC proposes new grid standards for data centre connections,https://www.aemc.gov.au/news-centre/media-releases/aemc-proposes-new-grid-standards-data-centre-connections,14.md,Yes,Legislative and Statutory Developments
2026-03-11,Floating islands to prepare ACT for H5 bird flu,https://minister.agriculture.gov.au/collins/media-releases/floating-islands-prepare-act-h5-bird-flu,15.md,Yes,Funding and Grant Announcements
2026-03-10,Advisory Group supports development of mandatory winegrape purchases code,https://minister.agriculture.gov.au/collins/media-release/winegrape-advisory-group-supply-chain-2026,16.md,Yes,Consultation and Policy Design Opportunities
2026-03-06,Joint media release: H5 bird flu funding boost for Torres Strait,https://minister.agriculture.gov.au/collins/media-releases/h5-bird-flu-funding-for-torres-strait,17.md,Yes,Funding and Grant Announcements
2026-03-11,Smarter planning for animal disease threats,https://www.agriculture.gov.au/about/news/smarter-planning-disease-animal-threats,18.md,Yes,"Reports, Data Releases, and Analytical Insights"
2026-03-10,"Upcoming manual for general surveillance program design, monitoring and evaluation",https://www.agriculture.gov.au/about/news/general-surveillance-manual,19.md,No,
2026-03-08,Recognising Australia’s female farmers on International Women’s Day,https://www.agriculture.gov.au/about/news/IWD-2026,20.md,Yes,"Community, First Nations, and Social Licence Initiatives"
2026-03-10,More land rent relief for disaster affected leaseholders in North and Central Queensland,https://statements.qld.gov.au/statements/104685,21.md,Yes,State and Local Government Programs
2026-03-10,Advanced cancer treatment rolls out on the Sunshine Coast,https://statements.qld.gov.au/statements/104680,22.md,Yes,"Infrastructure, Project Approvals, and EPBC Developments"
2026-03-10,Atherton Courthouse upgrades to support and protect victims,https://statements.qld.gov.au/statements/104662,23.md,Yes,"Infrastructure, Project Approvals, and EPBC Developments"
2026-03-10,Gold Coast businesses up and racing to help deliver the 2032 Olympic and Paralympic Games,https://statements.qld.gov.au/statements/104672,24.md,No,
2026-03-10,New Exporter Academy unlocks global opportunities for Queensland business,https://statements.qld.gov.au/statements/104675,25.md,Yes,Funding and Grant Announcements
2026-03-10,Expressions of Interest open for Beams Road upgrade,https://statements.qld.gov.au/statements/104671,26.md,Yes,"Infrastructure, Project Approvals, and EPBC Developments"
2026-03-10,Next step to ease congestion in North Brisbane: Expressions of Interest open for major upgrade,https://statements.qld.gov.au/statements/104674,27.md,No,
2026-03-10,Kickstarting early intervention to keep Toowoomba youth out of crime,https://statements.qld.gov.au/statements/104667,28.md,Yes,Funding and Grant Announcements
2026-03-10,"Disaster hardship assistance for Bundaberg, Douglas and Banana",https://statements.qld.gov.au/statements/104677,29.md,Yes,Funding and Grant Announcements
2026-03-11,Targeted investment in women strengthens resources workforce,https://statements.qld.gov.au/statements/104664,30.md,Yes,Funding and Grant Announcements
2026-03-11,Regional funding boost for vital volunteers,https://statements.qld.gov.au/statements/104660,31.md,Yes,Funding and Grant Announcements
2026-03-11,Record approval allows Amazon to expand operations in South East Queensland,https://statements.qld.gov.au/statements/104666,32.md,No,
2026-03-11,March infringements package: key decisions on energy,https://energy.ec.europa.eu/news/march-infringements-package-key-decisions-energy-2026-03-11_en,33.md,Yes,"Compliance, Oversight, and Enforcement Actions"
2026-03-11,Commission approves €260 million Belgian State aid for carbon capture and storage project,https://ec.europa.eu/commission/presscorner/detail/en/ip_26_583,CLEANED,NO FILE,
2026-03-10,EU-Qatar: Meeting confirms ongoing energy cooperation,https://energy.ec.europa.eu/news/eu-qatar-meeting-confirms-ongoing-energy-cooperation-2026-03-10_en,35.md,Yes,"Ministerial, Diplomatic, and International Engagements"
2026-03-10,Eurostat: New release - Energy in Europe 2026 edition,https://ec.europa.eu/eurostat/web/products-eurostat-news/w/WDN-20260310-1,36.md,Yes,"Reports, Data Releases, and Analytical Insights"
2026-03-10,Commission launches strategy to accelerate clean energy investment,https://energy.ec.europa.eu/news/commission-launches-strategy-accelerate-clean-energy-investment-2026-03-10_en,37.md,Yes,Consultation and Policy Design Opportunities
2026-03-10,The Commission reaffirms its commitment to boost energy efficiency financing,https://energy.ec.europa.eu/news/commission-reaffirms-its-commitment-boost-energy-efficiency-financing-2026-03-10_en,38.md,Yes,Consultation and Policy Design Opportunities
2026-03-10,Commission unveils strategy to bring Europe’s first SMRs online by the early 2030s,https://energy.ec.europa.eu/news/commission-unveils-strategy-bring-europes-first-smrs-online-early-2030s-2026-03-10_en,39.md,Yes,Consultation and Policy Design Opportunities
2026-03-10,Commission presents measures to increase EU’s energy independence and affordability,https://ec.europa.eu/commission/presscorner/detail/en/ip_26_555,CLEANED,NO FILE,
2026-03-10,Commission to boost access to affordable and clean energy for all Europeans,https://energy.ec.europa.eu/news/commission-boost-access-affordable-and-clean-energy-all-europeans-2026-03-10_en,41.md,Yes,Consultation and Policy Design Opportunities
2026-03-10,Speech by President von der Leyen at the Nuclear Energy Summit,https://ec.europa.eu/commission/presscorner/detail/en/speech_26_581,CLEANED,NO FILE,
2026-03-10,Categorising income under AASB 18: Survey and virtual roundtable for private NFP entities and universities,https://aasb.gov.au/news/categorising-income-under-aasb-18-survey-and-virtual-roundtable-for-private-nfp-entities-and-universities/,CLEANED,NO FILE,
2026-03-06,AASB March Board Meeting Public Agenda and Papers out now,https://aasb.gov.au/news/aasb-march-board-meeting-public-agenda-and-papers-out-now/,44.md,Yes,Consultation and Policy Design Opportunities
2026-03-06,IMO Secretary-General: Seafarer deaths in Strait of Hormuz unacceptable,https://www.imo.org/en/MediaCentre/PressBriefings/pages/IMO-secretary-general-statement-strait-of-hormuz-seafarer-deaths-unacceptable.aspx,45.md,Yes,"Ministerial, Diplomatic, and International Engagements"
2026-03-11,Member State Audit Scheme moves toward a more dynamic second cycle,https://www.imo.org/en/MediaCentre/Pages/WhatsNew-2434.aspx,46.md,Yes,Consultation and Policy Design Opportunities
2026-03-06,First CBAM Certificate price to be published on 7 April,https://taxation-customs.ec.europa.eu/news/first-cbam-certificate-price-be-published-7-april-2026-03-06_en,47.md,Yes,"Environmental Protection, Biodiversity, and Nature Policy"
2026-03-09,World Wood Day 2026: Building Queensland’s future with sustainable timber,https://www.dpi.qld.gov.au/news-media/news/world-wood-day,48.md,Yes,Consultation and Policy Design Opportunities
2026-03-11,"Ahead of schedule: Governor Newsom’s Prop 1 is exceeding goals to expand capacity and treatment statewide, helping 5M+ Californians",https://www.gov.ca.gov/2026/03/11/ahead-of-schedule-governor-newsoms-prop-1-is-exceeding-goals-to-expand-capacity-and-treatment-statewide-helping-5m-californians/,49.md,Yes,Funding and Grant Announcements
2026-03-10,Governor Gavin Newsom & Attorney General Bonta: 37 Missing Children Found in Riverside County Operation,https://www.gov.ca.gov/2026/03/10/governor-gavin-newsom-attorney-general-bonta-37-missing-children-found-in-riverside-county-operation/,50.md,Yes,"Compliance, Oversight, and Enforcement Actions"
2026-03-12,"Governor Newsom announces more than $23 million to increase access to farm-fresh food for CalFresh, WIC, and Senior Farmers’ Market Nutrition Program recipients",https://www.gov.ca.gov/2026/03/12/governor-newsom-announces-more-than-23-million-to-increase-access-to-farm-fresh-food-for-calfresh-wic-and-senior-farmers-market-nutrition-program-recipients/,51.md,Yes,Funding and Grant Announcements
2026-03-10,Governor Newsom announces appointments 3.10.2026,https://www.gov.ca.gov/2026/03/10/governor-newsom-announces-appointments-3-10-2026/,52.md,Yes,"Ministerial, Diplomatic, and International Engagements"
2026-03-10,Governor Newsom proclaims AmeriCorps Week,https://www.gov.ca.gov/2026/03/10/governor-newsom-proclaims-americorps-week/,53.md,Yes,Parliamentary and Political Proceedings
2026-03-12,AFCA publishes updated Rules and Operational Guidelines,https://www.afca.org.au/news/latest-news/afca-publishes-updated-rules-and-operational-guidelines,54.md,Yes,Legislative and Statutory Developments
2026-03-10,New proximate cause e-learning module on AFCA website,https://www.afca.org.au/news/latest-news/new-proximate-cause-e-learning-module-on-afca-website,55.md,No,
2026-03-12,Astronaut to headline WA defence and security conference,https://www.wa.gov.au/government/media-statements/Cook%20Labor%20Government/Astronaut-to-headline-WA-defence-and-security-conference--20260312,56.md,No,
2026-03-12,New study highlights strong demand for Perth hotel market,https://www.wa.gov.au/government/media-statements/Cook%20Labor%20Government/New-study-highlights-strong-demand-for-Perth-hotel-market-20260312,57.md,No,
2026-03-12,Community grants to support grassroots conservation projects,https://www.wa.gov.au/government/media-statements/Cook%20Labor%20Government/Community-grants-to-support-grassroots-conservation-projects-20260312,58.md,Yes,Funding and Grant Announcements
2026-03-12,New tobacco laws pass Parliament,https://www.wa.gov.au/government/media-statements/Cook%20Labor%20Government/New-tobacco-laws-pass-Parliament-20260312,59.md,Yes,Legislative and Statutory Developments
2026-03-12,Stamp duty concessions to give more choice for home buyers,https://www.wa.gov.au/government/media-statements/Cook%20Labor%20Government/Stamp-duty-concessions-to-give-more-choice-for-home-buyers-20260312,60.md,No,
2026-03-12,Science students shine at Young Professionals in Agriculture Forum,https://www.wa.gov.au/government/media-statements/Cook%20Labor%20Government/Science-students-shine-at-Young-Professionals-in-Agriculture-Forum-20260312,61.md,No,
2026-03-12,New international partnership to strengthen AUKUS workforce,https://www.wa.gov.au/government/media-statements/Cook%20Labor%20Government/New-international-partnership-to-strengthen-AUKUS-workforce-20260312,62.md,No,
2026-03-12,Homes refurbished in Rockingham thanks to State Government grant,https://www.wa.gov.au/government/media-statements/Cook%20Labor%20Government/Homes-refurbished-in-Rockingham-thanks-to-State-Government-grant-20260312,63.md,Yes,Funding and Grant Announcements
2026-03-11,"Government, industry take steps to address fuel security concerns","https://www.wa.gov.au/government/media-statements/Cook%20Labor%20Government/Government,-industry-take-steps-to-address-fuel-security-concerns-20260311",64.md,Yes,Consultation and Policy Design Opportunities
2026-03-11,The Big Issue boosts job options for disadvantaged women,https://www.wa.gov.au/government/media-statements/Cook%20Labor%20Government/The-Big-Issue-boosts-job-options-for-disadvantaged-women--20260311,65.md,Yes,Funding and Grant Announcements
2026-03-11,Innovative program underway to steer children from crime,https://www.wa.gov.au/government/media-statements/Cook%20Labor%20Government/Innovative-program-underway-to-steer-children-from-crime--20260311,66.md,Yes,Funding and Grant Announcements
2026-03-10,Westport Authority to drive delivery of Kwinana's new container port,https://www.wa.gov.au/government/media-statements/Cook%20Labor%20Government/Westport-Authority-to-drive-delivery-of-Kwinana's-new-container-port--20260310,67.md,Yes,"Infrastructure, Project Approvals, and EPBC Developments"
2026-03-10,New Future Leaders cohort strengthens tourism workforce,https://www.wa.gov.au/government/media-statements/Cook%20Labor%20Government/New-Future-Leaders-cohort-strengthens-tourism-workforce-20260310,68.md,Yes,Funding and Grant Announcements
2026-03-10,WA leads national push for stronger eRideable laws,https://www.wa.gov.au/government/media-statements/Cook%20Labor%20Government/WA-leads-national-push-for-stronger-eRideable-laws-20260310,69.md,Yes,Consultation and Policy Design Opportunities
2026-03-10,Cook Government to convene Fuel Security Roundtable,https://www.wa.gov.au/government/media-statements/Cook%20Labor%20Government/Cook-Government-to-convene-Fuel-Security-Roundtable-20260310,70.md,Yes,Consultation and Policy Design Opportunities
2026-03-10,New facility provides major 'Uplyft' for early childhood services,https://www.wa.gov.au/government/media-statements/Cook%20Labor%20Government/New-facility-provides-major-'Uplyft'-for-early-childhood-services-20260310,71.md,Yes,"Infrastructure, Project Approvals, and EPBC Developments"
2026-03-10,Low-interest loans to provide affordable energy for manufacturers,https://www.wa.gov.au/government/media-statements/Cook%20Labor%20Government/Low-interest-loans-to-provide-affordable-energy-for-manufacturers-20260310,72.md,Yes,Funding and Grant Announcements
2026-03-10,WA innovators encouraged to apply as Innovation Booster Grants launch for 2026,https://www.wa.gov.au/government/media-statements/Cook%20Labor%20Government/WA-innovators-encouraged-to-apply-as-Innovation-Booster-Grants-launch-for-2026-20260310,73.md,Yes,Funding and Grant Announcements
2026-03-10,GreenTech Hub's first challenge Champions announced,https://www.wa.gov.au/government/media-statements/Cook%20Labor%20Government/GreenTech-Hub's-first-challenge-Champions-announced-20260310,74.md,Yes,Funding and Grant Announcements
2026-03-09,WA shines on screens as Home and Away special event airs,https://www.wa.gov.au/government/media-statements/Cook%20Labor%20Government/WA-shines-on-screens-as-Home-and-Away-special-event-airs-20260309,75.md,Yes,Funding and Grant Announcements
2026-03-09,Recognising women’s leadership in climate action and gender equality,https://www.greenclimate.fund/story/recognising-women-s-leadership-climate-action-and-gender-equality,76.md,Yes,"Environmental Protection, Biodiversity, and Nature Policy"
2026-03-06,Package travel: Parliament greenlights new rules to protect holidaymakers,https://www.europarl.europa.eu/news/en/press-room/20260306IPR37536/package-travel-parliament-greenlights-new-rules-to-protect-holidaymakers,77.md,Yes,Legislative and Statutory Developments
2026-03-06,"Human rights violations in Russia, Niger and Georgia",https://www.europarl.europa.eu/news/en/press-room/20260306IPR37537/human-rights-violations-in-russia-niger-and-georgia,78.md,Yes,Parliamentary and Political Proceedings
2026-03-12,EP TODAY,https://www.europarl.europa.eu/news/en/press-room/20260306IPR37516/ep-today,79.md,Yes,Legislative and Statutory Developments
2026-03-11,Stronger EU-Canada partnership amid global turmoil,https://www.europarl.europa.eu/news/en/press-room/20260306IPR37533/stronger-eu-canada-partnership-amid-global-turmoil,80.md,No,
2026-03-11,Armenia’s Prime Minister Nikol Pashinyan addresses MEPs on peace efforts with Azerbaijan,https://www.europarl.europa.eu/news/en/press-room/20260306IPR37529/prime-minister-nikol-pashinyan-addresses-meps-on-peace-efforts-with-azerbaijan,81.md,No,
2026-03-11,EU enlargement: a strategic investment in Europe’s security and stability,https://www.europarl.europa.eu/news/en/press-room/20260306IPR37532/eu-enlargement-a-strategic-investment-in-europe-s-security-and-stability,82.md,No,
2026-03-11,MEPs call for common defence market and action on flagship EU defence projects,https://www.europarl.europa.eu/news/en/press-room/20260306IPR37534/meps-call-for-common-defence-market-and-action-on-flagship-eu-defence-projects,83.md,No,
2026-03-11,"Parliament’s economic, employment and social priorities for 2026",https://www.europarl.europa.eu/news/en/press-room/20260306IPR37530/parliament-s-economic-employment-and-social-priorities-for-2026,84.md,Yes,Parliamentary and Political Proceedings
2026-03-11,MEPs demand action plan to eradicate the gender pay and pension gaps,https://www.europarl.europa.eu/news/en/press-room/20260306IPR37526/meps-demand-action-plan-to-eradicate-the-gender-pay-and-pension-gaps,85.md,Yes,Parliamentary and Political Proceedings
2026-03-11,Child sexual abuse online: support for extending voluntary rules until August 2027,https://www.europarl.europa.eu/news/en/press-room/20260306IPR37531/child-sexual-abuse-online-support-for-extending-rules-until-august-2027,86.md,Yes,Legislative and Statutory Developments
2026-03-11,€1.6 million in EU support to help Belgian workers,https://www.europarl.europa.eu/news/en/press-room/20260306IPR37510/EU1-6-million-in-eu-support-to-help-belgian-workers,87.md,Yes,Funding and Grant Announcements
2026-03-11,A new agreement for relations between Parliament and the Commission,https://www.europarl.europa.eu/news/en/press-room/20260306IPR37528/a-new-agreement-for-relations-between-parliament-and-the-commission,88.md,Yes,Parliamentary and Political Proceedings
2026-03-11,Simplified rules for small “mid-cap” companies,https://www.europarl.europa.eu/news/en/press-room/20260220IPR35906/simplified-rules-for-small-mid-cap-companies,89.md,Yes,Legislative and Statutory Developments
2026-03-11,EP TODAY,https://www.europarl.europa.eu/news/en/press-room/20260306IPR37515/ep-today,90.md,No,
2026-03-10,International Women’s Day: call to act against cyberbullying,https://www.europarl.europa.eu/news/en/press-room/20260306IPR37521/international-women-s-day-call-to-act-against-cyberbullying,91.md,Yes,Legislative and Statutory Developments
2026-03-12,In memoriam: Prof. Marie-Teres Albert,https://whc.unesco.org/en/news/2876,92.md,Yes,"Ministerial, Diplomatic, and International Engagements"
2026-03-09,Asia and the Pacific countries meet to discuss the implementation of the World Heritage Regional Framework Action Plan,https://whc.unesco.org/en/news/2872,93.md,Yes,Consultation and Policy Design Opportunities
2026-03-12,Northern Tablelands Aboriginal communities join the fight to save endangered Bell’s turtles,https://www.nsw.gov.au/departments-and-agencies/local-land-services/news/northern-tablelands-aboriginal-communities-join-fight-to-save-endangered-bells-turtles,94.md,Yes,"Environmental Protection, Biodiversity, and Nature Policy"
2026-03-11,Boosting farm productivity and resilience in western NSW,https://www.nsw.gov.au/departments-and-agencies/local-land-services/news/boosting-farm-productivity-and-resilience-western-nsw,95.md,Yes,Funding and Grant Announcements
2026-03-10,Consider early weaning to maintain stock condition during drought and dry times,https://www.nsw.gov.au/departments-and-agencies/local-land-services/news/consider-early-weaning-to-maintain-stock-condition-during-drought-and-dry-times,96.md,Yes,Funding and Grant Announcements
2026-03-12,Rodents removed from remote turtle nesting refuge,https://www2.gbrmpa.gov.au/news/rodents-removed-from-remote-turtle-nesting-refuge,97.md,Yes,"Environmental Protection, Biodiversity, and Nature Policy"
2026-03-09,$1.5 billion Future Made in Australia Fund opens new opportunities for regional NSW businesses,https://www.investregional.nsw.gov.au/news/15-billion-future-made-australia-fund-opens-new-opportunities-regional-nsw-businesses,98.md,Yes,Funding and Grant Announcements
2026-03-09,$52 million investment to accelerate renewable manufacturing across regional NSW,https://www.investregional.nsw.gov.au/news/52-million-investment-accelerate-renewable-manufacturing-across-regional-nsw,99.md,Yes,Funding and Grant Announcements
2026-03-12,1 in 7 Australians experienced personal fraud,https://www.abs.gov.au/media-centre/media-releases/1-7-australians-experienced-personal-fraud,100.md,No,
2026-03-10,Total Value of Dwellings Reaches $12 Trillion,https://www.abs.gov.au/media-centre/media-releases/total-value-dwellings-reaches-12-trillion,101.md,No,
2026-03-06,15 million people employed in December 2025,https://www.abs.gov.au/media-centre/media-releases/15-million-people-employed-december-2025,102.md,Yes,"Reports, Data Releases, and Analytical Insights"
2026-03-12,Open call: UNCCD COP17 media reporting fellowship,https://www.unccd.int/news-stories/stories/open-call-unccd-cop17-media-reporting-fellowship,103.md,Yes,Funding and Grant Announcements
2026-03-12,Over one billion people worldwide lack secure land rights,https://www.unccd.int/news-stories/stories/over-one-billion-people-worldwide-lack-secure-land-rights,104.md,Yes,"Reports, Data Releases, and Analytical Insights"
2026-03-06,"Women on the front line, communities in the lead: drought resilience takes root in Southern Africa",https://www.unccd.int/news-stories/stories/women-front-line-communities-lead-drought-resilience-takes-root-southern,105.md,Yes,Consultation and Policy Design Opportunities
2026-03-10,"Renewable energy is the ""fastest path to energy security, economic security, and national security"": UN Secretary-General",https://unfccc.int/news/renewable-energy-is-the-fastest-path-to-energy-security-economic-security-and-national-security-un,106.md,Yes,"Environmental Protection, Biodiversity, and Nature Policy"
2026-03-09,Innovative green hydrogen and ammonia project to cut emissions for Moree farms,https://www.planning.nsw.gov.au/news/innovative-green-hydrogen-and-ammonia-project-cut-emissions-moree-farms,107.md,Yes,"Infrastructure, Project Approvals, and EPBC Developments"
2026-03-12,International researchers overturn assumptions about the structure of most widely used hydrogel,https://www.ansto.gov.au/news/international-researchers-overturn-assumptions-about-structure-of-most-widely-used-hydrogel,108.md,No,
2026-03-10,Research collaborator earns distinguished scholarship for work on ultra-low friction materials,https://www.ansto.gov.au/news/research-collaborator-earns-distinguished-scholarship-for-work-on-ultra-low-friction-materials,109.md,Yes,Funding and Grant Announcements
2026-03-09,Built on their foundations: the women whose work shaped science at ANSTO,https://www.ansto.gov.au/news/built-on-their-foundations-women-whose-work-shaped-science-at-ansto,110.md,Yes,"Reports, Data Releases, and Analytical Insights"
2026-03-10,Response to the Jobs and Skills Australia Act (2022) Review,https://www.jobsandskills.gov.au/news/response-jobs-and-skills-australia-act-2022-review,111.md,Yes,Parliamentary and Political Proceedings
2026-03-10,Alpha HPA First Project Case Study,https://www.naif.gov.au/media-centre/alpha-hpa-first-project-case-study/,CLEANED,NO FILE,
2026-03-10,Kimberley Cotton Gin Case Study,https://www.naif.gov.au/media-centre/kimberley-cotton-gin-case-study/,113.md,Yes,Legislative and Statutory Developments
2026-03-12,Restoring wetlands to protect shorebirds,https://www.dcceew.gov.au/about/news/restoring-wetlands-protect-shorebirds,114.md,Yes,Funding and Grant Announcements
2026-03-10,IWC seeks research on offshore renewables and whales,https://www.dcceew.gov.au/about/news/iwc-seeks-research-offshore-renewables-whales,115.md,Yes,Funding and Grant Announcements
2026-03-10,In focus: National Groundwater Awareness Week,https://www.dcceew.gov.au/about/news/in-focus-national-groundwater-awareness-week,116.md,Yes,"Environmental Protection, Biodiversity, and Nature Policy"
