Date,Title,URL,md_file,ESG_or_not,Story_Type,Jurisdiction,ESG Summary
2026-03-05,Construction kicks off on massive Lennox Head Public School and preschool upgrade,https://www.nsw.gov.au/ministerial-releases/construction-kicks-off-on-massive-lennox-head-public-school-and-preschool-upgrade,270.md,Yes,Funding and Grant Announcements,NSW,"The Minns Labor Government’s $9 billion investment in NSW school infrastructure, including regional upgrades like Lennox Head Public School, reflects a focus on social equity and community development. The expansion aims to improve educational access, facilities, and early learning opportunities, supporting social inclusion and regional growth. Rebuilding the teaching workforce through wage increases and workload policies addresses governance and operational risks. Additionally, dedicated Indigenous student spaces at TAFE NSW and the rollout of gifted education programs demonstrate commitments to social equity and inclusive education, aligning with broader ESG goals of stakeholder engagement and community well-being."
2026-03-05,Next stage of $36 million Snowy Mountains Highway safety upgrades getting underway,https://www.nsw.gov.au/ministerial-releases/next-stage-of-36-million-snowy-mountains-highway-safety-upgrades-getting-underway,271.md,Yes,Funding and Grant Announcements,NSW,"The Minns and Albanese governments' $36 million investment in Snowy Mountains Highway safety upgrades aims to reduce road trauma and improve regional infrastructure, highlighting a focus on social and governance factors. The project includes installing safety barriers, rumble strips, and widening centrelines, which can enhance road safety and community well-being. Additionally, the deployment of laser devices for overhead wiring inspections and community consultation on accessibility upgrades at train stations reflect efforts to improve public transport safety, accessibility, and operational reliability, addressing stakeholder needs and regulatory compliance in regional transport infrastructure."
2026-03-05,"NSW Women of the Year: Leadership, courage and community shine",https://www.nsw.gov.au/ministerial-releases/nsw-women-of-year-leadership-courage-and-community-shine,272.md,No,,,
2026-03-05,Students out of demountables and into permanent classrooms as major upgrade delivered in Schofields,https://www.nsw.gov.au/ministerial-releases/students-out-of-demountables-and-into-permanent-classrooms-as-major-upgrade-delivered-schofields,273.md,Yes,"Infrastructure, Project Approvals, and EPBC Developments",NSW,"The NSW government’s school infrastructure upgrades, including replacing demountables with permanent classrooms, demonstrate a focus on social equity by improving educational facilities and outdoor spaces in high-growth areas. The development of the Hydrogen Centre of Excellence aligns with environmental goals by supporting renewable energy and hydrogen industry growth, potentially reducing carbon emissions. These initiatives reflect governance efforts to address infrastructure deficits, enhance community well-being, and support a transition to cleaner energy sources, with implications for stakeholder engagement, regulatory compliance, and long-term sustainability in education and energy sectors."
2026-03-05,Government moves to make feral pig and deer management bigger and better as nearly 250k pigs culled over past three years,https://www.nsw.gov.au/ministerial-releases/government-moves-to-make-feral-pig-and-deer-management-bigger-and-better-as-nearly-250k-pigs-culled-over-past-three-years,274.md,Yes,Funding and Grant Announcements,NSW,"The NSW Government’s $40 million biosecurity program aims to control feral pig and deer populations, supporting primary industries valued at $25 billion and emphasizing landholder participation through aerial culling, baiting, and trapping. The appointment of an independent biosecurity reviewer highlights efforts to improve regional pest management tools and techniques, including emerging technologies, to enhance environmental and economic resilience. These measures address ecological risks, protect agricultural productivity, and promote stakeholder collaboration, reflecting a focus on sustainable land management and biosecurity governance with significant implications for environmental health, industry stability, and community engagement."
2026-03-05,Regional NSW Ambulance staff recognised for outstanding service and bravery,https://www.nsw.gov.au/ministerial-releases/nsw-ambulance-staff-outstanding-service-and-bravery,275.md,Yes,Funding and Grant Announcements,NSW,"The NSW government’s investment in emergency health services, including record paramedic pay increases, regional deployment, and funding for infrastructure, reflects a focus on improving healthcare access and workforce resilience. Recognition of frontline staff and community bravery highlights social commitment to public health and safety. The expansion of urgent care facilities and temporary ambulance sites aims to enhance service delivery and reduce emergency department wait times, addressing operational and access-related ESG concerns. These initiatives demonstrate efforts to strengthen healthcare infrastructure, workforce well-being, and community safety, with potential implications for regulatory compliance and stakeholder trust."
2026-03-05,"More than 8,400 visits to Gregory Hills Urgent Care Service",https://www.nsw.gov.au/ministerial-releases/more-than-8400-visits-to-gregory-hills-urgent-care-service,276.md,No,,,
2026-03-05,A laser focus on rail reliability as hand-held wire check tech is deployed,https://www.nsw.gov.au/ministerial-releases/a-laser-focus-on-rail-reliability-as-hand-held-wire-check-tech-deployed,277.md,Yes,Corporate and Institutional ESG Actions,NSW,"The NSW government’s $423.4 million rail asset renewal and safety upgrades, including new laser wire-checking devices, aim to improve infrastructure reliability and safety following the 2025 overhead wiring failure. The deployment of advanced inspection technology enhances maintenance accuracy, reduces operational risks, and supports proactive asset management, addressing regulatory and safety concerns. These initiatives reflect a focus on infrastructure resilience, operational safety, and stakeholder confidence, with implications for compliance, risk mitigation, and long-term sustainability of the rail network. The investments demonstrate a commitment to improving public transport safety and reliability through technological innovation and infrastructure renewal."
2026-03-04,New temporary ambulance station opens at Smeaton Grange,https://www.nsw.gov.au/ministerial-releases/new-temporary-ambulance-station-opens-at-smeaton-grange,278.md,Yes,"Infrastructure, Project Approvals, and EPBC Developments",NSW,"The NSW Government's infrastructure investments, including the $615.5 million Ambulance Infrastructure Program and new ambulance stations, aim to enhance emergency healthcare capacity in Sydney and regional areas, reflecting a focus on healthcare accessibility and community resilience. The temporary ambulance site at Smeaton Grange supports workforce expansion through the SWIFT program, which adds 2,500 staff, including 500 paramedics to rural and regional communities, addressing operational and staffing risks. These initiatives demonstrate a commitment to improving healthcare infrastructure and workforce sustainability, with potential implications for operational efficiency, community health outcomes, and stakeholder trust."
2026-03-04,"Safer, more accessible transport on track for Canberra and Yass: Designs revealed for station upgrades",https://www.nsw.gov.au/ministerial-releases/safer-more-accessible-transport-on-track-for-canberra-and-yass-designs-revealed-for-station-upgrades,279.md,Yes,"Community, First Nations, and Social Licence Initiatives",NSW,"The Minns Labor Government’s $800 million Safe Accessible Transport program aims to enhance public transport accessibility and safety at Canberra and Yass Junction stations, aligning with Disability Standards for Accessible Public Transport. The initiative emphasizes stakeholder engagement, including input from disability organizations, to improve inclusivity for vulnerable groups such as people with disabilities, older adults, and those with mobility challenges. These upgrades may reduce social exclusion and promote equitable access, but also involve significant public investment and regulatory compliance, highlighting the importance of transparent planning and community consultation in infrastructure projects with social and governance implications."
2026-02-27,New insights for addressing childhood disadvantage,https://www.abs.gov.au/media-centre/media-releases/new-insights-addressing-childhood-disadvantage,28.md,No,,,
2026-03-05,Celebrate 50 Years of Werrikimbe National Park at Mooraback Cabin | Media release,https://www.environment.nsw.gov.au/news/celebrate-50-years-werrikimbe-national-park-mooraback-cabin,280.md,Yes,"Environmental Protection, Biodiversity, and Nature Policy",International,"The celebration of Werrikimbe National Park’s 50th anniversary highlights its ecological significance, including over 20 threatened species and rare populations like the rufous scrub-bird, emphasizing the importance of biodiversity conservation. The park’s status as a World Heritage-listed site underscores regulatory and governance responsibilities for protecting its natural and cultural heritage. Increased visitor activity for the event may raise concerns about environmental impact and the need for sustainable tourism practices. The event reinforces stakeholder engagement and public awareness of conservation efforts, which are critical for maintaining ecological integrity and complying with environmental regulations."
2026-02-28,"From bush to the city, NPWS Rainbow Lyrebirds step out at Mardi Gras for first time | Media release",https://www.environment.nsw.gov.au/news/npws-rainbow-lyrebirds-step-out-mardi-gras-first-time,281.md,Yes,Corporate and Institutional ESG Actions,NSW,"The NSW National Parks and Wildlife Service's (NPWS) participation in the 2026 Sydney Gay and Lesbian Mardi Gras highlights its commitment to diversity, equity, and inclusion (DEI), promoting an inclusive workplace environment. The initiative, including the LGBTQIA+ employee network and visibility efforts, aligns with ESG principles by fostering social responsibility and stakeholder engagement. Such actions can enhance organizational reputation, support employee well-being, and meet evolving stakeholder expectations for diversity and inclusion. However, it also underscores the importance of ongoing DEI initiatives as part of broader ESG strategies to mitigate social risks and demonstrate corporate governance in promoting workplace equality."
2026-02-27,NSW Threatened Species Scientific Committee final determinations for February 2026 | News,https://www.environment.nsw.gov.au/news/nsw-threatened-species-scientific-committee-final-determinations-february-2026-news,282.md,No,,,
2026-03-04,How the SBTi is meeting India’s corporate climate momentum,https://sciencebasedtargets.org/blog/how-the-sbti-is-meeting-indias-corporate-climate-momentum,283.md,Yes,Corporate and Institutional ESG Actions,International,"India’s growing commitment to science-based climate targets, with 445 companies adopting or planning to adopt such goals, highlights increased corporate focus on climate risk management and transition planning. Large Indian conglomerates face operational challenges in reducing Scope 3 emissions across complex supply chains, emphasizing the need for credible, globally recognized frameworks like the SBTi’s updated Corporate Net-Zero Standard. This shift reflects a broader move toward embedding climate considerations into business strategy, procurement, and investment decisions, with implications for regulatory compliance, investor confidence, and supply chain resilience in a rapidly expanding, high-growth economy."
2026-03-05,Proposed rules to protect life support customers during outages and extreme weather events,https://www.esc.vic.gov.au/media-centre/proposed-rules-protect-life-support-customers-during-outages-and-extreme-weather-events,284.md,No,,,
2026-03-03,VIDEO: How is the EU fighting illegal trade in European eel?,https://environment.ec.europa.eu/news/video-how-eu-fighting-illegal-trade-european-eel-2026-03-03_en,285.md,Yes,"Compliance, Oversight, and Enforcement Actions",International,"The illegal trafficking of European eels, a critically endangered species, poses significant environmental and regulatory risks, with EU efforts focused on strengthening enforcement, international cooperation, and traceability to combat wildlife crime. The trade generates billions of euros, highlighting substantial financial and reputational risks for businesses involved in supply chains linked to illegal eel products. EU policies, including the Wildlife Trade Regulations and Eel Regulation, aim to mitigate these risks through enhanced compliance and enforcement. Consumer campaigns and international cooperation are critical to reducing demand and illegal trade, aligning with broader biodiversity and sustainability commitments."
2026-03-03,PRACTICAL SUPPORT - Continued collaboration on wolf impact on small scale extensive livestock | Italy,https://environment.ec.europa.eu/news/practical-support-continued-collaboration-wolf-impact-small-scale-extensive-livestock-italy-2026-03-03_en,286.md,Yes,"Community, First Nations, and Social Licence Initiatives",International,"The LIFE MEDWOLF project in Italy exemplifies a collaborative approach to managing human-wildlife conflict, emphasizing stakeholder engagement, coexistence strategies, and evidence-based measures such as fencing and livestock guarding dogs. These initiatives aim to reduce depredation impacts, improve farmer livelihoods, and foster sustainable coexistence with large carnivores, aligning with environmental conservation and social resilience goals. The project’s funding, stakeholder networks, and promotion of best practices highlight governance and financial sustainability considerations, with potential implications for regulatory frameworks, stakeholder trust, and long-term ecosystem management in regions facing similar conflicts."
2026-02-27,New EU ship recycling list includes first German facility,https://environment.ec.europa.eu/news/new-eu-ship-recycling-list-includes-first-german-facility-2026-02-27_en,287.md,Yes,"Compliance, Oversight, and Enforcement Actions",International,"The European Commission’s update to the Ship Recycling Regulation emphasizes stricter environmental, safety, and labor standards for facilities handling EU-flagged vessels, aiming to reduce pollution and protect workers. Inclusion on the European List ensures compliance with these standards, supporting sustainable resource recovery and circular economy goals. The regulation restricts EU ships to use approved facilities, potentially increasing operational costs for shipowners and encouraging the transition to safer, more sustainable recycling practices. Non-compliance, as seen with some facilities, poses legal and reputational risks, highlighting the importance of regulatory adherence in mitigating environmental and social risks in the maritime sector."
2026-03-05,FRANCESCA: seeking your views on circular solutions for the furniture industry!,https://circulareconomy.europa.eu/platform/en/news-and-events/all-news/francesca-seeking-your-views-circular-solutions-furniture-industry,288.md,Yes,Consultation and Policy Design Opportunities,International,"The EU-funded FRANCESCA project aims to enhance circular design and business models in the furniture sector, emphasizing waste management and the use of secondary raw materials. By promoting circular economy practices across the entire furniture lifecycle, the initiative addresses environmental sustainability and resource efficiency. The project’s focus on developing tools and models to support reuse, refurbishment, and recycling aligns with regulatory pressures for sustainable production and waste reduction. Engaging industry stakeholders through surveys highlights the importance of compliance, innovation, and transparency in meeting evolving ESG standards and reducing environmental impact within the sector."
2026-03-04,Circular bioeconomy: a report on scaling up bio-based industries,https://circulareconomy.europa.eu/platform/en/news-and-events/all-news/circular-bioeconomy-report-scaling-bio-based-industries,289.md,Yes,Funding and Grant Announcements,International,"The European Commission emphasizes scaling up bio-based industries within the circular bioeconomy to enhance strategic autonomy, competitiveness, and job creation, highlighting significant ESG implications. The focus on bio-based materials, innovative food ingredients, and soil nutrients aligns with environmental sustainability goals by promoting resource efficiency and waste reduction. Policy recommendations include leveraging funding mechanisms like grants and high-risk investment funds to support early-stage ventures, which could influence regulatory frameworks and investor risk profiles. These initiatives reflect a strategic shift towards sustainable resource use, with potential impacts on environmental performance, innovation, and stakeholder expectations for responsible bioeconomy development."
2026-03-05,AEMC proposes improvements to life support customer processes,https://www.aemc.gov.au/news-centre/media-releases/aemc-proposes-improvements-life-support-customer-processes,29.md,Yes,"Compliance, Oversight, and Enforcement Actions",National,"The AEMC's draft rule enhances protections for vulnerable energy consumers requiring life support, emphasizing safety, communication, and operational efficiency. Key ESG implications include improved stakeholder communication, streamlined registration processes, and increased transparency for energy providers and regulators. The proposal also recommends establishing a central register to support emergency response and facilitate customer mobility, addressing social equity and operational resilience. These measures aim to reduce risks associated with unplanned outages and disconnections, while ensuring compliance with safety standards and protecting vulnerable populations, aligning with broader social and governance objectives in the energy sector."
2026-03-03,Assessing the climate mitigation potential of circular economy,https://circulareconomy.europa.eu/platform/en/news-and-events/all-news/assessing-climate-mitigation-potential-circular-economy,290.md,Yes,"Reports, Data Releases, and Analytical Insights",International,"The European Environment Agency's briefing underscores the critical role of the circular economy in climate change mitigation, aligning with EU policies like the 2025 Clean Industrial Deal and the Circular Economy Action Plan. It highlights the potential for circular approaches to reduce GHG emissions but notes significant variability in research findings regarding mitigation effectiveness. This variability presents regulatory and stakeholder challenges for businesses, emphasizing the need for clearer guidance and standardized metrics to support compliance, investment decisions, and reputational management in transitioning towards sustainable, circular models. The findings have implications for policy development, corporate strategy, and investor risk assessment related to climate and sustainability commitments."
2026-03-02,Applications for EU Green Week 2026 partner events are now open!,https://circulareconomy.europa.eu/platform/en/news-and-events/all-news/applications-eu-green-week-2026-partner-events-are-now-open,291.md,Yes,"Environmental Protection, Biodiversity, and Nature Policy",International,"The upcoming EU Green Week in June 2026 will focus on investing in nature, emphasizing the integration of biodiversity protection, habitat restoration, and sustainable resource management into business practices. The event promotes nature-based solutions and links the circular economy to environmental sustainability, highlighting opportunities for companies to reduce waste and pollution while supporting biodiversity. This initiative signals increased regulatory and stakeholder pressure for organizations to adopt environmentally responsible strategies, enhance transparency around ecological impacts, and align with EU policies on biodiversity and resource efficiency, potentially affecting compliance requirements and investment risk profiles."
2026-03-02,A vibrant new chapter for Victoria’s Multicultural Business Precincts,https://business.vic.gov.au/news-and-updates/2026/a-vibrant-new-chapter-for-victorias-multicultural-business-precincts,292.md,Yes,"Community, First Nations, and Social Licence Initiatives",Victoria,"The Victoria government’s Multicultural Business Precinct Revitalisation Program aims to enhance social cohesion and community well-being by upgrading multicultural precincts through lighting, public art, and community spaces. These initiatives promote cultural inclusivity, safety, and local economic development, supporting small businesses and fostering social integration. While primarily social and community-focused, the program may influence stakeholder perceptions and reputational standing by demonstrating commitment to multiculturalism and urban renewal. Such investments can also contribute to local economic resilience, aligning with broader social sustainability goals and potentially attracting responsible investment in diverse, vibrant neighborhoods."
2026-03-05,Consultation begins on options to stop family violence perpetrators accessing their victims’ super after death,https://ministers.treasury.gov.au/ministers/daniel-mulino-2025/media-releases/consultation-begins-options-stop-family-violence,293.md,Yes,Consultation and Policy Design Opportunities,National,"The Australian government is consulting on reforms to prevent perpetrators of family and domestic violence from receiving superannuation death benefits intended for victims, addressing financial abuse risks and enhancing protections for victim-survivors. This initiative aims to close legal loopholes that currently allow abusers to benefit financially from victims’ deaths, aligning with broader efforts to improve social safety, reduce harm, and promote fairness within the superannuation system. The reforms could impact superannuation governance, compliance obligations, and stakeholder trust, emphasizing the importance of safeguarding vulnerable populations and reinforcing social responsibility in financial systems."
2026-03-04,Submission on the Australian tyre industry,https://alga.com.au/submission-on-the-australian-tyre-industry/,294.md,Yes,State and Local Government Programs,National,"The Australian Local Government Association advocates for a national mandatory product stewardship scheme to improve end-of-life tyre management, aiming to enhance recovery rates, prevent illegal dumping, and promote the use of crumb rubber. Addressing the environmental challenge of tyre waste, this initiative has significant ESG implications by reducing environmental pollution, supporting circular economy practices, and potentially lowering costs for local governments. Implementing such regulations could also influence industry compliance, investor risk assessments, and stakeholder perceptions regarding sustainable waste management and environmental responsibility."
2026-03-02,"Copper prices have hit record highs, but smelters face mounting strategic pressures",https://www.iea.org/commentaries/copper-prices-have-hit-record-highs-but-smelters-face-mounting-strategic-pressures,295.md,Yes,"Reports, Data Releases, and Analytical Insights",International,"The report highlights significant ESG risks stemming from rising copper prices and supply chain vulnerabilities, including increasing market concentration in Chinese smelting capacity, which poses geopolitical and economic security concerns. The dominance of China in refining critical minerals like copper raises issues of supply resilience, dependency, and potential disruptions affecting energy, technology, and defense sectors. The need for diversified sourcing, investment in sustainable mining practices, and regulatory oversight to prevent market overconcentration underscores the importance of strategic, environmentally responsible, and resilient supply chain management to mitigate future ESG risks."
2026-03-04,National Accounts – December quarter 2025,https://ministers.treasury.gov.au/ministers/jim-chalmers-2022/media-releases/national-accounts-december-quarter-2025,296.md,No,,,
2026-03-05,Ballarat pavilion to kick goals for local athletes,https://www.rdv.vic.gov.au/news/ballarat-pavilion-to-kick-goals-for-local-athletes,3.md,Yes,Funding and Grant Announcements,Victoria,"The new pavilion at Frank Bourke Oval in Ballarat, supported by a $5 million council fund, enhances community sports infrastructure with modern, accessible facilities meeting AFL Victoria and Cricket Australia standards, promoting active lifestyles and social inclusion. The project emphasizes local employment through modular construction by local tradespeople, aligning with regional development goals. As part of broader state investments in public spaces and active transport infrastructure, such initiatives can improve community well-being, support local economies, and foster social cohesion, reflecting a focus on social and governance aspects of ESG by promoting equitable access and sustainable regional growth."
2026-03-03,Drier conditions on the horizon after record year,https://www.agriculture.gov.au/about/news/abares-march-reports,30.md,No,,,
