Date,Title,URL,md_file,ESG_or_not,Story_Type,Jurisdiction,ESG Summary
2026-02-28,Statement on Iran,https://www.pm.gov.au/media/statement-iran,163.md,Yes,"Ministerial, Diplomatic, and International Engagements",National,"The Australian government’s response to Iran’s destabilising activities includes sanctions against over 200 Iranian-linked individuals and measures to counter threats to regional security, highlighting the importance of compliance and risk management for businesses operating in or with Iran. The escalation of tensions and travel advisories reflect geopolitical risks that could impact supply chains, investments, and operational stability. The focus on Iran’s nuclear non-compliance and human rights abuses underscores the need for companies to monitor evolving sanctions, export controls, and reputational risks associated with engagement in regions affected by conflict and regime repression."
2026-03-04,Turning a hobby into income? You might be in business,https://www.ato.gov.au/businesses-and-organisations/small-business-newsroom/turning-a-hobby-into-income-you-might-be-in-business,166.md,No,,,
2026-03-05,Women shaping the future of community sport,https://www.parliament.vic.gov.au/news/general-news/womeninsport,17.md,Yes,"Community, First Nations, and Social Licence Initiatives",National,"The event highlights ongoing gender equality efforts in community sport, emphasizing the need to address barriers faced by women in participation, leadership, and recognition. It underscores the importance of equal opportunity, respect, and pay, aligning with social ESG goals. The focus on increasing female engagement in sports, including regional communities, reflects broader social inclusion and gender equity initiatives. These efforts may influence future policy and funding priorities, potentially impacting governance and compliance requirements for sports organizations to promote diversity, equity, and social sustainability."
2026-03-03,Climate resilience adds revenue options for Australia’s farmers,https://www.climatechangeauthority.gov.au/climate-resilience-adds-revenue-options-australias-farmers,175.md,Yes,"Reports, Data Releases, and Analytical Insights",Australian Capital Territory,"The speech highlights Australia's efforts to decarbonise, emphasizing the land sector's significant role in reducing emissions through land management, reforestation, and sequestration, which can enhance climate resilience and meet emissions targets. It discusses regulatory reforms, such as the Australian Carbon Credit Unit Scheme and Safeguard Mechanism, aimed at improving emissions abatement and public confidence. The focus on technological innovation, renewable energy adoption, and climate adaptation strategies underscores the importance of regulatory compliance, investor confidence, and stakeholder engagement in transitioning to a low-carbon economy while supporting rural community resilience."
2026-03-04,"Leadership Shift At A Critical Moment For Corporate ESG KPMG International has appointed Gauthier Acket as Head of Global ESG, placing a nearly three-decade veteran of the firm at the...",https://esgnews.com/kpmg-appoints-gauthier-acket-as-head-of-global-esg/,177.md,Yes,Legislative and Statutory Developments,International,"KPMG has appointed Gauthier Acket as Head of Global ESG amid rising regulatory and investor pressures on climate disclosures, governance, and sustainability performance. This leadership change underscores the increasing importance of ESG advisory services in managing climate risk, regulatory compliance, and transition strategies for multinational corporations. Firms like KPMG are expanding their ESG practices to support companies in meeting complex disclosure standards such as ISSB and evolving climate policies, highlighting the growing integration of ESG considerations into corporate strategy, risk management, and capital allocation amid tightening global climate policies and stakeholder scrutiny."
2026-03-04,Advice Grants now available for First Nations applicants – guidelines are available now.,https://www.dcceew.gov.au/about/news/clean-energy-advice-first-nations-peoples,178.md,Yes,Funding and Grant Announcements,National,"The Australian Government's investment of over $39 million over three years to support First Nations communities in clean energy initiatives highlights a focus on social and governance ESG factors. The program aims to empower Indigenous communities through grants for advice, training, and planning, aligning with goals to promote equitable partnerships, economic benefits, and community-led decision-making. This initiative addresses social inclusion, Indigenous empowerment, and supports the transition to renewable energy, potentially reducing transition risks and fostering stakeholder trust. It also emphasizes compliance with the First Nations Clean Energy Strategy and the Closing the Gap agreement, reinforcing government commitments to social equity and sustainable development."
2026-03-05,State of the energy transition: Your technology playbook,https://www.csiro.au/en/news/All/Articles/2026/March/State-of-the-Energy-Transition,179.md,Yes,"Reports, Data Releases, and Analytical Insights",International,"CSIRO’s report highlights significant ESG implications for Australia’s energy transition, emphasizing the need for targeted RD&D to reduce costs and scale low-emission technologies across sectors such as electricity, transport, and mining. Key areas include advancing energy storage, low-carbon fuels, and carbon capture, utilization, and storage, which are critical for decarbonizing hard-to-abate industries and achieving net-zero emissions by 2050. The report underscores the importance of collaborative efforts among research, industry, and government to ensure equitable access, reliable infrastructure, and cost-effective solutions, addressing environmental impacts, social equity, and governance challenges in transitioning to a sustainable low-carbon economy."
2026-03-03,Improving community engagement to make better decisions,https://www.parliament.vic.gov.au/news/society/consultreport,18.md,Yes,Consultation and Policy Design Opportunities,Victoria,"The Victorian parliamentary inquiry recommends updating the Public Engagement Framework to ensure consistent, transparent, and inclusive community consultation by government departments, emphasizing early engagement and clear communication. Mandating framework adherence and public reporting aims to enhance stakeholder trust and social cohesion. These reforms could increase compliance and operational transparency for government agencies, potentially influencing how businesses and contractors engage with communities. Strengthening community participation aligns with social responsibility goals, while improved engagement practices may mitigate reputational risks associated with poorly managed or rushed consultations. Overall, the focus on transparent, inclusive engagement underscores the importance of stakeholder trust in governance and policy-making processes."
2026-03-03,CSIRO backs Australian startups tackling some of humanity's biggest challenges,https://www.csiro.au/en/news/All/News/2026/March/On-Accelerate-program,180.md,Yes,Funding and Grant Announcements,National,"The selected ventures under CSIRO’s ON Accelerate program demonstrate significant ESG implications, including advancing healthcare equity through AI-driven skin cancer detection accessible to underserved communities, and personalising cancer treatments to improve safety and reduce toxicity. Additionally, innovations like Hydro Harvester address critical water security in drought-affected remote and Indigenous communities, supporting social and environmental resilience. These initiatives highlight efforts to enhance social equity, environmental sustainability, and governance by promoting inclusive access to essential services, reducing environmental impact, and fostering community engagement in technological solutions with potential for broad societal benefits."
2026-02-27,CSIRO partners with AMRF Connect on advanced manufacturing program,https://www.csiro.au/en/news/All/News/2026/February/Innovate-to-Grow-Advanced-Manufacturing,181.md,No,,,
2026-03-03,Innes Willox statement on WGEA gender pay gaps,https://www.australianindustrygroup.com.au/news/media-centre/2026/innes-willox-statement-on-wgea-gender-pay-gaps/,183.md,Yes,"Reports, Data Releases, and Analytical Insights",National,"The publication of gender pay gap data by WGEA highlights ongoing efforts by employers to improve workplace equality, with over 10,500 companies involved. However, private sector employers with over 500 employees will soon face regulatory requirements to demonstrate progress, increasing compliance and disclosure burdens. This reflects a broader push for transparency and equitable pay practices, which could impact corporate governance, reputation, and operational costs. The emphasis on gender equality reporting underscores the growing importance of ESG disclosure mandates and stakeholder expectations for social responsibility in the workplace."
2026-03-05,Consultation begins on Gender Equity Charter for aviation sector,https://www.infrastructure.gov.au/department/media/news/consultation-begins-gender-equity-charter-aviation-sector,185.md,Yes,Consultation and Policy Design Opportunities,National,"The Australian Government's consultation on a new Gender Equity Charter under the 2024 Aviation White Paper aims to address significant gender disparities in the aviation sector, including a 37.2% pay gap and low female representation in technical roles. The initiative emphasizes mandatory annual reporting on workplace culture, employment targets, and pay equity, with potential implications for access to government grants. This reflects a focus on social ESG factors, promoting diversity, inclusion, and fair pay, while increasing regulatory and compliance requirements for industry stakeholders to improve gender equity and workforce sustainability."
2026-03-03,Construction begins on Stage 1 of Melbourne Airport Rail Link,https://www.infrastructure.gov.au/department/media/news/construction-begins-stage-1-melbourne-airport-rail-link,186.md,No,,,
2026-03-03,AFC Women’s Asian Cup 2026 has kicked off,https://www.infrastructure.gov.au/department/media/news/afc-womens-asian-cup-2026-has-kicked,187.md,Yes,Funding and Grant Announcements,National,"The Australian Government’s $15 million investment to support the Matildas’ tournament aligns with national efforts to promote gender equity and increase women’s participation in sport, reflecting social ESG priorities. The event aims to inspire young girls, enhance gender diversity, and showcase Australia internationally, contributing to social inclusion and cultural diplomacy. Additionally, government backing of major women’s sporting events ahead of the Brisbane 2032 Olympics demonstrates strategic planning for sustainable economic and social benefits, emphasizing the importance of gender-focused initiatives in sports as part of broader ESG and national development goals."
2026-03-03,Export Finance Australia and Standard Chartered partner to expand finance for Australian exporters,https://www.exportfinance.gov.au/newsroom/export-finance-australia-and-standard-chartered-partner-to-expand-finance-for-australian-exporters/,188.md,No,,,
2026-03-05,Beyond net zero: What climate reports reveal about strategy,https://www.bdo.com.au/en-au/insights/esg-sustainability/afr-leaders/beyond-net-zero-what-climate-reports-reveal-about-strategy,189.md,Yes,"Reports, Data Releases, and Analytical Insights",National,"The new mandatory climate reporting requirements in Australia are shifting focus from ambition to financial and operational integration, emphasizing quantifiable disclosures such as earnings sensitivity, capital reallocation, and physical risk impacts. These reports will influence investor assessments of climate resilience, risk management, and governance quality, affecting market valuations and access to capital. Companies that embed climate data into strategic decision-making and capital planning will be better positioned, highlighting the importance of governance, systems, and transparency. This transition underscores the increasing role of climate disclosure as a governance indicator and market pricing tool, with significant implications for corporate risk management and investor confidence."
2026-03-02,Giant leap of learning as civics meets space,https://www.parliament.vic.gov.au/news/general-news/mission-control,19.md,Yes,"Community, First Nations, and Social Licence Initiatives",Victoria,"The ""Mission Control"" program highlights the growing importance of interdisciplinary skills and stakeholder engagement in space exploration, emphasizing the need for diverse expertise beyond traditional STEM roles. It underscores the potential for increased investment and regulatory focus on sustainable and ethical space missions, as students grapple with trade-offs related to health, energy, agriculture, and entertainment—reflecting broader societal debates about resource allocation and wellbeing. The initiative also promotes civic literacy and ethical decision-making, aligning with governance and social responsibility themes critical for responsible development of the expanding space industry."
2026-03-02,​​REAL Program launches supporting transitions from the justice system,https://www.indigenous.gov.au/news/real-program-launches-supporting-transitions-from-justice-system,190.md,Yes,"Community, First Nations, and Social Licence Initiatives",National,"The REAL Program aims to support First Nations individuals transitioning from the justice system through culturally informed, community-led initiatives, emphasizing social inclusion and reconciliation. Its focus on connecting Indigenous people to employment, education, and cultural practices aligns with social sustainability goals. The program’s expansion and potential funding opportunities for eligible organizations may influence corporate social responsibility strategies and stakeholder engagement. Additionally, integrating cultural and community support into rehabilitation efforts could impact operational practices for organizations involved in justice and social services, highlighting the importance of culturally sensitive approaches in social governance and community development."
2026-03-05,Australia and Canada agree to strengthen cooperation on AI safety,https://www.industry.gov.au/news/australia-and-canada-agree-strengthen-cooperation-ai-safety,191.md,Yes,"Ministerial, Diplomatic, and International Engagements",International,"The memorandum of understanding between Australia and Canada on AI safety signifies increased international cooperation on managing AI-related risks, with a focus on developing guidelines, sharing information, and joint research. This collaboration may influence regulatory frameworks, compliance requirements, and risk management strategies for AI systems, impacting businesses operating in or with these countries. The establishment of national AI safety institutes and adherence to internationally recognized standards could lead to new governance and oversight obligations, emphasizing the importance of transparency, responsible innovation, and stakeholder trust in AI deployment. These developments highlight evolving regulatory and reputational risks for AI developers and users."
2026-03-03,Four new major projects to strengthen Australia’s supply chains,https://www.industry.gov.au/news/four-new-major-projects-strengthen-australias-supply-chains,192.md,Yes,"Infrastructure, Project Approvals, and EPBC Developments",National,"The Australian Government's approval of major projects in renewable energy, green metals, and rare earth elements highlights a strategic shift towards decarbonisation and strengthening domestic supply chains, reducing reliance on imports and enhancing energy security. Significant investments in green steel, rare earth processing, and solar manufacturing support the transition to low-carbon industries, with substantial job creation and regional economic development. These projects also aim to build sovereign capability in critical minerals and renewable energy infrastructure, aligning with environmental goals and addressing supply chain resilience, but they may also pose environmental and social governance challenges related to resource extraction and land use."
2026-03-03,George Medicines designs a ‘triple pill’ to better manage hypertension,https://www.industry.gov.au/news/george-medicines-designs-triple-pill-better-manage-hypertension,193.md,Yes,Funding and Grant Announcements,National,"The Australian Government’s Biomedical Translation Fund (BTF) supported George Medicines in developing and commercialising a triple-pill hypertension therapy, approved by the FDA in 2025, which aims to improve public health outcomes by reducing side effects and enhancing treatment adherence. The fund’s investment accelerates clinical development and global market entry, highlighting government efforts to foster innovation, improve healthcare access, and address non-communicable diseases. This initiative underscores the importance of public-private partnerships in advancing medical research, with potential implications for health equity, regulatory compliance, and stakeholder trust in biomedical innovation."
2026-03-02,Launch your STEM career as a graduate in 2027,https://www.industry.gov.au/news/launch-your-stem-career-graduate-2027,194.md,No,,,
2026-03-02,Fuel pump audit will ensure you get what you pay for at the bowser,https://www.industry.gov.au/news/fuel-pump-audit-will-ensure-you-get-what-you-pay-bowser,195.md,No,,,
2026-02-27,"Get inside the athlete's brain, explore First Nations science and go stargazing at National Science...",https://www.industry.gov.au/news/get-inside-athletes-brain-explore-first-nations-science-and-go-stargazing-national-science-week-2026,196.md,Yes,Funding and Grant Announcements,National,"The Australian Government’s funding of inclusive science events for National Science Week 2026 emphasizes engagement with underrepresented groups, Indigenous knowledge systems, and regional communities, supporting social inclusion and cultural diversity. Initiatives such as Indigenous science programs and activities focused on remote areas highlight efforts to promote equitable access to STEM and environmental stewardship. These projects may enhance community resilience, environmental awareness, and Indigenous participation in science, aligning with social and governance ESG goals. However, increased public engagement and visibility of Indigenous and regional knowledge could also influence stakeholder perceptions and policy priorities related to environmental and social responsibility."
2026-02-27,$6.9 million for manufacturing Printed Solar and a semiconductor packaging tool,https://www.industry.gov.au/news/69-million-manufacturing-printed-solar-and-semiconductor-packaging-tool,197.md,Yes,Funding and Grant Announcements,National,"The Australian Government's Industry Growth Program funds innovative projects aligned with national priorities, including advancing manufacturing capabilities and sustainable technologies. Notably, grants support semiconductor and printed solar technologies, which have implications for supply chain resilience, technological sovereignty, and environmental sustainability. These initiatives may influence future regulatory standards, promote cleaner energy solutions, and impact stakeholder perceptions regarding environmental responsibility and technological innovation. The program’s focus on scaling environmentally sustainable and high-tech manufacturing aligns with broader ESG goals of fostering sustainable economic growth and reducing environmental impact through advanced, recyclable solar solutions."
2026-03-05,Update on Norfolk Island air freight arrangements,https://www.infrastructure.gov.au/department/media/news/update-norfolk-island-air-freight-arrangements-0,198.md,Yes,"Infrastructure, Project Approvals, and EPBC Developments",National,"The Australian Government’s decision to award a long-term contract to Toll Remote Logistics for air freight services to Norfolk Island highlights regulatory and operational commitments to ensure supply chain resilience in remote areas. This initiative addresses social considerations by maintaining essential supplies for residents and businesses, supporting community well-being. It also reflects governance efforts to secure reliable logistics infrastructure amid geographic challenges. The focus on adaptable, responsive freight services underscores the importance of stakeholder engagement and resilience planning, with potential implications for environmental sustainability depending on the logistics provider’s environmental practices."
2026-03-02,Building Women’s Careers marks one year of impact across Australia,https://www.dewr.gov.au/newsroom/articles/building-womens-careers-marks-one-year-impact-across-australia,199.md,Yes,"Community, First Nations, and Social Licence Initiatives",National,"The Building Women’s Careers (BWC) Program advances ESG objectives by promoting gender equality and social inclusion within Australia's workforce, particularly in sectors like construction, clean energy, and technology. Its focus on inclusive partnership projects, skills development, and pathways to secure employment supports social sustainability and workforce resilience. The program’s emphasis on transforming workplace culture aligns with governance and diversity goals, potentially influencing regulatory standards and stakeholder expectations for gender equity. By fostering a more inclusive and skilled economy, the initiative addresses social risks and enhances long-term economic stability."
2026-02-27,Victoria’s minerals in the spotlight,https://resources.vic.gov.au/about-us/news/victorias-minerals-in-the-spotlight,2.md,Yes,"Ministerial, Diplomatic, and International Engagements",Victoria,"Victoria's promotion of its growing minerals sector at the PDAC conference highlights efforts to attract responsible investment in critical minerals, supporting the state's Critical Minerals Roadmap. This initiative aims to establish local supply chains and position Victoria as an investment-ready destination, which has implications for environmental management, social license to operate, and governance standards in resource development. The focus on critical minerals underscores the importance of sustainable and responsible extraction practices to mitigate environmental and social risks, aligning with broader ESG considerations related to resource governance, supply chain transparency, and stakeholder engagement in the transition to a low-carbon economy."
2026-02-27,Law change for victim-survivors of institutional child abuse,https://www.parliament.vic.gov.au/news/justice/vicariousliability,20.md,Yes,Legislative and Statutory Developments,Victoria,"The passage of the Justice Legislation Amendment (Vicarious Liability for Child Abuse) Bill 2025 in Victoria introduces significant legal and regulatory changes requiring institutions, including religious organizations, to be held vicariously liable for employee misconduct, notably child abuse. This retrospective legislation increases the legal and financial risks for organizations with trust-based roles, potentially leading to higher insurance costs, compliance burdens, and reputational damage. It aligns with broader efforts to improve accountability and victim redress, emphasizing the importance of governance and stakeholder trust in institutions responsible for safeguarding vulnerable populations."
2026-03-04,Identity verification made simpler for scheme participants,https://cer.gov.au/news-and-media/news/2026/march/identity-verification-made-simpler-scheme-participants,200.md,Yes,Legislative and Statutory Developments,National,"The Australian government has streamlined identity verification processes for participants in emissions trading schemes, including ACCU, GO, and ANREU, by aligning with the Document Verification Service and accepting recently expired passports. These regulatory changes aim to reduce compliance burdens, improve efficiency, and facilitate participation across multiple schemes. However, schemes like NGER and the Safeguard Mechanism remain unaffected, potentially impacting organizational compliance and operational costs. The regulatory amendments reflect a broader effort to enhance transparency and stakeholder engagement while reducing administrative risks associated with identity verification in climate-related markets."
2026-03-02,New solar battery photo requirements now in place,https://cer.gov.au/news-and-media/news/2026/march/new-solar-battery-photo-requirements-now-place,201.md,No,,,
2026-02-27,2024–25 National Greenhouse and Energy Reporting data now available,https://cer.gov.au/news-and-media/news/2026/february/2024-25-national-greenhouse-and-energy-reporting-data-now-available,202.md,Yes,"Reports, Data Releases, and Analytical Insights",National,"The release of the 2024–25 National Greenhouse and Energy Reporting data highlights a reduction in scope 1 greenhouse gas emissions by Australian corporations, driven by declines in electricity generation and oil and gas sectors. This transparency supports regulatory compliance and aligns with Australia’s international reporting obligations, emphasizing the importance of ESG disclosure for corporate accountability. The data underscores ongoing efforts to reduce emissions, which may influence investor risk assessments, stakeholder perceptions, and future policy development. Companies’ emissions performance and reporting practices will remain critical factors in ESG evaluations and regulatory compliance strategies."
