Date,Title,URL,md_file,ESG_or_not,Story_Type,Jurisdiction,ESG Summary
2026-03-02,Grants to support development of processing facility,https://resources.vic.gov.au/about-us/news/grants-to-support-development-of-processing-facility,1.md,Yes,Funding and Grant Announcements,Victoria,"The new Advancing Antimony Grants in Victoria aim to establish a local antimony processing facility, supporting regional economic development and job creation. As a critical mineral used in clean energy and manufacturing, increased local processing aligns with sustainable resource management and supply chain resilience. The initiative reflects government efforts to attract investment under Victoria’s Critical Minerals Roadmap, potentially influencing environmental and social governance by promoting domestic mineral processing, reducing reliance on imports, and fostering economic growth in a resource-rich region. These developments may also raise considerations around environmental impacts of mineral processing and community engagement."
2026-03-04,Commission and EU countries confirm no immediate oil or gas supply concerns following the disruptions in the Middle East,https://energy.ec.europa.eu/news/commission-and-eu-countries-confirm-no-immediate-oil-or-gas-supply-concerns-following-disruptions-2026-03-04_en,10.md,No,,,
2026-03-04,Circus brings colour and creativity to Kimberley communities,https://www.wa.gov.au/government/media-statements/Cook%20Labor%20Government/Circus-brings-colour-and-creativity-to-Kimberley-communities-20260304,100.md,Yes,Funding and Grant Announcements,Western Australia,"The Western Australian government’s support for culturally safe youth programs, including circus arts and storytelling initiatives, aims to promote social and emotional wellbeing, resilience, and community engagement among regional Indigenous children and young people. Funding through grants and partnerships emphasizes mental health, cultural safety, and community respect, aligning with preventative health and social inclusion goals. These programs may enhance youth development, reduce mental health risks, and foster cultural identity, but also involve operational and compliance considerations for delivering culturally responsive, community-driven initiatives within regional and remote settings."
2026-03-04,First residential lots released at Princess Margaret Hospital site,https://www.wa.gov.au/government/media-statements/Cook%20Labor%20Government/First-residential-lots-released-at-Princess-Margaret-Hospital-site-20260304,101.md,Yes,"Community, First Nations, and Social Licence Initiatives",Western Australia,"The Subi East redevelopment project emphasizes sustainable urban renewal by prioritizing land supply for housing, including private, affordable, and social housing, addressing housing affordability and social inclusion. The reuse of historic buildings and materials from demolition supports cultural heritage preservation and resource efficiency. Public amenities such as green spaces, water features, and accessible walkways promote community well-being and environmental quality. The project’s focus on high-density housing near transport links aligns with sustainable urban development goals, potentially reducing car dependency and emissions. Overall, the initiative reflects a commitment to socially inclusive, environmentally conscious, and well-governed urban growth."
2026-03-04,New seasonal flight connecting Perth and Christchurch,https://www.wa.gov.au/government/media-statements/Cook%20Labor%20Government/New-seasonal-flight-connecting-Perth-and-Christchurch-20260304,102.md,No,,,
2026-03-04,Regional communities to share benefits of WA's energy transition,https://www.wa.gov.au/government/media-statements/Cook%20Labor%20Government/Regional-communities-to-share-benefits-of-WA's-energy-transition-20260304,103.md,Yes,"Community, First Nations, and Social Licence Initiatives",Western Australia,"Western Australia's new community benefits guideline for large-scale renewable energy projects aims to ensure meaningful, place-based benefits for local communities, including Indigenous groups, as part of the energy transition. The tiered benefit approach and stakeholder engagement requirements may increase compliance and operational burdens for developers, while fostering stakeholder trust and social license. Implementation through pilot programs and future guidance could influence industry practices and disclosure obligations, highlighting the importance of community engagement, social equity, and stakeholder collaboration in renewable energy development. These measures could also impact investor risk profiles and regulatory expectations for ESG compliance."
2026-03-03,WA new home approvals reach highest level in four years,https://www.wa.gov.au/government/media-statements/Cook%20Labor%20Government/WA-new-home-approvals-reach-highest-level-in-four-years-20260303,104.md,Yes,Funding and Grant Announcements,Western Australia,"Western Australia's record $6.3 billion investment in housing initiatives aims to boost supply, affordability, and social housing, supported by policies encouraging multi-residential developments and workforce growth through fee-free TAFE. The surge in building approvals, including a 40% increase in multi-residential projects, highlights efforts to address housing security and social equity. These measures may influence regulatory frameworks, investment risks, and stakeholder perceptions, emphasizing the importance of sustainable urban development, social inclusion, and responsible governance in managing transition and social risks associated with rapid housing expansion."
2026-03-03,Joint media statement - Rail freight upgrades support WA's bumper grain harvest,https://www.wa.gov.au/government/media-statements/Cook%20Labor%20Government/Joint-media-statement---Rail-freight-upgrades-support-WA's-bumper-grain-harvest-20260303,105.md,Yes,Funding and Grant Announcements,Western Australia,"The rail freight upgrades at WA CBH Group sites, funded by the Australian government’s $200 million ASCI program, aim to improve supply chain efficiency and support record grain harvests, enhancing export capacity and regional economic growth. These infrastructure investments address operational risks, bolster regional employment, and promote sustainable export practices by reducing bottlenecks and increasing freight safety. The project aligns with climate and economic resilience goals by enabling more efficient transportation of agricultural commodities, thereby strengthening WA’s competitive position in global markets and supporting regional communities’ socio-economic stability."
2026-03-03,Creativity takes centre stage with new funding for WA artists,https://www.wa.gov.au/government/media-statements/Cook%20Labor%20Government/Creativity-takes-centre-stage-with-new-funding-for-WA-artists-20260303,106.md,Yes,Funding and Grant Announcements,Western Australia,"The Cook Government's $2.4 million funding for arts projects in Western Australia aims to strengthen the creative sector, promote community engagement, and support cultural diversity. This investment enhances social inclusion by providing access to arts and cultural experiences, particularly for Indigenous communities and youth. It also encourages sustainable development of local arts organizations and artists, fostering social cohesion and cultural preservation. While primarily cultural, these initiatives may influence reputational and stakeholder perceptions, emphasizing the importance of supporting diverse, community-driven creative industries within ESG frameworks."
2026-03-03,Construction commences at Osborne Park Hospital,https://www.wa.gov.au/government/media-statements/Cook%20Labor%20Government/Construction-commences-at-Osborne-Park-Hospital-20260303,107.md,Yes,"Infrastructure, Project Approvals, and EPBC Developments",Western Australia,"The Osborne Park Hospital expansion, part of Western Australia’s $1.8 billion New Women and Babies Hospital Project, signifies significant health infrastructure investment aimed at improving maternity and mental health services, including a mother-baby unit and family birth centre. The project aligns with the government’s broader $4.9 billion health infrastructure plan, potentially enhancing healthcare access and quality for families. However, the construction and operational expansion may pose environmental impacts and operational risks, emphasizing the importance of sustainable development practices and compliance with health and safety regulations to mitigate stakeholder and community concerns."
2026-03-01,Roundtables with WA leaders to underpin new workforce strategy,https://www.wa.gov.au/government/media-statements/Cook%20Labor%20Government/Roundtables-with-WA-leaders-to-underpin-new-workforce-strategy-20260301,108.md,No,,,
2026-03-02,IESC advice on Ulan West Modification 8 Project,https://www.iesc.gov.au/projectadvice/advice-decision-maker-ulan-west-modification-8-project-iesc-2026-163,109.md,No,,,
2026-03-03,"Press statement of Dan Jørgensen, European Commissioner for Energy and Housing and Parviz Shahbazov, Minister of Energy of the Republic of Azerbaijan",https://energy.ec.europa.eu/news/press-statement-dan-jorgensen-european-commissioner-energy-and-housing-and-parviz-shahbazov-minister-2026-03-03_en,11.md,Yes,"Ministerial, Diplomatic, and International Engagements",International,"The meeting underscored commitments to energy security, renewable energy promotion, and methane emission reduction, highlighting ESG risks and opportunities for Azerbaijan and Europe. Emphasis on increasing renewable investments, grid modernization, and regional energy connectivity aligns with climate goals and transition risks. Initiatives like the Global Methane Pledge and OGMP 2.0 reflect efforts to mitigate environmental impacts. The focus on green energy corridors and electrification underscores the importance of sustainable infrastructure development, with potential ESG implications for regulatory compliance, investor confidence, and reputational risk related to climate and environmental standards."
2026-03-02,Agenda and minutes of the 121st IESC Meeting,https://www.iesc.gov.au/resource/agenda-and-minutes-121st-iesc-meeting,110.md,No,,,
2026-03-04,The Skeptic's Pause,https://www.iaasb.org/news-events/2026-03/skeptic-s-pause,111.md,No,,,
2026-03-02,"Mine Land Rehabilitation Authority (MLRA) Closure -Important announcement from Dr Jen Brereton, CEO of the MLRA",https://www.mineland.vic.gov.au/events/mine-land-rehabilitation-authority-mlra-closure-important-announcement-from-dr-jen-brereton-ceo-of-the-mlra/,112.md,Yes,"Community, First Nations, and Social Licence Initiatives",Victoria,"The closure of the Mine Land Rehabilitation Authority (MLRA) in March 2026 marks a significant transition in mine rehabilitation governance, with implications for environmental, social, and governance (ESG) considerations. The MLRA’s role in promoting transparent, community-focused, and sustainable rehabilitation practices highlights the importance of ongoing oversight and stakeholder engagement in managing environmental and social risks associated with mine closure. Its emphasis on collaboration with Traditional Owners, government, and industry underscores the need for continued governance, risk management, and transparency to ensure that cultural, environmental, and social values are preserved post-closure."
2026-03-02,New NAIF CEO Neil MacDonald Commences Role Based in Cairns,https://www.naif.gov.au/media-centre/new-naif-ceo-neil-macdonald-commences-role-based-in-cairns/,114.md,Yes,Funding and Grant Announcements,National,"The Australian Government plans to extend NAIF’s operations by 10 years, potentially increasing infrastructure investments in northern Australia, with implications for environmental, social, and governance factors. The extension aims to support projects that deliver community benefits, Indigenous outcomes, and local economic growth, highlighting a focus on social impact and stakeholder engagement. The appointment of a new CEO with infrastructure investment expertise signals a strategic emphasis on leveraging financing mechanisms to catalyse sustainable development. This expanded mandate may also heighten regulatory and governance responsibilities for NAIF, influencing project oversight and compliance standards."
2026-03-05,Supporting Hunter producers through a variable season,https://www.nsw.gov.au/departments-and-agencies/local-land-services/news/supporting-hunter-producers-through-a-variable-season,115.md,No,,,
2026-02-27,NSW Government delivers powerful statewide action weed program to protect farming and public lands,https://www.nsw.gov.au/departments-and-agencies/local-land-services/news/nsw-government-delivers-powerful-statewide-action-weed-program-to-protect-farming-and-public-lands,116.md,Yes,Funding and Grant Announcements,NSW,"The NSW Weeds Action Program's four-year funding enhances biosecurity efforts to prevent, eradicate, and contain high-risk invasive weeds, protecting environmental and agricultural health while supporting primary industries valued at $25 billion annually. The program's focus on risk-based planning, compliance, and stakeholder collaboration aims to reduce environmental damage, safeguard livestock and wildlife, and improve land productivity. Additionally, initiatives like feral pig and deer management, and support for farmers through eID rebates, demonstrate a commitment to sustainable land use, ecosystem health, and stakeholder engagement, aligning with broader environmental and social governance objectives."
2026-03-02,Webinar: Higher Education Outcomes,https://www.jobsandskills.gov.au/news/webinar-higher-education-outcomes,117.md,No,,,
2026-02-27,Global labour markets ease while AI offers productivity potential,https://www.jobsandskills.gov.au/news/global-labour-markets-ease-while-ai-offers-productivity-potential,119.md,No,,,
2026-03-03,New call under the EU Renewable Energy Financing Mechanism to support solar PV projects in Bulgaria and Finland,https://cinea.ec.europa.eu/news-events/news/renewfm-new-call-under-eu-renewable-energy-financing-mechanism-support-solar-pv-projects-bulgaria-2026-03-03_en,12.md,Yes,Funding and Grant Announcements,International,"The EU's launch of a €54.9 million renewable energy funding mechanism to support cross-border ground-mounted solar PV projects in Bulgaria and Finland highlights regulatory efforts to accelerate renewable deployment and meet climate targets. This initiative emphasizes stakeholder collaboration, investment support, and compliance with EU climate and energy policies, potentially influencing market dynamics and investor risk profiles. The competitive grant process and emphasis on cost-effective, sustainable energy solutions reflect governance and transparency priorities, while fostering European solidarity and advancing the transition to cleaner energy sources with significant implications for project developers and policymakers."
2026-03-05,Written Reply to Parliamentary Question on Recalcitrant Litterbugs,https://www.mse.gov.sg/latest-news/written-reply-to-parliamentary-question-on-recalcitrant-litterbugs/,120.md,Yes,"Compliance, Oversight, and Enforcement Actions",National,"The response highlights enforcement efforts by Singapore's National Environment Agency and Parks Board against littering, including monitoring via surveillance cameras and potential public display of CCTV footage to identify offenders. The focus on enforcement and surveillance reflects regulatory measures aimed at maintaining environmental standards and public cleanliness, which can impact operational compliance costs and reputational risk for businesses. The limited use of public display indicates a cautious approach to privacy and community engagement, balancing environmental enforcement with social considerations. These actions underscore the importance of regulatory compliance and community involvement in environmental governance."
2026-03-04,Written Reply to Parliamentary Question on Mobile Enforcement Cameras,https://www.mse.gov.sg/latest-news/written-reply-to-parliamentary-question-on-mobile-enforcement-cameras/,121.md,Yes,"Compliance, Oversight, and Enforcement Actions",National,"The National Environment Agency (NEA) deployed approximately 490 mobile enforcement cameras in January 2026 to address environmental public health issues such as littering, smoking violations, refuse management, and rat infestations. This initiative reflects regulatory efforts to improve environmental compliance and public health standards, potentially reducing environmental risks and enhancing community well-being. The planned expansion of camera deployment indicates ongoing regulatory enforcement and increased monitoring, which could impact operational costs for businesses and influence stakeholder perceptions regarding environmental responsibility and compliance with public health regulations."
2026-03-04,Written Reply to Parliamentary Question on Recycling Bin Fires,https://www.mse.gov.sg/latest-news/written-reply-to-parliamentary-question-on-recycling-bin-fires/,122.md,Yes,"Compliance, Oversight, and Enforcement Actions",National,"The government disclosed an average of 35 fires annually involving blue recycling bins over the past three years, primarily caused by improper disposal of fire hazards like batteries and lit cigarettes. This highlights operational and safety risks associated with waste management, prompting regulatory and educational responses. The National Environment Agency (NEA) is actively promoting public awareness campaigns to improve disposal practices, aiming to reduce fire incidents and enhance environmental safety. These measures reflect efforts to mitigate environmental and operational risks, ensure compliance with waste handling regulations, and protect stakeholder interests in sustainable waste management."
2026-03-04,Written Reply to Parliamentary Question on the use of Disposable Carrier Bag Charge proceeds,https://www.mse.gov.sg/latest-news/written-reply-to-parliamentary-question-on-the-use-of-disposable-carrier-bag-charge-proceeds/,123.md,Yes,"Community, First Nations, and Social Licence Initiatives",International,"The government mandates transparency for supermarket operators collecting disposable carrier bag charges, requiring annual reporting on proceeds and their use, primarily directed toward environmental or social causes. This regulatory requirement enhances accountability and public scrutiny, encouraging responsible allocation of funds. Ongoing monitoring aims to ensure proceeds support ESG objectives, reflecting a policy focus on environmental and social impact, stakeholder engagement, and responsible corporate conduct. These measures highlight the importance of regulatory oversight and stakeholder pressure in shaping corporate ESG practices related to waste reduction and social responsibility."
2026-03-04,Speech by SPS Goh Hanyan - Committee of Supply 2026,https://www.mse.gov.sg/latest-news/speech-by-sps-goh-hanyan---committee-of-supply-2026/,124.md,Yes,Funding and Grant Announcements,National,"The speech highlights Singapore’s climate adaptation strategies, emphasizing regulatory investments in coastal and flood protection, including billions allocated to infrastructure and community engagement. It introduces new initiatives such as the Climate Adaptation Package and the Beverage Container Return Scheme, which promote environmental sustainability and circular economy principles. The focus on community-led resilience projects, stakeholder consultation, and support for vulnerable groups like seniors underscores social inclusion and stakeholder engagement. These measures reflect a comprehensive approach to managing climate transition risks, regulatory compliance, and fostering sustainable practices, with significant implications for business operations, environmental impact, and stakeholder relations."
2026-03-04,Speech by SMS Zaqy Mohamad - Committee of Supply 2026,https://www.mse.gov.sg/latest-news/speech-by-sms-zaqy-mohamad---committee-of-supply-2026/,125.md,Yes,Funding and Grant Announcements,National,"Singapore's food resilience strategy emphasizes diversification of imports, regional partnerships, and local production to mitigate supply chain risks amid geopolitical tensions, animal diseases, and climate change. The government is investing in technology adoption, capacity building, and high-quality agri-inputs to enhance farm productivity and sustainability. Stockpiling essential foods and strengthening early warning systems aim to ensure reliable access during disruptions. These initiatives reflect a focus on operational resilience, food security, and stakeholder collaboration, with implications for businesses to diversify supply sources, invest in local partnerships, and support sustainable, resilient food systems amid increasing environmental and geopolitical risks."
2026-03-03,Speech by SMS Janil Puthucheary - Committee of Supply 2026,https://www.mse.gov.sg/latest-news/speech-by-sms-janil-puthucheary-committee-of-supply-2026/,126.md,Yes,"Compliance, Oversight, and Enforcement Actions",International,"The speech highlights Singapore’s climate adaptation strategies, emphasizing water resilience through infrastructure investments like NEWater and desalination, and heat resilience via urban cooling and research initiatives, including support for vulnerable groups. It also addresses resource sustainability through waste reduction, extended producer responsibility schemes, and recycling programs such as Return Right. These measures aim to mitigate environmental impacts, promote sustainable consumption, and enhance regulatory compliance. The focus on collective action, stakeholder engagement, and enforcement underscores the importance of governance and social responsibility in addressing climate change, resource management, and public health risks."
2026-03-03,Speech by Minister Grace Fu - Committee of Supply 2026,https://www.mse.gov.sg/latest-news/speech-by-minister-grace-fu-committee-of-supply-2026/,127.md,Yes,Legislative and Statutory Developments,National,"Singapore’s government emphasizes the importance of climate adaptation, highlighting regulatory measures such as the Coastal Protection Bill and investments in infrastructure resilience across flood, coastal, heat, water, and food security sectors. The nation aims to develop a comprehensive National Adaptation Plan through public engagement, encouraging private sector integration and community participation. Initiatives include climate risk assessments, infrastructure upgrades, scientific research, and innovative community-led projects. These efforts reflect a strategic approach to managing climate transition risks, safeguarding economic stability, and enhancing social resilience amid increasing climate hazards, with a focus on long-term sustainability and stakeholder collaboration."
2026-03-02,Oral Reply to Parliamentary Question on Utilities Bill Arrears,https://www.mse.gov.sg/latest-news/oral-reply-to-parliamentary-question-on-utilities-bill-arrears/,128.md,Yes,"Community, First Nations, and Social Licence Initiatives",National,"The government’s efforts to reduce utility bill arrears, from 0.5% to 0.2%, demonstrate a focus on social equity and support for lower-income households, mitigating potential social risks. Measures such as targeted rebates, community assistance, and non-disruptive water flow restrictors aim to prevent service disruptions and protect vulnerable populations. The introduction of the PAYU scheme for electricity further enhances financial inclusion and affordability. These initiatives reflect a commitment to social sustainability and responsible utility governance, reducing the risk of social unrest and reputational damage for utility providers while promoting equitable access to essential services."
2026-03-02,Written Reply to Parliamentary Question on Noise Emissions,https://www.mse.gov.sg/latest-news/written-reply-to-parliamentary-question-on-noise-emissions/,129.md,Yes,"Compliance, Oversight, and Enforcement Actions",International,"The response highlights increased enforcement and technological efforts by Singapore’s authorities to address vehicular noise emissions, including fines for foreign-registered vehicles and exploration of acoustic cameras. The rise in noise-related fines indicates heightened regulatory compliance measures, which could impact vehicle operators and cross-border mobility. These actions reflect regulatory and operational risks for businesses involved in vehicle importation, maintenance, or compliance. Enhanced enforcement and potential future use of advanced noise detection technologies may increase compliance costs and influence stakeholder perceptions regarding environmental standards and regulatory stringency."
