Date,Title,URL,md_file,ESG_or_not,Story_Type,Jurisdiction,ESG Summary
2026-03-05,IMF to Close Resident Representative Office in Suriname,https://www.imf.org/en/news/articles/2026/03/05/pr-26072-suriname-imf-to-close-resident-representative-office-in-suriname,232.md,Yes,Consultation and Policy Design Opportunities,International,"The IMF’s closure of its Suriname office following the successful completion of a macroeconomic stabilization program highlights ongoing international support for economic reforms and debt sustainability. Suriname’s upcoming large-scale oil production presents significant environmental and social risks, including potential environmental degradation and community impacts. Continued IMF engagement through policy consultations and capacity development underscores the importance of governance and regulatory oversight in managing resource extraction and ensuring sustainable development. These developments have implications for investor risk, regulatory compliance, and stakeholder expectations related to environmental and social governance in Suriname’s evolving resource sector."
2026-03-05,IMF Staff Concludes Visit to Kenya,https://www.imf.org/en/news/articles/2026/03/04/pr-26071-kenya-imf-staff-concludes-visit-to-kenya,233.md,Yes,Consultation and Policy Design Opportunities,International,"The IMF visit to Kenya highlights the country's need to strengthen fiscal discipline, governance, and public sector efficiency to build resilience against external shocks, including geopolitical risks from the Middle East. These measures are critical for maintaining economic stability, investor confidence, and compliance with international financial standards. Enhanced governance and fiscal credibility are essential for attracting sustainable investment and managing transition risks amid global uncertainties. The focus on fiscal reforms and resilience-building underscores the importance of transparent, effective governance practices in supporting Kenya’s economic stability and sustainable development goals."
2026-03-05,Shaping Asia’s Future,https://www.imf.org/en/news/articles/2026/03/05/sp030526-shaping-asias-future,234.md,Yes,"Reports, Data Releases, and Analytical Insights",International,"The IMF highlights Asia’s progress in financial stability, poverty reduction, and trade, emphasizing the importance of sustainable growth and regional integration. Key ESG concerns include managing the social impacts of AI on employment, particularly for entry-level and middle-skilled workers, amid demographic shifts such as rapid aging in some countries. The region’s focus on digital infrastructure and inclusive digital finance presents opportunities for social inclusion, but also raises governance challenges related to regulation, data security, and equitable access. Strengthening resilience through sustainable policies and regional cooperation is vital to balancing economic growth with social and environmental sustainability."
2026-03-04,IMF Staff Completes 2026 Article IV Consultation to Kiribati,https://www.imf.org/en/news/articles/2026/03/04/pr26070-kiribati-imf-staff-completes-2026-article-iv-consultation-to-kiribati,235.md,Yes,"Reports, Data Releases, and Analytical Insights",International,"The IMF highlights Kiribati's high climate-related vulnerabilities, including risks to fiscal and external sustainability from climate shocks affecting fishing revenues and infrastructure. The country's reliance on withdrawals from the Revenue Equalization Reserve Fund (RERF) and external grants introduces fiscal volatility, complicating long-term climate resilience and economic stability. Strengthening institutional capacity, debt management, and fiscal frameworks are emphasized to support sustainable growth amid climate risks. These factors pose significant transition and operational risks for businesses, underscoring the importance of climate adaptation, transparent governance, and diversified revenue sources to mitigate future ESG challenges."
2026-03-04,"Joint Press Release by the Ministry of Finance of Thailand, the Bank of Thailand, and the International Monetary Fund on Progress in Preparations for the 2026 Annual Meetings",https://www.imf.org/en/news/articles/2026/03/04/pr-26069-joint-pr-progress-2026-annual-meetings,236.md,Yes,"Ministerial, Diplomatic, and International Engagements",International,"The 2026 IMF and World Bank Annual Meetings in Thailand highlight opportunities to promote sustainable, resilient, and inclusive economic growth, with a focus on digital financial inclusion through Thailand’s “Safe and Inclusive Digital Finance” agenda. The event underscores the importance of international cooperation in addressing global challenges such as climate change, geopolitical risks, and economic resilience. Thailand’s emphasis on human capital development and resilience aligns with ESG priorities, while the event’s focus on sharing development visions and innovative financial strategies may influence global ESG standards and policies. The meetings could shape future ESG-related frameworks and promote sustainable financial practices."
2026-03-03,IMF Statement on the Middle East,https://www.imf.org/en/news/articles/2026/03/03/pr-26068-statement-on-middle-east,237.md,No,,,
2026-03-02,St. Kitts and Nevis: Staff Concluding Statement of the 2026 Article IV Mission,https://www.imf.org/en/news/articles/2026/03/02/cs-03022026-st-kitts-and-nevis-staff-concluding-statement-of-the-2026-article-iv-mission,238.md,Yes,"Reports, Data Releases, and Analytical Insights",National,"The report highlights significant fiscal and external vulnerabilities driven by declining Citizenship-by-Investment (CBI) revenues, high fiscal deficits, and rising public debt, which pose governance and fiscal sustainability risks. Weakening fiscal buffers and reliance on volatile CBI income threaten long-term debt sustainability and public financial management. Additionally, vulnerabilities in the banking and non-bank financial sectors, including legacy NPLs and rising natural disaster risks, underscore the importance of strengthening financial regulation, disaster resilience, and transparency. Reforms in energy, climate risk management, and anti-money laundering frameworks are critical to mitigate environmental and governance risks associated with natural disasters, financial stability, and international scrutiny."
2026-03-05,"New leader, same negativity","https://www.premier.tas.gov.au/latest-news/2026/march/new-leader,-same-negativity",239.md,No,,,
2026-03-04,Australian economy grew 0.8% in the December quarter,https://www.abs.gov.au/media-centre/media-releases/australian-economy-grew-08-december-quarter,24.md,No,,,
2026-03-05,Building Tasmania to supercharge delivery,https://www.premier.tas.gov.au/latest-news/2026/march/building-tasmania-to-supercharge-delivery,240.md,No,,,
2026-03-05,Tasmania’s role as Australia’s Antarctic Gateway celebrated with French icebreaker visit,https://www.premier.tas.gov.au/latest-news/2026/march/tasmanias-role-as-australias-antarctic-gateway-celebrated-with-french-icebreaker-visit,241.md,Yes,"Ministerial, Diplomatic, and International Engagements",Tasmania,"The partnership between Tasmania and France in Antarctic research and logistics underscores significant ESG considerations, including climate resilience, ocean governance, and sustainable resource management. Tasmania’s role as an Antarctic gateway supports scientific collaboration on climate and fisheries, which has implications for environmental stewardship. The ongoing investment in Antarctic infrastructure and the economic contribution of the sector highlight the importance of responsible governance and sustainable development. However, increased activity in the region also raises concerns about environmental impact, ecosystem protection, and the need for strict compliance with international environmental standards to mitigate risks associated with climate change and resource exploitation."
2026-03-05,Interim Redress Scheme for Historical Forced Adoptions now open,https://www.premier.tas.gov.au/latest-news/2026/march/interim-redress-scheme-for-historical-forced-adoptions-now-open,242.md,No,,,
2026-03-05,Labor must outline their tax plan,https://www.premier.tas.gov.au/latest-news/2026/march/labor-must-outline-their-tax-plan,243.md,No,,,
2026-03-04,North West Regional Hospital redevelopment reaches next stage,https://www.premier.tas.gov.au/latest-news/2026/march/north-west-regional-hospital-redevelopment-reaches-next-stage,244.md,Yes,"Infrastructure, Project Approvals, and EPBC Developments",Tasmania,"The North West Regional Hospital upgrade in Tasmania involves a $14.5 million redevelopment of the Emergency Department and ambulance drop-off area, focusing on improved safety, security, and accessibility. The project aims to enhance patient and staff safety, including better security measures, expanded triage, and facilities for vulnerable populations, aligning with social responsibility goals. The development process emphasizes stakeholder consultation, including clinicians, police, and consumer advocates, reflecting governance and community engagement. Construction is contingent on approvals, highlighting regulatory compliance risks. These upgrades demonstrate a commitment to healthcare quality, safety, and stakeholder inclusivity, with potential implications for operational resilience and community trust."
2026-03-04,Record final demand and nation-leading private investment growth highlight strength of Tasmanian economy,https://www.premier.tas.gov.au/latest-news/2026/march/record-final-demand-and-nation-leading-private-investment-growth-highlight-strength-of-tasmanian-economy,245.md,No,,,
2026-03-03,Legislation tabled to improve protections for long-term caravan park residents,https://www.premier.tas.gov.au/latest-news/2026/march/legislation-tabled-to-improve-protections-for-long-term-caravan-park-residents,246.md,Yes,Legislative and Statutory Developments,Tasmania,"The Residential Parks Bill 2026 introduces regulatory reforms to enhance protections for long-term caravan park residents in Tasmania, including fair rent practices, bond caps, and transparency in utility charges, reducing financial and operational risks for residents. It grants the Tasmanian Civil & Administrative Tribunal increased authority to resolve disputes swiftly, supporting social safeguards and fair governance. These measures aim to balance residents' rights with park operators' interests, potentially impacting compliance obligations and operational costs for businesses in the housing and tourism sectors, while addressing social equity and community well-being in the context of affordable housing and visitor economy sustainability."
2026-03-04,Legislation to freeze National Construction Code tabled,https://www.premier.tas.gov.au/latest-news/2026/march/legislation-to-freeze-national-construction-code-tabled,247.md,No,,,
2026-03-03,State of the State 2026,https://www.premier.tas.gov.au/latest-news/2026/march/state-of-the-state-2026,248.md,Yes,Funding and Grant Announcements,Tasmania,"The Tasmania government emphasizes investments in renewable energy projects like Marinus, aiming to leverage the global energy transition while maintaining low power prices, reflecting environmental sustainability and economic resilience. Significant infrastructure developments, including the Macquarie Point Stadium, Antarctic gateway, and Dowsing Point land release, highlight commitments to community development, tourism, and housing affordability, with a focus on sustainable urban planning. Efforts to reduce red tape, support small businesses, and improve healthcare access, especially for women, demonstrate social responsibility. Additionally, reforms to streamline government services and foster economic growth indicate strong governance aimed at long-term societal and environmental benefits."
2026-03-03,Progress on Kangaroo Bay development welcomed,https://www.premier.tas.gov.au/latest-news/2026/march/progress-on-kangaroo-bay-development-welcomed,249.md,No,,,
2026-03-03,Total approvals fall in January,https://www.abs.gov.au/media-centre/media-releases/total-approvals-fall-january,25.md,No,,,
2026-03-03,Doctors receive a pay rise,https://www.premier.tas.gov.au/latest-news/2026/march/doctors-receive-a-pay-rise,250.md,No,,,
2026-02-27,Heavy vehicle sustainability guide released with support from Green Industries SA,https://www.greenindustries.sa.gov.au/news/heavy-vehicle-sustainability-guide-released,251.md,Yes,Funding and Grant Announcements,National,"Heavy Vehicle Industry Australia has launched the Moving Forward Sustainability Guide, supported by Green Industries SA, to promote decarbonisation, circularity, and sustainability risk management among industry members. The initiative aims to address emissions reduction challenges through improved reporting obligations, policy awareness, and practical case studies, aligning with regulatory and stakeholder expectations for environmental performance. The program’s funding from the LEAP grant underscores government and industry collaboration to enhance resource efficiency and sustainability practices, potentially reducing transition risks and reputational impacts for businesses in the heavy vehicle sector."
2026-03-02,Level Crossing Removal2 March 2026Making progress in Melton News,https://bigbuild.vic.gov.au/news/level-crossing-removal-project/making-progress-in-melton,252.md,Yes,"Infrastructure, Project Approvals, and EPBC Developments",Victoria,"The Melton infrastructure project involves significant upgrades, including new rail station and bridge constructions aimed at improving safety and reducing congestion, which align with social and governance ESG goals. The removal of dangerous level crossings and the development of accessible, modern transportation infrastructure demonstrate a focus on community safety and stakeholder engagement. However, the project’s scale and construction activities may pose environmental risks related to construction emissions and resource use. Overall, the initiative reflects efforts to enhance urban mobility and safety, with potential implications for regulatory compliance and stakeholder trust in sustainable urban development."
2026-03-01,Big Build Roads1 March 2026Ballan Road traders ready for Spend and Win News,https://bigbuild.vic.gov.au/news/roads/ballan-road-traders-ready-for-spend-and-win,253.md,No,,,
2026-02-27,Victoria's Big Build27 February 2026Transport build ramps up this autumn News,https://bigbuild.vic.gov.au/news/victorias-big-build/transport-build-ramps-up-this-autumn,254.md,No,,,
2026-02-27,Level Crossing Removal27 February 2026New Mordialloc Station set to open in May News,https://bigbuild.vic.gov.au/news/level-crossing-removal-project/new-mordialloc-station-set-to-open-in-may,255.md,Yes,"Infrastructure, Project Approvals, and EPBC Developments",Victoria,"The removal of level crossings on the Frankston Line involves significant infrastructure upgrades, including new rail bridges and an elevated station, aimed at improving safety and reliability. The project incorporates community feedback through design elements reflecting local character and native planting, supporting social and environmental sustainability. Construction activities, such as road closures and detours, may impact local traffic and mobility, highlighting operational and stakeholder engagement considerations. These developments demonstrate a focus on safety, community integration, and environmental enhancement, aligning with broader ESG goals of sustainable urban infrastructure and stakeholder-centered planning."
2026-03-04,Securing long-term investment in Northern Australia,https://minister.infrastructure.gov.au/m-king/media-release/securing-long-term-investment-northern-australia,256.md,Yes,Legislative and Statutory Developments,National,"The Australian Government's extension of the $7 billion Northern Australia Infrastructure Facility (NAIF) to 2036 aims to support economic development, job creation, and infrastructure in northern Australia, with a focus on accountability and governance improvements aligned with best practices. The legislation incorporates recommendations from a 2024 independent review, emphasizing transparency and stakeholder engagement. This long-term investment strategy presents transition risks and opportunities related to regional development, potentially impacting environmental sustainability and social equity in the region. The ongoing review process underscores the importance of balancing economic growth with responsible governance and sustainable development."
2026-03-05,Secretary-General: Press Release,https://press.un.org/en/2026/sgsm23036.doc.htm,257.md,Yes,Legislative and Statutory Developments,International,"The message highlights legal discrimination against women worldwide, with many countries lacking protections for gender equality and enforcement. This legal disparity poses significant ESG risks for businesses, including potential reputational damage, legal liabilities, and operational challenges related to gender-based discrimination. The rollback of progress amid rising authoritarianism and political instability underscores the importance of compliance with evolving gender equality standards and human rights regulations. Companies may face increased stakeholder scrutiny and the need for robust policies to address gender discrimination, aligning with broader ESG goals of promoting social justice, equality, and responsible governance."
2026-03-04,"Triple Lending Capacity, Scale Up Private Capital for Sustainable Development, Secretary-General Urges at European Investment Bank Group Meeting",https://press.un.org/en/2026/sgsm23035.doc.htm,258.md,Yes,"Ministerial, Diplomatic, and International Engagements",International,"The UN Secretary-General highlights the urgent need for increased and scaled-up financing from multilateral development banks like the European Investment Bank to address the global SDG financing gap, particularly for developing countries facing high interest rates and debt distress. Emphasizing reforms to the international financial architecture, the message calls for fairer governance, expanded guarantees, risk-sharing, and mobilization of private capital to fund sustainable development projects such as clean energy, resilient infrastructure, and social protection. These measures aim to mitigate transition and operational risks, promote social inclusion, and ensure more equitable and sustainable economic growth."
2026-03-04,"Activities of Secretary-General in Ethiopia, 12-15 February",https://press.un.org/en/2026/sgt3455.doc.htm,259.md,Yes,"Ministerial, Diplomatic, and International Engagements",International,"The Secretary-General emphasized Africa’s need for increased climate adaptation finance, calling for developed countries to triple funding and mobilize $1.3 trillion annually by 2035, highlighting climate finance as a critical ESG issue. He urged reforms to end resource exploitation and stressed Africa’s potential as a renewable energy hub, which could create sustainable industries and jobs. The focus on climate action, resource management, and equitable development underscores the importance of environmental sustainability, responsible governance, and social equity in Africa’s economic growth and global partnerships."
2026-03-03,Current account deficit widens,https://www.abs.gov.au/media-centre/media-releases/current-account-deficit-widens,26.md,No,,,
2026-03-03,Secretary‑General Appoints Pablo Salazar Canelos of Ecuador United Nations Resident Coordinator in Costa Rica,https://press.un.org/en/2026/sga2395.doc.htm,260.md,No,,,
2026-03-03,"Amid Rising Global Tensions, Secretary-General Urges Trusted Scientific Guidance on Artificial Intelligence, in Remarks to Independent International Panel",https://press.un.org/en/2026/sgsm23034.doc.htm,261.md,No,,,
2026-02-28,"Following Iran Strikes, Secretary-General Warns Security Council of Wider Conflict in Middle East, Calls for De-escalation, Immediate Ceasefire",https://press.un.org/en/2026/sgsm23033.doc.htm,262.md,Yes,"Ministerial, Diplomatic, and International Engagements",International,"The escalation of military conflict in the Middle East, involving US, Israel, and Iran, poses significant ESG risks including potential violations of international law, civilian casualties, and regional instability. The conflict threatens supply chains, maritime security, and global energy markets, especially with Iran’s threat to close the Strait of Hormuz. These developments increase geopolitical and operational risks for businesses, heightening the importance of compliance with international humanitarian law, assessing conflict-related disruptions, and managing reputational risks associated with involvement or stakeholder concerns over human rights and regional stability."
2026-02-28,"Secretary-General Condemns Military Escalation in Middle East, Calls for Cessation of Hostilities",https://press.un.org/en/2026/sgsm23032.doc.htm,263.md,No,,,
2026-02-27,"‘Choose Dignity over Discrimination’, Secretary-General Tells General Assembly Meeting on Global Compact for Safe, Orderly, Regular Migration",https://press.un.org/en/2026/sgsm23031.doc.htm,264.md,Yes,"Ministerial, Diplomatic, and International Engagements",International,"The UN Secretary-General emphasized the need for rights-based, gender-responsive migration governance that respects human dignity and addresses operational challenges such as trafficking, smuggling, and unsafe routes. The call for expanded legal pathways, fair recruitment practices, and protection of vulnerable groups highlights the importance of social inclusion and human rights. Efforts to improve data systems, reduce remittance costs, and integrate climate action reflect environmental and economic considerations. Enhanced international cooperation and investment in social cohesion are crucial for managing migration's social and governance risks, with implications for businesses involved in labor markets, supply chains, and social responsibility initiatives."
2026-03-03,"Novus on Victoria, Chatswood Build-To-Rent approved subject to conditions",https://www.ipcn.nsw.gov.au/news/novus-victoria-chatswood-build-rent-approved-subject-conditions,265.md,Yes,"Infrastructure, Project Approvals, and EPBC Developments",NSW,"The NSW Independent Planning Commission approved the Novus on Victoria build-to-rent development, supporting the national housing target and promoting long-term residential tenancies in a highly accessible area. The approval includes conditions to mitigate environmental and social impacts, such as traffic management, construction impact controls, and public domain improvements. These measures aim to address community concerns about built form, amenity, and traffic congestion, highlighting the importance of regulatory compliance and stakeholder engagement in sustainable urban development. The decision underscores the role of planning authorities in balancing housing supply with environmental and social considerations."
2026-02-27,Prof Haymet addresses Royal Society of NSW annual dinner,https://www.chiefscientist.gov.au/news-and-media/prof-haymet-addresses-royal-society-nsw-annual-dinner,266.md,No,,,
2026-03-02,Stocktake reinforces Australia's strength in critical minerals,https://www.minister.industry.gov.au/ministers/king/media-releases/stocktake-reinforces-australias-strength-critical-minerals,267.md,Yes,"Reports, Data Releases, and Analytical Insights",National,"Australia’s increasing critical mineral resources, vital for clean energy, defense, and manufacturing, reinforce its role in global supply chains and energy transition efforts. The country’s focus on sustainable exploration and resource management supports the transition to net zero and enhances national security. Regulatory and investment initiatives, such as the $3.4 billion Resourcing Australia’s Prosperity program, aim to bolster responsible resource development and geoscience data collection. These developments may influence ESG considerations related to environmental management, ethical sourcing, and supply chain resilience, highlighting Australia’s strategic importance in the global shift toward sustainable and secure critical mineral supplies."
2026-02-27,Increased funding to support South West FOGO services,https://www.wa.gov.au/government/media-statements/Cook%20Labor%20Government/Increased-funding-to-support-South-West-FOGO-services-20260225,268.md,Yes,Funding and Grant Announcements,Western Australia,"The Western Australian government has increased funding support for regional organics recycling programs, including a rebate of $95 per tonne, to reduce landfill waste, lower greenhouse gas emissions, and promote a circular economy. This initiative addresses environmental sustainability and climate resilience by diverting organic waste from landfills and returning nutrients to soils. The interim financial support aims to develop regionally sustainable processing solutions, highlighting commitments to environmental protection, emission reduction, and long-term waste management strategies aligned with broader climate and ecological goals."
2026-02-27,Australian Government General Government Sector Monthly Financial Statements for January 2026,https://ministers.finance.gov.au/financeminister/media-release/2026/02/27/australian-government-general-government-sector-monthly-financial-statements-january-2026,269.md,No,,,
2026-03-02,Winter crops recover with 20% rise in value for 2024-25,https://www.abs.gov.au/media-centre/media-releases/winter-crops-recover-20-rise-value-2024-25,27.md,No,,,
