Date,Title,URL,md_file,ESG_or_not,Story_Type,Jurisdiction,Cross_sector_relevance,Policy_significance,Business_risk_opportunity,Strategic_ESG_signal,Corporate_governance_relevance,Forward_looking_insight,Member Relevance,Rating,Relevance,Output 1,Output 2,Output 3,Output 4,Output 5,Output 6,Hook,One Liner
2026-03-02,Upgraded RLMI gives strongest insight yet into regional labour markets,https://www.jobsandskills.gov.au/news/upgraded-rlmi-gives-strongest-insight-yet-regional-labour-markets,84.md,No,,,,,,,,,,0,Low,,,,,,,,
2026-03-06,"Women on the front line, communities in the lead: drought resilience takes root in Southern Africa",https://www.unccd.int/news-stories/stories/women-front-line-communities-lead-drought-resilience-takes-root-southern,85.md,Yes,Funding and Grant Announcements,International,9,9,9,8,8,9,7,8.627119,High,Grant opportunity – Gender-smart drought resilience in Southern Africa.,"The Gender-Transformative Drought Resilience in Transition States in Southern Africa (GRDSA) Project has advanced country-led drought investment planning and pipelines to enable mobilization of finance, and is financed by the African Development Bank and the Government of Canada.","It invites organisations to submit ideas aligned with gender-transformative drought resilience, community leadership and scalable investments",demonstrate gender-smart approaches that empower women and local communities.,scale community-led drought resilience initiatives aligned with national policies.,provide investable plans and readiness for blended finance to support implementation.,"Drought resilience, women-led","GRDSA funds prep for investment plans in Madagascar, Mozambique, Zimbabwe to mobilise climate finance."
2026-03-02,Renewable energy is a clear solution to the fossil fuel cost chaos: Statement from UN Climate Change Executive Secretary,https://unfccc.int/news/renewable-energy-is-a-clear-solution-to-the-fossil-fuel-cost-chaos-statement-from-un-climate-change,86.md,Yes,"Ministerial, Diplomatic, and International Engagements",International,7,7,7,8,3,8,8,6.728814,Medium,"UN Climate Change Executive Secretary Simon Stiell has given a statement, focusing on renewables, energy security and sovereignty, fossil fuel cost chaos.",,,,,,Coal loses pace?,"UN says renewables cheaper and safer, but global shift needs faster support for developing nations."
2026-03-04,Securing long-term investment in northern Australia,https://www.naif.gov.au/media-centre/securing-long-term-investment-in-northern-australia/,87.md,Yes,Legislative and Statutory Developments,National,6,8,6,5,6,7,9,6.440678,Medium,Statutory development – NAIF extension.,The Australian Government has introduced the NAIF Amendment Bill 2026 to extend the investment period to 30 June 2036.,"Northern Australia Infrastructure Facility Amendment Bill 2026 extends NAIF's investment period to 30 June 2036 across northern Australia, unless future reviews authorise a longer term.","The government says NAIF has already delivered more than $4 billion in commitments to northern economic development; amendments require reviews to commence after 30 June 2029 and 30 June 2034, with potential extensions considered by then.",,,NAIF extended,"Bill extends the investment window to 2036, securing jobs and infrastructure funding in the north."
2026-03-02,New NAIF CEO Neil MacDonald Commences Role Based in Cairns,https://www.naif.gov.au/media-centre/new-naif-ceo-neil-macdonald-commences-role-based-in-cairns/,88.md,No,,,,,,,,,,0,Low,,,,,,,,
2026-03-09,MRIWA RESEARCH SHOWCASE 2026,https://www.mriwa.wa.gov.au/news-and-events/mriwa-events/mriwa-research-showcase-2026/,89.md,Yes,Consultation and Policy Design Opportunities,Western Australia,8,4,7,7,5,7,6,6.322034,Medium,MRIWA is consulting on scope expansion into clean energy and emissions reduction for MRIWA Consultation on Scope Expansion into Clean Energy and Emissions Reduction that aims to align research and policy development.,,,,,,AI in mining?,Industry gathers 9 March 2026 to map automation-driven efficiency and risks in sustainable resources.
2026-03-09,Innovative green hydrogen and ammonia project to cut emissions for Moree farms,https://www.planning.nsw.gov.au/news/innovative-green-hydrogen-and-ammonia-project-cut-emissions-moree-farms,90.md,No,,,,,,,,,,0,Low,,,,,,,,
2026-03-04,"More than 7,800 homes declared State significant",https://www.planning.nsw.gov.au/news/more-than-7800-homes-declared-state-significant,91.md,Yes,"Infrastructure, Project Approvals, and EPBC Developments",NSW,6,7,5,5,7,4,6,5.694915,Medium,17 projects have been declared as State Significant Development following recommendations from the Housing Delivery Authority in New South Wales.,"If all are lodged and approved, this could create more than 7,800 homes including affordable housing across New South Wales.",,,,,SSD declarations rise,"HDA recommendations could unlock 7,800 homes, boosting NSW housing supply and affordability."
2026-03-02,Speeding up the planning system to get shovels in the ground sooner,https://www.planning.nsw.gov.au/news/speeding-up-the-planning-system-to-get-shovels-in-the-ground-sooner,92.md,Yes,Legislative and Statutory Developments,NSW,7,8,7,6,7,7,7,7.016949,High,Statutory development – Planning reforms.,The NSW government has issued the second proclamation under the Planning Systems Reform Act 2025 to fast-track assessments.,"The Planning Systems Reform Act 2025 enables targeted assessment pathways and approvals for modifications to DAs in NSW, unless environmental impacts disqualify them.",The reforms take effect on 21 March 2026; officials say targeted pathways could cut assessments by up to 50 per cent for low‑risk development and 14‑day approvals apply to modifications with no environmental impacts.,,,NSW fast-tracks approvals,"Targeted pathways halve timelines for low-risk development, as 14-day modifications speed decisions."
2026-03-05,Synchrotron X-rays reveal pathway to greener fertiliser production,https://www.ansto.gov.au/news/synchrotron-x-rays-reveal-pathway-to-greener-fertiliser-production,93.md,Yes,"Reports, Data Releases, and Analytical Insights",National,8,7,8,7,4,8,8,7.067797,High,"Australia’s national decarbonisation strategy and growing policy focus on green ammonia and fertiliser technologies have implications for fertiliser emissions intensity, says ANSTO.","""Operando X-ray methods are increasingly essential for understanding modern electrocatalysts"", the ANSTO says.",,,,,Green nitrogen breakthrough,"Operando XAS reveals copper–cobalt catalyst stability, advancing green ammonia and urea pathways in Australia."
2026-03-02,"Mine Land Rehabilitation Authority (MLRA) Closure -Important announcement from Dr Jen Brereton, CEO of the MLRA",https://www.mineland.vic.gov.au/events/mine-land-rehabilitation-authority-mlra-closure-important-announcement-from-dr-jen-brereton-ceo-of-the-mlra/,94.md,Yes,Corporate and Institutional ESG Actions,Victoria,7,6,8,6,4,5,4,5.983051,Medium,The Mine Land Rehabilitation Authority (MLRA) has issued a closure notice on mine rehabilitation in Victoria effective on 20 March 2026.,,,,,,End of rehabilitation authority,"Victoria's MLRA closes March 20, 2026, transitioning projects and information to successors."
2026-03-06,Torres Strait prepares for H5 bird flu,https://www.dcceew.gov.au/about/news/torres-strait-prepares-h5-bird-flu,95.md,Yes,Funding and Grant Announcements,Queensland,7,7,8,8,6,8,6,7.288136,High,Grant opportunity – Eradication of invasive rats on Warul Kawa for H5 preparedness.,More than $1.5 million has been allocated to the Torres Strait Regional Authority to prepare for H5 avian influenza.,"Eligible projects should demonstrate community-led, island-specific eradication and species protection actions",Lead project governance by the Maluilgal Registered Native Title Body Corporate.,Deploy drone-enabled baiting to eradicate invasive rats on Warul Kawa.,Demonstrate measurable conservation outcomes by protecting migratory birds and reducing disease risk.,Funding to curb rats,A$1.5 million backs TSRA-led rat eradication on Warul Kawa to shield migratory birds from H5.
2026-03-06,Australia and Canada sign first clean energy partnership,https://www.dcceew.gov.au/about/news/australia-canada-sign-first-clean-energy-partnership,96.md,Yes,"Ministerial, Diplomatic, and International Engagements",International,9,9,9,9,7,9,8,8.661017,High,"Minister for Climate Change and Energy Chris Bowen has delivered a statement, focusing on trade, investment, standards and supply chains; grid modernisation and resilience; energy and hard-to-abate sectors; indigenous engagement; climate change adaptation.",,,,,,Australia and Canada energy pact,"Two nations launch a partnership to accelerate net zero, trade, grids, and adaptation."
2026-03-04,Clean energy advice for First Nations peoples,https://www.dcceew.gov.au/about/news/clean-energy-advice-first-nations-peoples,97.md,Yes,Funding and Grant Announcements,National,6,8,8,8,5,8,9,7.237288,High,Grant opportunity – First Nations clean energy advice grants.,"The Australian Government has invested over $39 million across 3 years to help First Nations communities build skills, confidence and knowledge in clean energy.",Eligibility criteria and how to apply are published,"Provide grants for training, planning and professional advice to build skills in clean energy.",Support community leadership with First Nations deciding what advice is needed.,"Align projects with the First Nations Clean Energy Strategy goals to power communities, enable equitable partnerships and achieve economic benefits.",First Nations energy grants,Australia funds $39m for First Nations clean energy grants; Round 1 opens March 4.
2026-03-03,World Wildlife Day: protecting native plants,https://www.dcceew.gov.au/about/news/world-wildlife-day-protecting-native-plants,98.md,Yes,Funding and Grant Announcements,National,7,8,7,8,3,7,7,6.711864,Medium,Grant opportunity – Protection of threatened native plants under the Saving Native Species program.,The Australian Government has invested more than $700 million to protect threatened plants and animals.,"It invites projects that demonstrate the recovery of threatened native plant species through seed collection, cultivation and habitat restoration.",demonstrate recovery of threatened native plant species through seed collection and seed storage.,deploy propagation of cuttings to improve genetic diversity.,enable habitat restoration and protection through fencing repair and weed and feral animal management.,Funding to save flora,"AU govt allocates over $700m to recover threatened plants, linking First Nations, scientists and communities."
2026-03-02,Have your say on the new national H2 Regulatory Guidebook for Pipelines,https://www.dcceew.gov.au/about/news/hys-new-national-h2-regulatory-guidebook-pipelines,99.md,Yes,Consultation and Policy Design Opportunities,National,7,8,6,6,6,7,7,6.694915,Medium,The regulator is consulting on the National Hydrogen Regulatory Guidebook: Pipelines for hydrogen infrastructure regulation that provides a roadmap to navigating Australia’s regulatory frameworks.,Submissions are due by 5:00 pm (AEST) on Monday 13 April 2026.,,,,,Hydrogen pipeline rules,Consultation opens on the regulatory guidebook; submissions due by 13 April 2026.
2026-03-06,Television interview - Sky Newsday,https://www.pm.gov.au/media/television-interview-sky-newsday-0,100.md,No,,,,,,,,,,0,Low,,,,,,,,
2026-03-05,"Press conference - Parliament House, Canberra",https://www.pm.gov.au/media/press-conference-parliament-house-canberra-45,101.md,No,,,,,,,,,,0,Low,,,,,,,,
2026-03-05,Australia-Canada Joint Statement,https://www.pm.gov.au/media/australia-canada-joint-statement,102.md,Yes,"Ministerial, Diplomatic, and International Engagements",International,8,7,8,7,7,7,7,7.338983,High,"The Prime Minister of Australia, the Honourable Anthony Albanese MP, has delivered a statement in Canberra to the Prime Minister of Canada, focusing on strengthening bilateral partnership, regional security and climate cooperation.",,,,,,Canada Australia deepens cooperation,"Leaders launch minister talks and new partnerships to deepen security, trade and clean energy ties."
2026-03-05,Welcome to the Prime Minister of Canada,https://www.pm.gov.au/media/welcome-prime-minister-canada,103.md,Yes,"Ministerial, Diplomatic, and International Engagements",International,7,5,7,7,4,6,7,6.050847,Medium,"Prime Minister Carney has delivered a speech in Parliament to the Canadian delegation, focusing on climate change, clean energy, defence industry co-operation, and the strengthening of bilateral partnership.",,,,,,Australia–Canada alliance deepens,"Mid-power partnership aligns clean energy, critical minerals, defence cooperation, and pension fund leverage."
2026-03-05,"Opening remarks - Parliament House, Canberra",https://www.pm.gov.au/media/opening-remarks-parliament-house-canberra-2,104.md,Yes,"Ministerial, Diplomatic, and International Engagements",International,7,6,8,6,6,6,6,6.508475,Medium,"ANTHONY ALBANESE, PRIME MINISTER OF AUSTRALIA has given a speech in Australia to your delegation, focusing on cooperation across climate change, defence, technology, social policy including the ban on social media for under 16s and productivity and social cohesion.",,,,,,Global cooperation ahead,"Australia and Canada fuse defence, AI, and minerals talks to bolster world governance."
2026-03-04,Retirement of Pat Turner AM,https://www.pm.gov.au/media/retirement-pat-turner-am,105.md,Yes,"Community, First Nations, and Social Licence Initiatives",National,6,7,6,6,7,6,1,6.152542,Medium,"The Australian Government has announced outcomes under the National Agreement on Closing the Gap, which aims to promote inclusive participation and self-determination for First Nations communities.",,,,,,Farewell to a leader,"Australia honours Pat Turner, linking Closing the Gap gains to future policy direction."
2026-03-04,Why we're building high speed rail,https://www.pm.gov.au/media/why-were-building-high-speed-rail,106.md,Yes,"Infrastructure, Project Approvals, and EPBC Developments",National,8,7,8,8,6,8,9,7.559322,High,The government has legislated the High Speed Rail Authority to develop the business case and has moved the Sydney to Newcastle stage into the development phase.,"The business case shows that investing in this first leg of the high-speed rail network will generate around $250 billion in economic activity here in Australia and will add 99,000 jobs and 160,000 new households to the Hunter region.",,,,,Rail links future growth,"Government advances Newcastle–Sydney fast link; 99,000 jobs and $250 billion in regional output."
2026-03-02,Television interview - ABC 7.30,https://www.pm.gov.au/media/television-interview-abc-730-16,107.md,No,,,,,,,,,,0,Low,,,,,,,,
2026-03-05,Federal Court Star Entertainment judgment,https://www.aicd.com.au/news-media/media-releases/2026/federal-court-star-entertainment-judgment.html,108.md,Yes,"Compliance, Oversight, and Enforcement Actions",National,6,7,7,6,8,7,4,6.728814,Medium,ASIC has been unable to make the case against the directors concerning breaches of the duty of care and diligence under the corporate governance framework.,,,,,,Duty clarified?,ASIC intensifies focus on board oversight of non-financial risk.
2026-03-03,AICD Gender Diversity Snapshot,https://www.aicd.com.au/news-media/media-releases/2026/aicd-gender-diversity-snapshot.html,109.md,Yes,Corporate and Institutional ESG Actions,National,8,7,8,8,9,7,6,7.762712,High,"AICD has issued the ""Gender Diversity Snapshot"" on gender diversity.",,,,,,Boards near parity?,"ASX gender diversity sits at 37.6–43.8% across tiers; leadership gaps remain, momentum must continue."
2026-03-05,WTO members conclude month-long reform discussions in Geneva,https://www.wto.org/english/news_e/news26_e/refrm_05mar26_306_e.htm,110.md,No,,,,,,,,,,0,Low,,,,,,,,
2026-03-06,"Chair of agriculture talks circulates revised draft text, as MC14 outline emerges",https://www.wto.org/english/news_e/news26_e/agng_06mar26_309_e.htm,111.md,No,,,,,,,,,,0,Low,,,,,,,,
2026-03-06,DG Okonjo-Iweala urges members to explore new ways to revitalize WTO at South-South event,https://www.wto.org/english/news_e/news26_e/devel_06mar26_308_e.htm,112.md,No,,,,,,,,,,0,Low,,,,,,,,
2026-03-06,"Ahead of Women’s Day, WEIDE Fund announces US$ 1.76-million grants to women-led businesses",https://www.wto.org/english/news_e/news26_e/women_06mar26_305_e.htm,113.md,No,,,,,,,,,,0,Low,,,,,,,,
2026-03-06,"EU contributes EUR 75,000 to support LDC participation at MC14",https://www.wto.org/english/news_e/pres26_e/pr991_301_e.htm,114.md,Yes,Funding and Grant Announcements,International,7,3,4,6,0,3,2,3.813559,Low,Grant opportunity – WTO MC14 participation grants for LDC government officials.,"The European Union has contributed EUR 75,000 (approximately CHF 69,500) to support the participation of government officials from least developed countries at the WTO's 14th Ministerial Conference in Yaoundé, Cameroon.",Eligibility is invited from projects that enable broad and inclusive participation of LDC government officials at MC14,Enable broad and inclusive participation of LDC government officials at MC14.,Scale efficient and transparent deployment of the grant funds.,Demonstrate measurable impact on decision-making and WTO engagement by LDC participants.,Inclusive WTO funding,"Brussels commits €75,000 to enable least-developed-country officials’ participation at MC14 in Yaoundé."
2026-03-06,"EU contributes EUR 1 million to strengthen trade capacity in developing economies, LDCs",https://www.wto.org/english/news_e/pres26_e/pr990_300_e.htm,115.md,No,,,,,,,,,,0,Low,,,,,,,,
2026-03-04,"Government Procurement Committee discusses GPA implementation, progress in accessions",https://www.wto.org/english/news_e/news26_e/gpro_04mar26_307_e.htm,116.md,No,,,,,,,,,,0,Low,,,,,,,,
2026-03-04,"Heads of WTO, EIB sign landmark agreement to boost trade and investment",https://www.wto.org/english/news_e/news26_e/serv_04mar26_303_e.htm,117.md,No,,,,,,,,,,0,Low,,,,,,,,
2026-03-03,WTO members consider new e-commerce proposal and previous submissions ahead of MC14,https://www.wto.org/english/news_e/news26_e/ecwp_03mar26_304_e.htm,118.md,No,,,,,,,,,,0,Low,,,,,,,,
2026-03-03,"WTO members review five regional trade agreements, discuss transparency issues",https://www.wto.org/english/news_e/news26_e/rta_03mar26_299_e.htm,119.md,No,,,,,,,,,,0,Low,,,,,,,,
2026-03-02,"WTO MSME Group welcomes expansion, highlights successful entrepreneurs and MC14 plans",https://www.wto.org/english/news_e/news26_e/igmsm_02mar26_302_e.htm,120.md,No,,,,,,,,,,0,Low,,,,,,,,
2026-03-04,In Memoriam: Rafeeuddin Ahmed,https://www.untourism.int/news/in-memoriam-rafeeuddin-ahmed,121.md,No,,,,,,,,,,0,Low,,,,,,,,
2026-03-04,UN Tourism and TUI Care Foundation join hands to support Rural Artists and Artisans Across Africa,https://www.untourism.int/news/un-tourism-and-tui-care-foundation-join-hands-to-support-rural-artists-and-artisans-across-africa,122.md,Yes,Funding and Grant Announcements,International,9,5,8,9,2,7,7,6.711864,Medium,Grant opportunity – Tourism for Rural Development Small Grants Programme.,"The Tourism for Rural Development Small Grants Programme has opened its first call for proposals across Africa, enabling five NGOs to support artisans and uplift communities through community-led tourism.",Eligibility invites non profit organisations focused on community led tourism heritage protection and rural livelihoods,Demonstrate impact on income generation for local artisans and SMEs.,Scale women and youth participation in creative and entrepreneurial activities.,Deliver training and partnerships that improve market access and sustainable tourism value chains.,Rural funds unlocked,Five African NGOs win UN-TUI funds to empower artisans and boost rural livelihoods.
2026-03-05,Catalyzing Investments to Scale Up Climate-Resilient Agriculture: India Landscape Accelerator Launch,https://www.wbcsd.org/news/catalyzing-investments-to-scale-up-climate-resilient-agriculture-india-landscape-accelerator-launch/,123.md,Yes,Corporate and Institutional ESG Actions,International,9,8,9,8,8,8,8,8.338983,High,"WBCSD, as part of COP28's Action Agenda on Regenerative Landscapes, has launched the ""India Landscape Accelerator"".",,,,,,ILA launches strategy,Private sector and governments mobilize investments to scale climate-resilient agri-food in India through transition plans.
2026-03-04,How internal carbon pricing can support capital allocation and risk management,https://www.wbcsd.org/news/how-internal-carbon-pricing-can-support-capital-allocation-and-risk-management/,124.md,Yes,Corporate and Institutional ESG Actions,International,9,9,9,9,9,9,9,9,High,"WBCSD Corporate Performance & Accountability and Climate teams has issued guidance on ""Internal Carbon Pricing"".",The guidance recommends escalation of internal carbon prices for long-lived investments and clarifies governance and ownership of ICP.,,,,,ICP reshapes capital,CFOs apply escalating shadow prices to capex and protect margins as CBAM tightens.
2026-03-09,Top 3 questions before requesting lodgment deferrals,https://www.ato.gov.au/tax-and-super-professionals/for-tax-professionals/tax-professionals-newsroom/top-3-questions-before-requesting-lodgment-deferrals,125.md,No,,,,,,,,,,0,Low,,,,,,,,
2026-03-06,The countdown is on for Payday Super!,https://www.ato.gov.au/businesses-and-organisations/small-business-newsroom/the-countdown-is-on-for-payday-super,126.md,No,,,,,,,,,,0,Low,,,,,,,,
2026-03-06,Late payment offset will no longer be available,https://www.ato.gov.au/businesses-and-organisations/small-business-newsroom/late-payment-offset-will-no-longer-be-available,127.md,No,,,,,,,,,,0,Low,,,,,,,,
2026-03-05,SBSCH users must download their records before 30 June,https://www.ato.gov.au/tax-and-super-professionals/for-tax-professionals/tax-professionals-newsroom/sbsch-users-must-download-their-records-before-30-june,128.md,No,,,,,,,,,,0,Low,,,,,,,,
2026-03-05,Public country-by-country reporting lodgment instructions available,https://www.ato.gov.au/businesses-and-organisations/business-bulletins-newsroom/public-country-by-country-reporting-lodgment-instructions-available,129.md,No,,,,,,,,,,0,Low,,,,,,,,
2026-03-05,About the Register of Foreign Ownership of Australian Assets,https://www.ato.gov.au/individuals-and-families/investments-and-assets/foreign-resident-investments/foreign-investment-in-australia/register-of-foreign-ownership-of-australian-assets/about-the-register-of-foreign-ownership-of-australian-assets,130.md,No,,,,,,,,,,0,Low,,,,,,,,
2026-03-05,Register of Foreign Ownership of Australian Assets 2024–25 Report,https://www.ato.gov.au/individuals-and-families/investments-and-assets/foreign-resident-investments/foreign-investment-in-australia/register-of-foreign-ownership-of-australian-assets/register-of-foreign-ownership-of-australian-assets-reports/register-of-foreign-ownership-of-australian-assets-2024-25-report,131.md,No,,,,,,,,,,0,Low,,,,,,,,
2026-03-05,ATO consultation report,https://www.ato.gov.au/about-ato/consultation/ato-consultation-report,132.md,No,,,,,,,,,,0,Low,,,,,,,,
2026-03-04,Turning a hobby into income? You might be in business,https://www.ato.gov.au/businesses-and-organisations/small-business-newsroom/turning-a-hobby-into-income-you-might-be-in-business,133.md,No,,,,,,,,,,0,Low,,,,,,,,
2026-03-04,Is your TPAR overdue? Lodge now to avoid penalties,https://www.ato.gov.au/businesses-and-organisations/small-business-newsroom/is-your-tpar-overdue-lodge-now-to-avoid-penalties,134.md,No,,,,,,,,,,0,Low,,,,,,,,
2026-03-03,Climate resilience adds revenue options for Australia’s farmers,https://www.climatechangeauthority.gov.au/climate-resilience-adds-revenue-options-australias-farmers,135.md,Yes,Consultation and Policy Design Opportunities,National,9,8,9,9,9,8,7,8.610169,High,The Climate Change Authority is consulting on the Australian Carbon Credit Unit Scheme review for the ACCU Scheme that aims to deliver abatement for a decarbonising economy.,Submissions are due by 8 December.,,,,,ACCU review underway,Authority weighs emissions scheme calibrations to support faster 2035 targets.
2026-03-05,Carlsberg Raises Climate Ambition With Updated Brewing Tomorrow ESG Programme,https://esgnews.com/carlsberg-raises-climate-ambition-with-updated-brewing-tomorrow-esg-programme/,136.md,No,,,,,,,,,,0,Low,,,,,,,,
2026-03-04,KPMG Appoints Gauthier Acket As Head Of Global ESG,https://esgnews.com/kpmg-appoints-gauthier-acket-as-head-of-global-esg/,137.md,Yes,Corporate and Institutional ESG Actions,International,8,7,8,8,9,8,8,7.983051,High,"KPMG International has appointed Gauthier Acket as Head of Global ESG, succeeding John McCalla-Leacy after more than two decades with the firm.","Gauthier Acket, Head of Global ESG at KPMG International, announced the transition in a LinkedIn post.",,,,,Leadership shift,KPMG names Gauthier Acket Head of Global ESG as regulatory pressure drives climate governance.
2026-03-05,State of the energy transition: Your technology playbook,https://www.csiro.au/en/news/All/Articles/2026/March/State-of-the-Energy-Transition,138.md,Yes,"Reports, Data Releases, and Analytical Insights",National,9,7,8,8,6,9,8,7.847458,High,"Australia's net-zero by 2050 targets have implications for decarbonisation metrics across electricity, low-carbon fuels and mining, says CSIRO.","CSIRO says accelerated RD&D is needed to reduce costs and enable deployment across electricity, transport and mining sectors.",,,,,Policy roadmap,CSIRO highlights sector opportunities to accelerate decarbonisation; calls cross-sector collaboration to cut costs by 2050.
