Date,Title,URL,md_file,ESG_or_not,Story_Type,Jurisdiction,Cross_sector_relevance,Policy_significance,Business_risk_opportunity,Strategic_ESG_signal,Corporate_governance_relevance,Forward_looking_insight,Member Relevance,Rating,Relevance,Output 1,Output 2,Output 3,Output 4,Output 5,Output 6
2026-03-04,AER approves Discover Energy Pty Ltd's application to surrender its gas retailer authorisation,https://www.aer.gov.au/news/articles/communications/aer-approves-discover-energy-pty-ltds-application-surrender-its-gas-retailer-authorisation,1.md,Yes,Legislative and Statutory Developments,National,6,7,6,3,7,5,8,5.779661,Medium,Statutory development – Gas retailer surrender.,The Australian Energy Regulator has approved Discover Energy's surrender of its gas retailer authorisation to transfer customers.,Instrument: surrender of gas retailer authorisation; operative clause: surrender takes effect 4 September 2026 with transfer conditions and obligation to inform customers about Energy Made Easy.,"The AER approved the surrender on 4 March 2026. The surrender takes effect on 4 September 2026 and imposes conditions on customer transfers, alongside ongoing obligations for ombudsman membership. Discover must provide affected customers with information about Energy Made Easy during the transition.",,
2026-03-05,Ballarat pavilion to kick goals for local athletes,https://www.rdv.vic.gov.au/news/ballarat-pavilion-to-kick-goals-for-local-athletes,2.md,Yes,Funding and Grant Announcements,Victoria,6,6,6,6,4,6,6,5.694915,Medium,Grant opportunity – Ballarat pavilion funding under Council Support Package.,"The project has secured $5 million from the Council Support Package to deliver a new pavilion at Frank Bourke Oval, with facilities meeting AFL Victoria and Cricket Australia standards.","Eligible applicants are invited to demonstrate impact on community sport, accessibility and regional activation",demonstrate impact on community sport participation.,demonstrate accessibility and inclusivity improvements.,demonstrate regional activation and economic benefits.
2026-03-04,Innovative glasshouse ready to grow,https://www.rdv.vic.gov.au/news/innovative-glasshouse-ready-to-grow,3.md,Yes,"Infrastructure, Project Approvals, and EPBC Developments",Victoria,9,6,8,7,6,8,6,7.305085,High,Planning authorities have approved the development of the Rijk Zwaan glasshouse facility in Bacchus Marsh.,The project commits to creating 40 new full-time jobs by next year.,,,,
2026-03-02,Happy trails for locals and visitors in Leongatha,https://www.rdv.vic.gov.au/news/happy-trails-for-locals-and-visitors-in-leongatha,4.md,Yes,Funding and Grant Announcements,Victoria,8,8,7,7,7,8,7,7.491525,High,Grant opportunity – Leongatha Great Southern Rail Trail precinct rejuvenation.,"The package has secured $6 million for the Leongatha precinct, with additional support exceeding $10 million for the rail trail across four stages and a further $100,000 towards activation initiatives.",Eligibility focuses on improving visitor experience and regional connectivity through heritage assets and activation initiatives,Improve historic railway precincts and visitor amenities.,Expand pedestrian and cycling links to town centres.,Activate local economies through community events and public spaces.
2026-03-02,New acreage release in the Beetaloo Sub-basin,https://resourcingtheterritory.nt.gov.au/news-and-events/news/2026/new-acreage-release-in-the-beetaloo-sub-basin,5.md,No,,,,,,,,,,0,Low,,,,,,
2026-03-03,Drier conditions on the horizon after record year,https://www.agriculture.gov.au/about/news/abares-march-reports,6.md,No,,,,,,,,,,0,Low,,,,,,
2026-03-08,Recognising Australia’s female farmers on International Women’s Day,https://www.agriculture.gov.au/about/news/IWD-2026,7.md,Yes,"Community, First Nations, and Social Licence Initiatives",Queensland,6,6,6,6,5,7,3,5.898305,Medium,"Community bodies have announced initiatives under the International Year of the Woman Farmer, which aims to inclusive participation.",,,,,
2026-03-09,World Wood Day 2026: Building Queensland’s future with sustainable timber,https://www.dpi.qld.gov.au/news-media/news/world-wood-day,8.md,Yes,Consultation and Policy Design Opportunities,Queensland,9,8,8,8,8,8,9,8.20339,High,"Queensland Government is consulting on the Queensland Future Timber Plan 2050 for forestry and timber policy that aims to secure a sustainable, innovative and productive industry.",,,,,
2026-03-05,Join us at Your Catch Counts activation events,https://www.dpi.qld.gov.au/news-media/news/join-us-at-our-activation-events,9.md,Yes,"Community, First Nations, and Social Licence Initiatives",Queensland,7,8,7,6,4,6,1,6.20339,Medium,"Fisheries Queensland has announced outreach events under the Your Catch Counts program, which aims to ensure inclusive participation in sustainable fishing.",,,,,
2026-03-03,Joint media release: Australia's agricultural production on track to exceed 2030 industry target,https://minister.agriculture.gov.au/collins/media-release/joint-media-release-national-farmers-federation-aus-agriculture-production-2026,10.md,Yes,"Reports, Data Releases, and Analytical Insights",National,8,7,8,6,8,7,6,7.305085,High,"The forecast to exceed the $100 billion target has implications for regional jobs and export capacity, says Australian Bureau of Agricultural Resources Economics and Sciences (ABARES).","""This forecast gives Australians 100 billion reasons to thank our farmers, whose hard work, resilience and skill is helping power our national economy,"" the Australian Government says.","""Australia’s farm gate production value will hit a record $101.4 billion in 2025-26, and $107.4 billion when combined with fisheries and forestry,"" the ABARES says.",,,
2026-03-08,Supporting women to leave abusive relationships,https://www.gov.scot/news/supporting-women-to-leave-abusive-relationships/,11.md,Yes,Funding and Grant Announcements,International,8,8,8,7,7,8,2,7.491525,High,Grant opportunity – Fund to Leave initiative.,"The Scottish Government has provided £2 million for the Fund to Leave for 2026-27 to increase emergency financial support for up to 2,400 women and their children escaping abusive relationships.",It invites applications that demonstrate how funding will enable immediate financial support and safe relocation for those leaving abuse,provide immediate financial support for essentials when leaving an abusive partner.,"pay rent, afford transport and buy essentials including food and clothing.",support women with no recourse to public funds to apply.
2026-03-06,Growing Scotland's entrepreneurial economy,https://www.gov.scot/news/growing-scotlands-entrepreneurial-economy-2/,12.md,No,,,,,,,,,,0,Low,,,,,,
2026-03-05,New law supports digital economy,https://www.gov.scot/news/new-law-supports-digital-economy/,13.md,Yes,Legislative and Statutory Developments,International,7,8,7,6,7,7,8,7.050847,High,Statutory development – Digital assets.,The Scottish Parliament has passed Stage 3 of the Digital Assets (Scotland) Bill to boost legal protection for digital assets.,"Instrument: Digital Assets (Scotland) Bill provides greater legal protection to digital assets across Scotland, clarifying ownership rights for investors and businesses.","Meanwhile, the government says Scotland's fintech sector is worth £14 billion and has grown from 26 companies in 2018 to more than 260 in 2026, with the Stage 3 approval confirmed on 5 March 2026.",,
2026-03-04,Supporting care home residents’ right to visit loved ones,https://www.gov.scot/news/supporting-care-home-residents-right-to-visit-loved-ones-2/,14.md,Yes,Legislative and Statutory Developments,International,6,9,7,8,7,7,1,7.118644,High,Statutory development – Anne’s Law regulations.,The Scottish Parliament has approvedAnne’s Law regulations guaranteeing care home residents access to visits.,"The Anne’s Law regulations enshrine the right to contact in care homes, allowing visiting unless suspension is essential to prevent serious risk, with end-of-life exceptions.",The regulations sit under the Care Reform (Scotland) Act 2025 and received unanimous approval on 4 March 2026; accompanying guidance and a code of practice are in development.,,
2026-03-04,Help for veterans and families,https://www.gov.scot/news/help-for-veterans-and-families/,15.md,Yes,Funding and Grant Announcements,International,8,8,7,8,7,6,2,7.169492,High,Grant opportunity – Scottish Veterans Fund.,"The Scottish Government has committed £600,000 for the 2026-27 round and has boosted the fund by £100,000, with allocations across 30 projects.",This opportunity invites organisations supporting veterans across Scotland to demonstrate impact.,"demonstrate impact on confidence, reintegration to civilian life and employment opportunities for veterans through targeted activities.","address mental health, financial wellbeing and access to services for veterans and their families.",prioritise projects that reach less heard from parts of the veteran community and align with strategic recommendations.
2026-03-04,Cheaper bus travel for Highland communities,https://www.gov.scot/news/cheaper-bus-travel-for-highland-communities/,16.md,Yes,Consultation and Policy Design Opportunities,International,8,8,7,7,5,8,8,7.220339,High,Scottish Government is consulting on the £2 bus fare cap pilot for transport that aims to support households hit by rising everyday costs.,,,,,
2026-03-04,Improving delivery across health and social care,https://www.gov.scot/news/improving-delivery-across-health-and-social-care/,17.md,Yes,"Infrastructure, Project Approvals, and EPBC Developments",International,7,8,7,7,8,8,3,7.338983,High,"Public Services Delivery Scotland has been established to lead transformation across the health and care system and the wider public sector in Scotland, replacing NHS Education for Scotland and NHS National Services Scotland.",The proposal will reduce duplication and scale what works to give frontline teams more time with patients.,,,,
2026-03-04,Accelerating growth in Grangemouth,https://www.gov.scot/news/accelerating-growth-in-grangemouth/,18.md,Yes,Funding and Grant Announcements,International,9,8,9,8,8,9,8,8.491525,High,Grant opportunity – Energy.,"The £10 million investment has been announced to support the expansion into large‑scale production, creating 149 new jobs in Grangemouth by 2030.",Eligible projects are invited to meet the following focus areas,demonstrate job creation and local employment impact.,demonstrate delivery of practical skills training or pathways into sustainable industries.,demonstrate capability to scale biochemicals production and integrate with green energy targets.
2026-03-03,Modernising Scotland's contract law,https://www.gov.scot/news/modernising-scotlands-contract-law/,19.md,No,,,,,,,,,,0,Low,,,,,,
2026-03-03,Investing in Ferguson Marine,https://www.gov.scot/news/investing-in-ferguson-marine/,20.md,No,,,,,,,,,,0,Low,,,,,,
2026-03-06,First CBAM Certificate price to be published on 7 April,https://taxation-customs.ec.europa.eu/news/first-cbam-certificate-price-be-published-7-april-2026-03-06_en,21.md,Yes,Consultation and Policy Design Opportunities,International,9,10,9,9,8,8,7,8.79661,High,The European Commission is consulting on the Common Central Platform procurement for CBAM certificate management as part of the operational implementation of the CBAM framework.,Submissions are due by 20 March 2026 at 12:00:59 (UTC+01:00) Central European Time.,,,,
2026-03-03,"Protein powder, sunglasses, moisturiser: what do these products have in common? If you buy them online, they most likely violate EU product standards",https://taxation-customs.ec.europa.eu/news/protein-powder-sunglasses-moisturiser-what-do-these-products-have-common-if-you-buy-them-online-they-2026-03-03_en,22.md,Yes,"Compliance, Oversight, and Enforcement Actions",International,9,9,8,8,8,8,2,8.135593,High,"In line with guidance from the European Commission, the Commission services has issued a notice concerning e-commerce imports under EU customs rules.",,,,,
2026-03-02,Commission Unveils Updated Learning Opportunities for Customs and Tax Professionals,https://taxation-customs.ec.europa.eu/news/commission-unveils-updated-learning-opportunities-customs-and-tax-professionals-2026-03-02_en,23.md,Yes,Consultation and Policy Design Opportunities,International,7,6,4,2,4,7,5,5.033898,Medium,The European Commission is consulting on the Special Scheme for Small Enterprises and the updated SAMANCTA training programme for TAXUD that aims to enhance expertise among customs and taxation departments across the European Union.,,,,,
2026-03-02,CBAM call for tender to establish the Common Central Platform (CCP),https://taxation-customs.ec.europa.eu/news/cbam-call-tender-establish-common-central-platform-ccp-2026-03-02_en,24.md,Yes,"Infrastructure, Project Approvals, and EPBC Developments",International,9,9,8,9,8,8,6,8.423729,High,The 27 EU Member States and the European Commission have signed a Joint Procurement Agreement for the procurement of the CCP.,Interested economic operators are invited to participate in the call for tender and must submit their offers by 20 March 2026 at 12:00:59 (UTC+01:00) Central European Time.,,,,
2026-03-02,Grants to support development of processing facility,https://resources.vic.gov.au/about-us/news/grants-to-support-development-of-processing-facility,25.md,Yes,Funding and Grant Announcements,Victoria,8,7,7,7,2,7,8,6.440678,Medium,Grant opportunity – Advancing Antimony Grants.,The $1million grant program has opened in April as part of Victoria’s Critical Minerals Roadmap to support creating an antimony processing facility in Victoria.,Eligible projects are invited to demonstrate how local antimony processing will be achieved,demonstrate how local processing will boost Victoria's manufacturing capacity.,demonstrate investment attraction and regional job creation.,demonstrate alignment with Victoria’s Critical Minerals Roadmap.
2026-03-02,ATO response to Tax Ombudsman’s review of ATO’s management of GIC remission,https://www.ato.gov.au/media-centre/ato-response-to-tax-ombudsmans-review-of-atos-management-of-gic-remission,26.md,No,,,,,,,,,,0,Low,,,,,,
2026-03-06,IMO Secretary-General: Seafarer deaths in Strait of Hormuz unacceptable,https://www.imo.org/en/MediaCentre/PressBriefings/pages/IMO-secretary-general-statement-strait-of-hormuz-seafarer-deaths-unacceptable.aspx,27.md,Yes,"Ministerial, Diplomatic, and International Engagements",International,8,8,7,6,7,7,4,7.084746,High,"IMO Secretary-General Arsenio Dominguez has delivered a statement, focusing on the protection of seafarers, including their rights and well-being, and the freedom of navigation, in accordance with international law.",,,,,
2026-03-05,Enhancing transparency in Port State Control through an updated data-exchange agreement,https://www.imo.org/en/MediaCentre/Pages/WhatsNew-2433.aspx,28.md,Yes,"Ministerial, Diplomatic, and International Engagements",International,9,9,8,7,8,7,4,7.898305,High,"IMO Secretary-General Arsenio Dominguez has delivered a statement in London, focusing on transparency, cooperation and data sharing in Port State Control through an updated data-exchange agreement with the Paris MoU.",,,,,
2026-03-03,Trinidad and Tobago enhances readiness for hazardous and noxious marine spills,https://www.imo.org/en/MediaCentre/Pages/WhatsNew-2432.aspx,29.md,Yes,"Environmental Protection, Biodiversity, and Nature Policy",International,8,8,7,7,7,7,4,7.237288,High,,,,,,
2026-03-02,New sulphur and nitrogen emission limits enter into force in the Canadian Arctic and the Norwegian Sea,https://www.imo.org/en/MediaCentre/Pages/WhatsNew-2431.aspx,30.md,Yes,"Environmental Protection, Biodiversity, and Nature Policy",International,9,9,8,9,7,8,6,8.271186,High,"""Decreasing SOx and NOx emissions from shipping improves human health by lowering rates of lung cancer, cardiovascular disease, strokes and childhood asthma,"" says the report.","""The new ECAs were designated through [Resolution MEPC.392(82),]( adopted at [MEPC 82]( in October 2024."" says the report.",,,,
2026-03-06,Commission approves €150 million Romanian State aid scheme for electricity storage,https://ec.europa.eu/commission/presscorner/detail/en/ip_26_524,31.md,No,,,,,,,,,,0,Low,,,,,,
2026-03-05,Energy Union Task Force meets to discuss energy security and prices in Europe,https://energy.ec.europa.eu/news/energy-union-task-force-meets-discuss-energy-security-and-prices-europe-2026-03-05_en,32.md,Yes,Consultation and Policy Design Opportunities,International,8,7,6,6,8,6,9,6.915254,Medium,"European Union energy authorities are consulting on energy security and electricity market mechanisms for the Energy Union Task Force that aims to ensure investor certainty and accelerate the deployment of domestic, affordable and clean energy supplies.",,,,,
2026-03-04,Commission and EU countries confirm no immediate oil or gas supply concerns following the disruptions in the Middle East,https://energy.ec.europa.eu/news/commission-and-eu-countries-confirm-no-immediate-oil-or-gas-supply-concerns-following-disruptions-2026-03-04_en,33.md,Yes,"Ministerial, Diplomatic, and International Engagements",International,6,7,6,4,7,7,8,6.237288,Medium,"Directorate-General for Energy has delivered a statement in Brussels to ESG practitioners, investors, policy leads, focusing on energy security of supply and monitoring.",,,,,
2026-03-03,"Press statement of Dan Jørgensen, European Commissioner for Energy and Housing and Parviz Shahbazov, Minister of Energy of the Republic of Azerbaijan",https://energy.ec.europa.eu/news/press-statement-dan-jorgensen-european-commissioner-energy-and-housing-and-parviz-shahbazov-minister-2026-03-03_en,34.md,Yes,"Ministerial, Diplomatic, and International Engagements",International,8,9,9,8,8,8,9,8.372881,High,"Minister Shahbazov has delivered a statement in Baku, focusing on developing natural gas as a flexible and key strategic energy source, cross-regional green energy corridors and interconnectors, and Azerbaijan’s role in green energy.",,,,,
2026-03-03,New call under the EU Renewable Energy Financing Mechanism to support solar PV projects in Bulgaria and Finland,https://cinea.ec.europa.eu/news-events/news/renewfm-new-call-under-eu-renewable-energy-financing-mechanism-support-solar-pv-projects-bulgaria-2026-03-03_en,35.md,Yes,Funding and Grant Announcements,International,8,8,9,8,7,8,8,8.016949,High,Grant opportunity – cross-border renewable energy financing for ground-mounted solar PV.,The Commission has launched a call with a total budget of €54.9 million to provide investment grants for ground-mounted solar PV projects in Bulgaria and Finland.,Applications are invited from eligible project developers and consortia proposing ground-mounted solar PV projects in designated host countries,demonstrate eligibility for investment grants through a competitive tender,deploy ground-mounted solar PV projects in Bulgaria or Finland with scalable deployment potential,participate in a competitive tender process for grant disbursement
2026-03-02,"Commissioner Jørgensen in Azerbaijan to discuss energy security, diversification and clean energy transition",https://energy.ec.europa.eu/news/commissioner-jorgensen-azerbaijan-discuss-energy-security-diversification-and-clean-energy-2026-03-02_en,36.md,Yes,"Ministerial, Diplomatic, and International Engagements",International,8,7,7,7,8,7,9,7.389831,High,"Commissioner for Energy and Housing Dan Jørgensen has delivered a speech in Baku to the 12th Southern Gas Corridor Advisory Council Ministerial meeting and the 4th Green Energy Advisory Council Ministerial meeting, focusing on strengthening the EU-Azerbaijan energy partnership, diversification away from Russian fossil fuels, energy security, competitiveness and decarbonisation.",,,,,
2026-03-05,AEMC proposes improvements to life support customer processes,https://www.aemc.gov.au/news-centre/media-releases/aemc-proposes-improvements-life-support-customer-processes,37.md,Yes,Consultation and Policy Design Opportunities,National,8,8,7,7,8,7,8,7.525424,High,The Australian Energy Market Commission is consulting on the draft determination for improving life support registration and communication for the life support protections program that aims to safeguard vulnerable energy customers.,Submissions are due by 16 April 2026.,,,,
2026-03-02,South Australia rockets up the charts as a global mining destination,https://www.energymining.sa.gov.au/home/news/latest/south-australia-rockets-up-the-charts-as-a-global-mining-destination,38.md,Yes,"Reports, Data Releases, and Analytical Insights",South Australia,8,8,8,7,8,8,8,7.847458,High,"The Fraser Institute’s 2025 Investment Attractiveness Index ranking has implications for South Australia’s policy certainty and regulatory framework in supporting mineral exploration and investment, says the Fraser Institute.","The Fraser Institute says the state’s deep geology, open data and regulatory certainty underpin investment-friendly exploration.",,,,
2026-03-02,AFCA announces three new C-suite appointments,https://www.afca.org.au/news/media-releases/afca-announces-three-new-c-suite-appointments,39.md,Yes,Corporate and Institutional ESG Actions,National,6,7,6,7,4,7,8,6.237288,Medium,"The Australian Financial Complaints Authority has announced three new C-suite appointments including Deborah Jenkins as inaugural Chief Customer Officer, Stevie-Ann Dovico as inaugural Chief Technology Officer, and Brigid Parsonson as Chief Operating Officer.",,,,,
2026-03-05,Joint Statement from the IAASB and IESBA Chairs Welcoming Emily Fitts as Chair of the Monitoring Group,https://www.iaasb.org/news-events/2026-03/joint-statement-iaasb-and-iesba-chairs-welcoming-emily-fitts-chair-monitoring-group,40.md,Yes,"Ministerial, Diplomatic, and International Engagements",International,7,8,6,6,7,6,6,6.661017,Medium,"Gabriela Figueiredo Dias has delivered a statement in New York to the Monitoring Group, focusing on the Monitoring Group’s role in advancing high-quality global standards that serve investors and the broader public interest.",,,,,
2026-03-04,The Skeptic's Pause,https://www.iaasb.org/news-events/2026-03/skeptic-s-pause,41.md,No,,,,,,,,,,0,Low,,,,,,
2026-03-03,"Update on response to Shield and First Guardian collapse, including AFCA membership of financial firms in liquidation",https://www.afca.org.au/news/latest-news/update-on-response-to-shield-and-first-guardian-collapse-including-afca-membership-of-financial-firms-in-liquidation,42.md,Yes,"Compliance, Oversight, and Enforcement Actions",National,7,7,6,6,6,5,8,6.254237,Medium,AFCA has decided that no financial firm (licensees) in liquidation involved in the collapse of the Shield and First Guardian Master Funds will be expelled from AFCA at this time.,,,,,
2026-03-06,Press conference: protection of copyright in the age of artificial intelligence,https://www.europarl.europa.eu/news/en/press-room/20260303IPR37004/press-conference-protection-of-copyright-in-the-age-of-artificial-intelligence,43.md,Yes,Legislative and Statutory Developments,International,8,8,7,7,6,8,4,7.237288,High,Statutory development – Copyright in AI.,The European Parliament has proposed protections for EU creative content against AI training misuse.,"Instrument: draft report to be put to a vote; operative clause empowers right-holders to prevent use of protected content for AI training, and requires that training of EU-generated content be governed by EU law, with safeguards for media pluralism.","The plenary draft sets out safeguards and a voting timeline, with a vote planned at 12:00 CET on 10 March; the text also addresses press sector protection and the use of protected works in AI training, according to the Parliament.",,
2026-03-05,Deal on measures to reinforce farmers’ position in the food supply chain,https://www.europarl.europa.eu/news/en/press-room/20260302IPR36912/deal-on-measures-to-reinforce-farmers-position-in-the-food-supply-chain,44.md,Yes,Legislative and Statutory Developments,International,7,8,7,8,7,8,4,7.372881,High,Statutory development – Farmers’ bargaining power.,EU Parliament and Council negotiators have agreed new rules to strengthen farmers' contractual position in the food chain.,"Instrument: provisional agreement on CMO reforms to strengthen producer organisations and mandate online price benchmarks in contracts EU-wide, with opt-outs for dairy price indicators.","The agreement is awaiting approval by both Parliament and Council before entering into force, as of March 2026, with reference document 20260302IPR36912 and the expectation that online benchmarks will be published by member states.",,
2026-03-05,Press briefing on next week’s plenary session,https://www.europarl.europa.eu/news/en/press-room/20260305IPR37410/press-briefing-on-next-week-s-plenary-session,45.md,Yes,Parliamentary and Political Proceedings,International,7,7,5,6,7,7,6,6.474576,Medium,European Parliament press service is holding a briefing on the 9–12 March plenary session.,,,,,
2026-03-02,International Women’s Day: women’s rights and democracy in the digital age,https://www.europarl.europa.eu/news/en/press-room/20260302IPR36903/international-women-s-day-women-s-rights-and-democracy-in-the-digital-age,46.md,Yes,Parliamentary and Political Proceedings,International,8,7,7,7,6,7,1,6.813559,Medium,European Parliament FEMM committee hosts interparliamentary meeting on women's rights and democracy in the digital age due 5 March 2026.,,,,,
