Date,Title,URL,md_file,ESG_or_not,Story_Type,Jurisdiction,Cross_sector_relevance,Policy_significance,Business_risk_opportunity,Strategic_ESG_signal,Corporate_governance_relevance,Forward_looking_insight,Member Relevance,Rating,Relevance,Output 1,Output 2,Output 3,Output 4,Output 5,Output 6
2026-03-06,15 million people employed in December 2025,https://www.abs.gov.au/media-centre/media-releases/15-million-people-employed-december-2025,47.md,Yes,"Reports, Data Releases, and Analytical Insights",National,8,6,5,3,5,6,5,5.525424,Medium,"The Australian Bureau of Statistics Labour Account release has implications for employed people and hours worked metrics, says the ABS.",The ABS says the 0.7% rise in employed people aligns with a 0.7% rise in hours worked this quarter.,,,,
2026-03-05,Strong growth in services lifts household spending,https://www.abs.gov.au/media-centre/media-releases/strong-growth-services-lifts-household-spending-0,48.md,No,,,,,,,,,,0,Low,,,,,,
2026-03-05,Independent schools drive rise in enrolments,https://www.abs.gov.au/media-centre/media-releases/independent-schools-drive-rise-enrolments,49.md,No,,,,,,,,,,0,Low,,,,,,
2026-03-04,Australian economy grew 0.8% in the December quarter,https://www.abs.gov.au/media-centre/media-releases/australian-economy-grew-08-december-quarter,50.md,No,,,,,,,,,,0,Low,,,,,,
2026-03-03,Total approvals fall in January,https://www.abs.gov.au/media-centre/media-releases/total-approvals-fall-january,51.md,No,,,,,,,,,,0,Low,,,,,,
2026-03-03,Current account deficit widens,https://www.abs.gov.au/media-centre/media-releases/current-account-deficit-widens,52.md,No,,,,,,,,,,0,Low,,,,,,
2026-03-02,Winter crops recover with 20% rise in value for 2024-25,https://www.abs.gov.au/media-centre/media-releases/winter-crops-recover-20-rise-value-2024-25,53.md,No,,,,,,,,,,0,Low,,,,,,
2026-03-02,IESC advice on Ulan West Modification 8 Project,https://www.iesc.gov.au/projectadvice/advice-decision-maker-ulan-west-modification-8-project-iesc-2026-163,54.md,No,,,,,,,,,,0,Low,,,,,,
2026-03-02,Agenda and minutes of the 121st IESC Meeting,https://www.iesc.gov.au/resource/agenda-and-minutes-121st-iesc-meeting,55.md,Yes,Parliamentary and Political Proceedings,National,8,2,1,2,8,1,7,3.779661,Low,Independent Expert Scientific Committee on Unconventional Gas Development and Large Coal Mining Development holds Meeting 121 on 11–12 February 2026.,,,,,
2026-03-07,Singapore and India trade mission to deliver for Queensland,https://statements.qld.gov.au/statements/104649,56.md,No,,,,,,,,,,0,Low,,,,,,
2026-03-07,Supporting women to return to work as Women’s Career Grants ramp up,https://statements.qld.gov.au/statements/104634,57.md,Yes,Funding and Grant Announcements,Queensland,7,7,8,7,6,6,3,6.728814,Medium,Grant opportunity – Women’s Career Grants Round 2 in Queensland.,"The Queensland Government has opened Round 2 of the Women’s Career Grants program, providing up to $5,000 per grant as part of a $20 million package to support women returning to work.",Expressions of interest are invited from eligible Queensland women to participate in Round 2.,"Demonstrate need to cover costs of workwear, childcare, training, recertification, transport, tools or technology.",Support women returning to work or upskilling through the expanded Jobs Academy and related grants.,Enable expressions of interest ahead of the 23 March opening for Round 2.
2026-03-07,Glasshouse Theatre throws open the doors for Community Day celebration,https://statements.qld.gov.au/statements/104646,58.md,No,,,,,,,,,,0,Low,,,,,,
2026-03-07,A proud night for Queensland at the Australian Tourism Awards,https://statements.qld.gov.au/statements/104647,59.md,No,,,,,,,,,,0,Low,,,,,,
2026-03-06,New appointments across justice portfolio,https://statements.qld.gov.au/statements/104636,60.md,Yes,Corporate and Institutional ESG Actions,Queensland,4,6,4,6,8,6,1,5.457627,Medium,The Crisafulli Government has announced the appointment of two esteemed senior legal figures to the Board of Legal Aid Queensland (LAQ) and the Queensland Law Reform Commission.,,,,,
2026-03-06,Statement from the Attorney-General,https://statements.qld.gov.au/statements/104644,61.md,Yes,Legislative and Statutory Developments,Queensland,6,8,7,6,3,5,2,5.762712,Medium,Statutory development – Gun control.,The Crisafulli Government has introduced a Bill to tighten gun laws in response to the Bondi Beach attack.,"Instrument: the Bill to impose stronger gun laws across Queensland, including new offences and gun-owner citizenship requirements.","The government says the legislation was scrutinised through a Parliamentary Committee Process for two weeks and debated over three days, with the package aimed at keeping guns out of terrorists’ and criminals’ hands in Queensland by the end of the current two-week sitting cycle.",,
2026-03-06,"Targeted hardship assistance for Charters Towers, and application window extended for six LGAs",https://statements.qld.gov.au/statements/104645,62.md,Yes,Funding and Grant Announcements,Queensland,8,9,7,6,8,6,6,7.322034,High,Grant opportunity – Disaster relief and hardship assistance in Queensland.,"The program has extended personal hardship assistance and DRFA measures across 49 LGAs, delivering payments of $180 to individuals and up to $900 for families, disaster loans up to $250,000, freight subsidies up to $5,000, and fodder support, supporting producers, small businesses and not-for-profits.","Eligibility focuses on flood-affected households, primary producers, small businesses, not-for-profits and local councils",demonstrate need and eligibility for Personal Hardship Assistance and disaster loans,scale disaster response by applying for freight subsidies and fodder support,enable recovery of small businesses and not-for-profits through loans and public asset reconstruction funding
2026-03-06,Women in Manufacturing Apprentice Awards announced,https://statements.qld.gov.au/statements/104640,63.md,Yes,Funding and Grant Announcements,Queensland,8,7,7,7,6,8,4,7.067797,High,Grant opportunity – Women in Manufacturing Leadership Program and Apprentice Awards in Queensland.,"The Queensland Government has opened applications for the 2026 Women in Manufacturing Leadership Program and announced the 2026 Apprentice Award winners, with grants of $10,000 and $5,000 respectively.",Eligibility criteria invite applicants to outline how funding will support advancing women in Queensland manufacturing,Demonstrate how funding will attract and retain women in Queensland manufacturing.,Demonstrate potential to advance women into leadership roles through mentoring or professional development.,"Provide evidence of impact through education, career development, or tools and uniforms for apprentices."
2026-03-06,Crisafulli Government drives housing delivery in Toowoomba,https://statements.qld.gov.au/statements/104637,64.md,Yes,Funding and Grant Announcements,Queensland,8,8,7,6,7,7,8,7.220339,High,Grant opportunity – Housing infrastructure activation funding.,The Residential Activation Fund has unlocked housing supply and Round 2 applications are now open to unlock further homes across the state.,Local governments and landowners with eligible projects are invited to review guidelines and apply,demonstrate ability to fast‑track land supply.,"deploy trunk infrastructure such as roads, sewerage and power.",enable coordination with councils and industry to deliver housing.
2026-03-06,Caboolture-Bribie Island Road duplication complete ahead of schedule,https://statements.qld.gov.au/statements/104638,65.md,No,,,,,,,,,,0,Low,,,,,,
2026-03-06,Inaugural Quantum Challenge makes big impact,https://statements.qld.gov.au/statements/104641,66.md,Yes,Consultation and Policy Design Opportunities,Queensland,7,6,6,6,5,7,4,6.101695,Medium,Queensland Government is launching the Queensland Quantum Challenge for Queensland’s future that prepares students for jobs in the years ahead.,Submissions are due by Friday 1 May 2026.,,,,
2026-03-06,Empowering Councils Bill passed to deliver better outcomes for Queenslanders,https://statements.qld.gov.au/statements/104633,67.md,Yes,Legislative and Statutory Developments,Queensland,5,7,5,6,9,6,1,6.118644,Medium,Statutory development – Local government empowerment.,Queensland Parliament has passed the Local Government (Empowering Councils) and Other Legislation Amendment Bill to empower councils.,Instrument: Local Government (Empowering Councils) and Other Legislation Amendment Bill; operative clause empowers councils and mayors to cut red tape and boost governance across Queensland.,"The measures sit on the back of amendments to the City of Brisbane Regulation 2012 and Local Government Regulation 2012, which have been in force since December 2025, and are intended to streamline decision making and improve transparency across Queensland councils. The government says the reforms empower mayors to more effectively represent their councils while reducing red tape and safeguarding integrity; monitoring suggests support from sector representatives across the state as the Bill moves into implementation.",,
2026-03-04,AASB March Board Meeting Public Agenda and Papers out now,https://aasb.gov.au/news/aasb-march-board-meeting-public-agenda-and-papers-out-now/,68.md,Yes,Consultation and Policy Design Opportunities,National,5,7,2,2,2,2,6,3.491525,Low,Australian Accounting Standards Board is consulting on the public agenda for Board Meeting 219 that will be held on 19 March 2026.,,,,,
2026-03-04,Narrow scope amendments to the fair value option in AASB 128,https://aasb.gov.au/news/narrow-scope-amendments-to-the-fair-value-option-in-aasb-128/,69.md,No,,,,,,,,,,0,Low,,,,,,
2026-03-03,2026 Distinguished Geoscience Australia Lectures and Public Talk Series has arrived!,https://www.ga.gov.au/news/2026-distinguished-geoscience-australia-lectures-and-public-talk-series-has-arrived,70.md,No,,,,,,,,,,0,Low,,,,,,
2026-03-02,Release of Australia’s Identified Mineral Resources (AIMR) 2025 report,https://www.ga.gov.au/news/release-of-australias-identified-mineral-resources-2025-aimr-report,71.md,Yes,"Reports, Data Releases, and Analytical Insights",National,8,8,7,8,7,8,9,7.711864,High,"The Australian Government’s Critical Minerals Strategic Reserve policy has implications for securing supply chains in the sector, says Geoscience Australia.","""Australia’s diverse geology and abundant mineral resources – including critical minerals – continue to underpin our economic and national security while supporting secure global supply chains with our strategic partners,"" the Australian Government says.",,,,
2026-03-05,California sues Trump over his unlawful use of tariffs — again,https://www.gov.ca.gov/2026/03/05/california-sues-trump-over-his-unlawful-use-of-tariffs-again/,72.md,Yes,"Compliance, Oversight, and Enforcement Actions",International,7,7,6,6,5,4,6,5.881356,Medium,California has filed a lawsuit challenging President Trump's imposition of tariffs under Section 122 of the Trade Act of 1974.,,,,,
2026-03-05,"Trump pardons wipe nearly $2 billion in victim repayment and taxpayer recovery for Medicare and tax fraud, and more",https://www.gov.ca.gov/2026/03/05/trumpcriminals3/,73.md,Yes,Parliamentary and Political Proceedings,International,7,7,6,6,2,7,2,5.745763,Medium,California Governor's Office tracks Trump's clemency actions on a public tracker launched in March 2026.,,,,,
2026-03-02,"Governor Newsom announces new CARE Court accountability measures to get more chronically mentally ill off our streets, awards $291 million in funding for services and housing",https://www.gov.ca.gov/2026/03/02/governor-newsom-announces-new-care-court-accountability-measures-to-get-more-chronically-mentally-ill-off-our-streets-awards-291-million-in-funding-for-services-and-housing/,74.md,Yes,Funding and Grant Announcements,International,8,9,8,7,8,8,7,7.983051,High,Grant opportunity – CARE Act implementation and housing expansion in California.,"The state has awarded about $581.8 million to expand shelter, housing and behavioural health services including CARE Act implementation, Homekey+ and HHAP Round 6.",Applicants are invited to demonstrate capacity to implement CARE Act reforms and scale housing and treatment supports statewide,demonstrate capacity to implement CARE Act reforms and scale permanent supportive housing and treatment services.,prioritise projects that expand permanent supportive housing and behavioural health capacity.,focus on advancing CARE Champions and supporting CARE ICU counties to improve implementation results.
2026-03-06,"Following Kristi Noem’s firing, Governor Newsom demands DHS redirect funding from Noem’s failed ad campaign to LA recovery",https://www.gov.ca.gov/2026/03/06/following-kristi-noems-firing-governor-newsom-demands-dhs-redirect-funding-from-noems-failed-ad-campaign-to-la-recovery/,75.md,Yes,Funding and Grant Announcements,International,7,8,7,6,8,7,6,7.135593,High,Grant opportunity – Los Angeles FEMA recovery funding and hazard mitigation.,The grant opportunity has opened to support projects that accelerate the release of more than $500 million in stalled FEMA funding and bolster hazard mitigation for Los Angeles and rural communities.,Eligibility is open to state and local agencies non profits and consortia delivering disaster recovery and hazard mitigation projects,demonstrate capacity to accelerate FEMA fund disbursement for LA recovery.,prioritise hazard mitigation projects that reduce wildfire and flood risk.,deploy governance mechanisms that align FEMA review with efficient project delivery.
2026-03-06,Governor Newsom announces major transformation of six vacant buildings in Los Angeles County into mental health and housing communities,https://www.gov.ca.gov/2026/03/06/governor-newsom-announces-major-transformation-of-six-vacant-buildings-in-los-angeles-county-into-mental-health-and-housing-communities/,76.md,No,,,,,,,,,,0,Low,,,,,,
2026-03-05,"El Gobernador, el Senado y la Asamblea se comprometen a proteger las elecciones de la intromisión federal de Trump",https://www.gov.ca.gov/2026/03/05/el-gobernador-el-senado-y-la-asamblea-se-comprometen-a-proteger-las-elecciones-de-la-intromision-federal-de-trump/,77.md,Yes,Parliamentary and Political Proceedings,International,4,3,6,6,1,5,0,4.033898,Low,California Governor's Office is pursuing protections for California's elections this November.,,,,,
2026-03-05,DINERO GRATIS PARA LA UNIVERSIDAD: Nuevo esfuerzo conecta a estudiantes de colegios comunitarios en California con becas disponibles de CalKIDS,https://www.gov.ca.gov/2026/03/05/dinero-gratis-para-la-universidad-nuevo-esfuerzo-conecta-a-estudiantes-de-colegios-comunitarios-en-california-con-becas-disponibles-de-calkids/,78.md,Yes,Funding and Grant Announcements,International,7,7,6,7,8,7,7,6.983051,Medium,Grant opportunity – California CalKIDS community college access.,"A grant opportunity has opened to connect eligible community college students with CalKIDS scholarships, with more than $20 million in scholarships available for eligible students.",Applications are invited to propose initiatives that connect eligible community college students with CalKIDS scholarships,identify eligible students and facilitate access to CalKIDS funds.,integrate CalKIDS data with college supports to streamline outreach and documentation.,"scale outreach to districts and ensure funds support books, computers and other educational materials."
2026-03-05,Governor Newsom announces over $2 million in funding for small businesses innovating in the Golden State,https://www.gov.ca.gov/2026/03/05/governor-newsom-announces-over-2-million-in-funding-for-small-businesses-innovating-in-the-golden-state/,79.md,Yes,Funding and Grant Announcements,International,9,8,8,7,7,8,7,7.830508,High,Grant opportunity – Accelerate California Innovation Grant Awards.,The Accelerate California Innovation Grant Awards have awarded more than $2 million to 37 startups across California.,Eligibility is open to California-based small businesses and early-stage ventures developing breakthrough technologies.,Demonstrate potential for high-growth impact and scalable commercialization.,Demonstrate early-stage development with some patents or patent activity.,"Align with Accelerate California hubs and regional collaboration with universities, investors, or accelerators."
2026-03-08,Walk trail to acknowledge remarkable women at Fremantle Cemetery,https://www.wa.gov.au/government/media-statements/Cook%20Labor%20Government/Walk-trail-to-acknowledge-remarkable-women-at-Fremantle-Cemetery-20260308,80.md,Yes,"Infrastructure, Project Approvals, and EPBC Developments",Western Australia,6,4,6,7,6,7,1,5.79661,Medium,The Metropolitan Cemeteries Board has approved the Fremantle Cemetery Historical Women's Walk Trail.,"Nominations are open for community members, historians, families, and organisations to highlight contributions across any field including the arts, community service, education, health, business, sport, advocacy, or public life, with the trail to be developed throughout 2026 following nominations and community consultation.",,,,
2026-03-07,$1 million in grants for WA research program to boost 'water smart' farms,https://www.wa.gov.au/government/media-statements/Cook%20Labor%20Government/$1-million-in-grants-for-WA-research-program-to-boost-'water-smart'-farms--20260307,81.md,Yes,Funding and Grant Announcements,Western Australia,7,7,8,8,7,7,6,7.288136,High,Grant opportunity – water security and resilience in agriculture.,"The Cook Government has unveiled $1 million in grants to improve on-farm water options, water security and resilience in drying climates.","Farmers in the Wheatbelt and Great Southern planning to drill for water are invited to apply for up to $20,000",Demonstrate on-farm water options improvements and resilience in drying climates.,Enable groundwater exploration using magnetic surveys to locate water in underground bedrock.,Scale engagement with up to 50 eligible farmers and specialist survey and drilling partners.
2026-03-07,$5.5 million in Marine Rescue vessel upgrades delivered,https://www.wa.gov.au/government/media-statements/Cook%20Labor%20Government/$5.5-million-in-Marine-Rescue-vessel-upgrades-delivered-20260307,82.md,Yes,Funding and Grant Announcements,Western Australia,7,6,7,6,7,6,4,6.423729,Medium,Grant opportunity – maritime safety and emergency response infrastructure.,"The government has allocated $5.5 million to deliver cutting‑edge, WA‑made vessels and strengthen emergency response across Western Australia's busiest waterways.",Eligible projects should demonstrate deployment of search and rescue assets and support WA made vessel manufacturing,demonstrate how funding will improve emergency response capabilities.,deploy WA made vessels and equipment.,validate impact on safety across waterways.
2026-03-07,WA tourism operators bring home gold at national awards,https://www.wa.gov.au/government/media-statements/Cook%20Labor%20Government/WA-tourism-operators-bring-home-gold-at-national-awards-20260307,83.md,No,,,,,,,,,,0,Low,,,,,,
2026-03-06,World's fastest track cyclists race into Perth,https://www.wa.gov.au/government/media-statements/Cook%20Labor%20Government/World%27s-fastest-track-cyclists-race-into-Perth-20260306,84.md,Yes,Funding and Grant Announcements,Western Australia,8,7,7,6,7,7,5,6.949153,Medium,Grant opportunity – Sustainable hosting of international sporting events.,This grant opportunity has opened to support the sustainable hosting of international sporting events in Western Australia.,"This call invites proposals that advance tourism benefits, local employment and community engagement around major sporting events",demonstrate how hosting international sporting events boosts local jobs and tourism.,enable community engagement and participation through accessible programming such as free Come and Try Track Cycling sessions.,validate long-term economic diversification through sustainable event infrastructure and planning.
2026-03-06,Perth crowds help AFC Women's Asian Cup break attendance record,https://www.wa.gov.au/government/media-statements/Cook%20Labor%20Government/Perth-crowds-help-AFC-Women%27s-Asian-Cup-break-attendance-record--20260306,85.md,No,,,,,,,,,,0,Low,,,,,,
2026-03-06,Purpose-built paediatric therapy centre opens in Kalgoorlie-Boulder,https://www.wa.gov.au/government/media-statements/Cook%20Labor%20Government/Purpose-built-paediatric-therapy-centre-opens-in-Kalgoorlie-Boulder-20260306,86.md,Yes,Funding and Grant Announcements,Western Australia,6,8,8,7,8,7,3,7.186441,High,Grant opportunity – Paediatric allied health service expansion.,"The grant opportunity has opened to scale paediatric allied health services and early intervention in regional Western Australia, backed by a $2.8 million government investment.",Applicants are invited to outline eligibility criteria and how projects will align with the focus areas of the grant,demonstrate measurable improvements in access to paediatric allied health services and early intervention.,deploy scalable service models that reduce travel burdens for regional families.,strengthen collaboration among local providers to sustain allied health services in regional communities.
2026-03-06,A free pass to adventures for WA foster and family carers,https://www.wa.gov.au/government/media-statements/Cook%20Labor%20Government/A-free-pass-to-adventures-for-WA-foster-and-family-carers-20260306,87.md,Yes,Funding and Grant Announcements,Western Australia,6,5,5,7,7,7,1,5.949153,Medium,Grant opportunity – Foster and Family Carers Adventure Pass.,The Western Australian Government has opened a Foster and Family Carers Adventure Pass programme during Foster and Family Carers Week 6–12 April 2026 to provide free entry and discounts to WA attractions.,Eligible households are invited to access the Foster and Family Carers Adventure Pass during Foster and Family Carers Week,"enable foster and family carer households to access free entry to Perth Zoo, WA Museums and WA national parks.",reduce ticket costs for eligible households by more than $300 across ticket prices.,support access during Foster and Family Carers Week 6–12 April 2026 with additional discounts on Rottnest Express ferry travel
2026-03-06,Kimberley's unique landscape primed for bike riding opportunities,https://www.wa.gov.au/government/media-statements/Cook%20Labor%20Government/Kimberley%27s-unique-landscape-primed-for-bike-riding-opportunities--20260306,88.md,No,,,,,,,,,,0,Low,,,,,,
2026-03-06,Joint media statement - New interchange to support Pilbara's clean energy future,https://www.wa.gov.au/government/media-statements/Cook%20Labor%20Government/Joint-media-statement---New-interchange-to-support-Pilbara%27s-clean-energy-future-20260306,89.md,No,,,,,,,,,,0,Low,,,,,,
2026-03-06,WA is Stronger Together on International Women's Day,https://www.wa.gov.au/government/media-statements/Cook%20Labor%20Government/WA-is-Stronger-Together-on-International-Women%27s-Day-20260306,90.md,No,,,,,,,,,,0,Low,,,,,,
2026-03-06,Cottesloe comes alive with return of Sculpture by the Sea,https://www.wa.gov.au/government/media-statements/Cook%20Labor%20Government/Cottesloe-comes-alive-with-return-of-Sculpture-by-the-Sea--20260306,91.md,Yes,Funding and Grant Announcements,Western Australia,7,7,7,6,4,7,3,6.254237,Medium,Grant opportunity – Sculpture by the Sea Cottesloe tourism and inclusion program.,"The program has secured funding from Tourism WA and Lotterywest to support its ongoing access, inclusion and tourism-focused initiatives.",Invitation to organisations outlining eligibility criteria and focus areas,demonstrate ability to deploy access and inclusion initiatives for large public art events,demonstrate capacity to support local businesses and local jobs through arts tourism,secure co-funding or in-kind support from state bodies or Lotterywest
2026-03-06,Tenders awarded to enhance care at Sir Charles Gairdner Hospital,https://www.wa.gov.au/government/media-statements/Cook%20Labor%20Government/Tenders-awarded-to-enhance-care-at-Sir-Charles-Gairdner-Hospital-20260306,92.md,Yes,"Infrastructure, Project Approvals, and EPBC Developments",Western Australia,8,8,8,8,6,7,8,7.542373,High,Two construction tenders have been awarded to Perth-based builder Devlyn Construction to upgrade Sir Charles Gairdner Hospital to support more people to access important diagnostic tools and treatment.,"The upgrades will support the wellbeing of Western Australians, enabling more people to access vital diagnostic tools and lifesaving treatment.",,,,
2026-03-06,Community Housing Provider appointed to manage former Fraser Suites complex,https://www.wa.gov.au/government/media-statements/Cook%20Labor%20Government/Community-Housing-Provider-appointed-to-manage-former-Fraser-Suites-complex-20260306,93.md,Yes,"Infrastructure, Project Approvals, and EPBC Developments",Western Australia,7,8,8,9,8,7,5,7.728814,High,The Cook Government has appointed Foundation Housing Limited as the Community Housing Provider to manage the former Fraser Suites in East Perth.,Foundation Housing Limited will deliver more than 200 affordable and social homes in East Perth through the $105 million acquisition and oversee a staged tenant move-in.,,,,
2026-03-06,Western Australian agrifood and beverage businesses participating in North Asia trade events,https://www.wa.gov.au/government/media-statements/Cook%20Labor%20Government/Western-Australian-agrifood-and-beverage-businesses-participating-in-North-Asia-trade-events-20260305,94.md,No,,,,,,,,,,0,Low,,,,,,
2026-03-05,Western Australia welcomes the Qantas Australian Tourism Awards,https://www.wa.gov.au/government/media-statements/Cook%20Labor%20Government/Western-Australia-welcomes-the-Qantas-Australian-Tourism-Awards-20260305,95.md,No,,,,,,,,,,0,Low,,,,,,
