Date,Title,URL,md_file,ESG_or_not,Story_Type,Jurisdiction,Cross_sector_relevance,Policy_significance,Business_risk_opportunity,Strategic_ESG_signal,Corporate_governance_relevance,Forward_looking_insight,Member Relevance,Rating,Relevance,Output 1,Output 2,Output 3,Output 4,Output 5,Output 6
2026-04-23,Improving Fremantle’s Samson Park for nature,https://www.dcceew.gov.au/about/news/improving-fremantles-samson-park-nature,83.md,Yes,Funding and Grant Announcements,Australian National Scope,6,7,8,7,2,7,7,6.237288,Medium,Funding for Samson Park upgrades.,"The Australian Government announced more than $1.7 million to improve bushland and wildlife areas in Samson Park, Fremantle.","Delivery by the City of Fremantle will fund drainage upgrades, accessible paths, a seasonal wetland, stormwater realignment, and extra native planting under the Local Environmental Projects Program.","The project supports climate resilience and habitat health by upgrading drainage, reducing flood impacts, expanding native plantings, and improving public access to nature within Fremantle's largest natural park.",,
2026-04-22,Macquarie Harbour water improvement a step closer,https://www.dcceew.gov.au/about/news/macquarie-harbour-water-improvement-step-closer,84.md,Yes,"Infrastructure, Project Approvals, and EPBC Developments",Australian National Scope,8,8,7,8,6,7,3,7.20339,High,The Australian Government has progressed the Oxygenation Offset Program in Macquarie Harbour to its next stage.,The Australian Government has committed $37.5 million to support the Maugean skate's recovery and its habitat since 2021.,,,,
2026-04-22,Restoring banksia woodland habitat,https://www.dcceew.gov.au/about/news/restoring-banksia-woodland-habitat,CLEANED,NO FILE,,,,,,,,,,,,,,,,,
2026-04-22,Partnering to protect Sea Country,https://www.dcceew.gov.au/about/news/partnering-protect-sea-country,86.md,Yes,Funding and Grant Announcements,Queensland,9,9,8,9,8,9,7,8.610169,High,Reef funding supports Traditional Owners.,The Australian government announced funding to expand the TUMRA program and later to support the Queensland Indigenous Land and Sea Rangers program.,"In September 2023, Reef Trust added $3 million to expand TUMRA for species protection, heritage, planning and on-country work; in July 2025, $12.6 million funded the Indigenous Land and Sea Rangers program.","This funding strengthens Indigenous governance and on-ground action, improving reef health, resilience, and job opportunities for Traditional Owners.",,
2026-04-17,World Heritage Day: Protecting our unique places,https://www.dcceew.gov.au/about/news/world-heritage-day-protecting-our-unique-places,87.md,Yes,"Environmental Protection, Biodiversity, and Nature Policy",Australian National Scope,6,7,6,6,3,6,2,5.576271,Medium,Protecting World Heritage in Australia.,"Australia reaffirms commitment to monitoring, managing and protecting World Heritage sites.","Recent listings include Murujuga Cultural Landscape and Budj Bim, while ongoing care and nominations for other sites like the Great Barrier Reef and Sydney Opera House emphasise safeguarding heritage values.","Maintaining these protections supports cultural and environmental resilience, guiding policy and funding decisions to ensure ongoing preservation for future generations.",,
2026-04-17,Review of NGER Method 2 for open-cut coal mines,https://www.dcceew.gov.au/about/news/review-nger-method-2-open-cut-coal-mines,88.md,Yes,Consultation and Policy Design Opportunities,Australian National Scope,8,8,6,8,6,8,8,7.355932,High,Review of NGER Method 2.,The government has released the terms of reference for the review of NGER Method 2 for open-cut coal mines.,"The review will consider issues under the terms of reference, with targeted stakeholder consultations and submissions stemming from the 2025 NGER public consultation, and updates including a May 2026 webinar.","This matters for ESG readers for staying compliant with reporting rules, guiding policy alignment, and informing investment and operational planning around fugitive emissions from coal mines.",,
2026-04-24,Landscape-scale cultural burning study expands,https://www.nsw.gov.au/departments-and-agencies/local-land-services/news/landscape-scale-cultural-burning-study-expands,89.md,Yes,"Environmental Protection, Biodiversity, and Nature Policy",NSW,8,8,8,9,7,8,8,8,High,Cultural Burning Study Expands.,Indigenous-led cultural burning is expanded across private and public lands in NSW and ACT.,"36 burns across three Local Land Services regions over four years to study biodiversity, soil and vegetation.","The project aims to restore ecological health, reduce bushfire risk and strengthen community capacity by integrating traditional and Western land-management practices.",,
2026-04-21,Forum to help landholders cash in on natural capital opportunities,https://www.nsw.gov.au/departments-and-agencies/local-land-services/news/forum-to-help-landholders-cash-on-natural-capital-opportunities,90.md,Yes,"Community, First Nations, and Social Licence Initiatives",NSW,8,7,8,8,4,8,8,7.220339,High,"The NSW Government’s Local Land Services has partnered with First Nations communities and the Australian National University to expand a cultural burning research program, which aims to promote inclusive participation and benefit sharing.",,,,,
2026-04-20,Business leaders call for 25 red tape reduction amid rising costs,https://www.aicd.com.au/news-media/media-releases/2026/alliance-of-industry-associations-pre-budget-submission-26-27.html,91.md,Yes,Legislative and Statutory Developments,Australian National Scope,7,7,7,4,4,5,5,5.711864,Medium,Red Tape Cut Urged 25%.,The Alliance of Industry Associations calls on all governments to reduce regulatory costs by 25% by 2030.,"The Alliance, representing business, universities, farmers and investors, cites about $160 billion annual regulatory costs and urges immediate steps, a stocktake, and cross-jurisdiction coordination to hit 25% reduction by 2030.","A 25% red tape reduction could lower costs for households and businesses, boosting productivity. The move aligns regulation with pro-growth reforms and strengthens resilience against cost pressures.",,
2026-04-24,Government's take joint action to support Liberty Bell Bay workers during sale process,https://www.pm.gov.au/media/governments-take-joint-action-support-liberty-bell-bay-workers-during-sale-process,92.md,Yes,Funding and Grant Announcements,Australian National Scope,9,6,7,6,7,6,6,6.830508,Medium,Support for Liberty Bell Bay.,The Albanese and Tasmanian Governments jointly announced a $3 million loan to EY to support Liberty Bell Bay workers during the sale process.,"The loan will be provided on a 50:50 basis and aims to keep the workforce in place, protect skills and expedite the facility's sale and restart.","By safeguarding jobs and maintaining critical domestic manganese alloy capability during administration, the arrangement supports industrial resilience and safeguards the Bell Bay community while a new owner is sought.",,
2026-04-23,Television interview - ABC Afternoon Briefing,https://www.pm.gov.au/media/television-interview-abc-afternoon-briefing-7,93.md,Yes,Parliamentary and Political Proceedings,Australian National Scope,7,6,4,4,7,5,4,5.457627,Medium,Fuel security and reform plan.,The Prime Minister outlined the staged approach to fuel shortages and confirmed ongoing National Cabinet discussions on reserves and supply.,"Four-to-six week advance assessments will determine if Stage Three is needed, with WA reserves and Export Finance Australia contributions cited as part of securing diesel, aviation fuel, and petrol supplies.","The discussion reflects policy focus on energy security, prioritising reliable supplies, conservation, and potential reform of the NDIS budgetary sustainability alongside resilient economic planning in response to geopolitical shocks.",,
2026-04-23,Press conference - Sydney,https://www.pm.gov.au/media/press-conference-sydney-32,94.md,Yes,Legislative and Statutory Developments,Australian National Scope,9,7,7,7,7,7,8,7.372881,High,Australia stabilises fuel security.,"National Cabinet confirms fuel security plan at level two, with cargo purchases and new suppliers to diversify fuel sources.","The government has secured six diesel cargoes totaling just over 300 million litres through Export Finance Australia while diversifying suppliers from the US, Argentina and Algeria as the Strait remains closed.","This underscores Australia's active energy security planning and public support measures, including stockpiles and targeted procurement. It highlights governance and supply chain resilience in a volatile global context.",,
2026-04-23,Press conference - Sydney,https://www.pm.gov.au/media/press-conference-sydney-31,CLEANED,NO FILE,,,,,,,,,,,,,,,,,
2026-04-23,Podcast interview - The Daily Aus,https://www.pm.gov.au/media/podcast-interview-daily-aus-1,96.md,No,,,,,,,,,,,,,,,,,
2026-04-23,Radio interview - ABC Sydney,https://www.pm.gov.au/media/radio-interview-abc-sydney-21,97.md,No,,,,,,,,,,,,,,,,,
2026-04-22,Radio interview - ABC Sydney,https://www.pm.gov.au/media/radio-interview-abc-sydney-20,98.md,No,,,,,,,,,,,,,,,,,
2026-04-22,Securing more fuel and fertiliser,https://www.pm.gov.au/media/securing-more-fuel-and-fertiliser,CLEANED,NO FILE,,,,,,,,,,,,,,,,,
2026-04-21,Press conference - Port Botany,https://www.pm.gov.au/media/press-conference-port-botany,100.md,No,,,,,,,,,,,,,,,,,
2026-04-20,Television interview - ABC 7:30,https://www.pm.gov.au/media/television-interview-abc-730-18,101.md,No,,,,,,,,,,,,,,,,,
2026-04-18,Press conference - Sydney,https://www.pm.gov.au/media/press-conference-sydney-30,102.md,Yes,"Ministerial, Diplomatic, and International Engagements",Australian National Scope,7,6,6,3,6,6,8,5.779661,Medium,Strait of Hormuz Summit Update.,Prime Minister Albanese joined 49 nations at a London summit on Strait of Hormuz to press for de-escalation and open passage.,Australia will participate in the London conference and has offered support including the Wedgetail E-7 for Gulf security.,"The gathering underscores global focus on energy security, maritime trade, and resilience of fuel supply chains amid regional volatility.",,
2026-04-17,"Press conference - Viva Refinery, Geelong",https://www.pm.gov.au/media/press-conference-viva-refinery-geelong,103.md,Yes,"Infrastructure, Project Approvals, and EPBC Developments",Australian National Scope,8,6,7,6,7,6,8,6.728814,Medium,"The Prime Minister and the Minister for Climate Change and Energy have approved the continued operation of Viva Energy's Geelong refinery at Corio, with 80 per cent of diesel production, 80 per cent of jet fuel production, and 60 per cent of petrol production continuing.","BP has joined the Export Finance Australia arrangements to secure additional cargoes, building on 100 million litres of supply secured in two lots over the past 24 hours.",,,,
2026-04-23,Deuteration supports blood test to help diagnose breast cancer,https://www.ansto.gov.au/news/deuteration-supports-blood-test-to-help-diagnose-breast-cancer,104.md,Yes,"Reports, Data Releases, and Analytical Insights",Australian National Scope,8,2,6,5,2,6,7,4.932203,Low,"Integration of deuterated lipid blood tests into Australia’s national cancer screening programs has implications for breast cancer detection and accessibility, says the National Deuteration Facility.","“Accuracy is paramount for a viable diagnostic test, and stable isotope labelled internal standards are the gold standard,” the National Deuteration Facility says.",,,,
2026-04-22,Professor Helen Garnett appointed to ANSTO Board,https://www.ansto.gov.au/news/professor-helen-garnett-appointed-to-ansto-board,105.md,Yes,"Ministerial, Diplomatic, and International Engagements",Australian National Scope,3,2,4,4,7,4,6,4.016949,Low,Garnett joins ANSTO board.,Minister Tim Ayres appointed Emeritus Professor Helen Garnett to ANSTO's board to strengthen governance.,"The appointment aims to support Australia’s research system as it tackles urgent national challenges, including critical minerals processing and nuclear medicines development.","It reinforces governance of independent public science agencies and underpins Australia’s capabilities in nuclear science and medicines for policy, investment, and supply chain resilience.",,
2026-04-22,Implement solar thermal to decarbonize industry,https://www.wbcsd.org/news/implement-solar-thermal-to-decarbonize-industry/,106.md,Yes,"Reports, Data Releases, and Analytical Insights",International,9,6,9,9,7,7,9,7.881356,High,"Industrial decarbonisation targets for heat have implications for emissions intensity per MWh of heat, says the World Business Council for Sustainable Development.","Solar thermal can replace fossil boilers, offering price stability and potential payback in 3–5 years, according to the WBCSD.","""it can supply up to 12% of the global final energy demand,"" the WBCSD says.",,,
2026-04-21,Materiality Mindset: Operationalizing Materiality from Insight to Foresight,https://www.wbcsd.org/news/materiality-mindset-operationalizing-materiality-from-insight-to-foresight/,107.md,Yes,Corporate and Institutional ESG Actions,International,8,9,9,9,9,9,8,8.79661,High,"WBCSD insights has published the ""Materiality Mindset"" insight on operationalizing materiality from insight to foresight.","The guidance recommends embedding materiality into ERM, making time horizons explicit, establishing governance and data controls proportionality, and actively governing trade-offs over time.",,,,
2026-04-20,Putting People at the Center of Climate Action: The importance of measuring the Just Transition,https://www.wbcsd.org/news/putting-people-at-the-center-of-climate-action-the-importance-of-measuring-the-just-transition/,108.md,Yes,"Reports, Data Releases, and Analytical Insights",International,9,8,9,9,9,9,8,8.79661,High,"Adopting sector-agnostic just-transition metrics has implications for how companies measure impacts on workers and communities, says Shift and the World Business Council for Sustainable Development.","The metrics offer practical insight for regulators, businesses and investors to identify effective approaches and needed course corrections, says Shift with WBCSD.",,,,
2026-04-20,How clean electrification can build energy security for business,https://www.wbcsd.org/news/how-clean-electrification-can-build-energy-security-for-business/,109.md,Yes,"Reports, Data Releases, and Analytical Insights",International,9,7,8,8,7,8,8,7.847458,High,"Germany’s motorway toll exemptions for zero-emission trucks until 2031 have implications for logistics operating costs and planning certainty, says the World Business Council for Sustainable Development.","The policy lowers operating costs and accelerates electrification of freight assets, enhancing resilience and competitiveness in logistics, the World Business Council for Sustainable Development says.",,,,
2026-04-17,Electrify industrial heat generation to eliminate emissions,https://www.wbcsd.org/news/electrify-industrial-heat-generation-to-eliminate-emissions/,110.md,Yes,"Reports, Data Releases, and Analytical Insights",International,9,8,9,9,8,7,9,8.372881,High,"World Business Council for Sustainable Development says electrification of industrial heat has implications for the share of industrial heat electrified, currently around 4%, rising to 11% by 2028.","The WBCSD explains that electrification improves energy efficiency, lowers emissions and cushions against fossil fuel price shocks.","“Only around 4% of industrial heat was electrified in 2022, projected to 11% by 2028,” the WBCSD says.",,,
2026-04-24,The hidden mechanics of connected care: Ensuring better outcomes for patients,https://www.csiro.au/en/news/All/Articles/2026/April/Interoperability-as-the-hidden-mechanics-of-connected-care,111.md,Yes,"Reports, Data Releases, and Analytical Insights",Australian National Scope,7,6,6,6,6,7,4,6.254237,Medium,"Australia's health information interoperability initiative has implications for patient data sharing efficiency and safety, says CSIRO.","""Making systems work better together helps free up time and supports safer, more effective care,"" the Australian e-Health Research Centre says.",,,,
2026-04-21,Technology transfer workshop highlights role of enabling environment in LDCs,https://www.wto.org/english/news_e/news26_e/trip_21apr26_367_e.htm,CLEANED,NO FILE,,,,,,,,,,,,,,,,,
2026-04-17,"Madagascar launches safeguard investigation on certain juices, nectars and non-alcoholic beverages",https://www.wto.org/english/news_e/news26_e/safe_mdg_17apr26_366_e.htm,CLEANED,NO FILE,,,,,,,,,,,,,,,,,
2026-04-17,"Madagascar launches safeguard investigation on certain tableware, kitchenware, and household and packaging articles",https://www.wto.org/english/news_e/news26_e/safe_mdg_17apr26_365_e.htm,114.md,No,,,,,,,,,,,,,,,,,
2026-04-20,Road transport contractual chain order issued,https://www.fwc.gov.au/about-us/news-and-media/news/road-transport-contractual-chain-order-issued,115.md,Yes,"Compliance, Oversight, and Enforcement Actions",Australian National Scope,6,6,4,2,7,4,7,4.932203,Low,Road Transport Fuel Cost Order Issued.,"The Expert Panel issued the Road Transport Contractual Chain Order – Fuel Cost Recovery – 2026, with an initial one-month review.",The order will commence on 21 April 2026 and followed hearings from 8 to 17 April 2026 under the regulated workers provisions.,"Affected members will be notified by email, SMS or post as the major case page publishes the decision and reasons.",,
2026-04-17,Registration of the Timber Furnishing and Textiles Union and withdrawal from the CFMEU from 17 April 2026,https://www.fwc.gov.au/cfmeu-and-tftu,116.md,Yes,"Compliance, Oversight, and Enforcement Actions",Australian National Scope,4,6,2,2,1,1,1,2.677966,Low,"Amalgamation withdrawn, TFTU registered.","The TFTU has been registered on 17 April 2026, with the order commencing on 21 April 2026.",The General Manager must send written notices to affected members informing their TFTU membership.,Affected members will access TFTU rules and related historic lodgments via the regulator’s site.,,
2026-04-24,Reminder: income tax returns due soon for taxable NFPs,https://www.ato.gov.au/not-for-profit-newsroom/reminder-income-tax-returns-due-soon-for-taxable-nfps,CLEANED,NO FILE,,,,,,,,,,,,,,,,,
2026-04-24,A word from Tom Wheeler - April 2026,https://www.ato.gov.au/not-for-profit-newsroom/a-word-from-tom-wheeler-april-2026,CLEANED,NO FILE,,,,,,,,,,,,,,,,,
2026-04-24,Nominate for our Not-for-profit Stewardship Group,https://www.ato.gov.au/not-for-profit-newsroom/nominate-for-our-not-for-profit-stewardship-group,CLEANED,NO FILE,,,,,,,,,,,,,,,,,
2026-04-22,Updated transfer pricing guideline published,https://www.ato.gov.au/businesses-and-organisations/business-bulletins-newsroom/updated-transfer-pricing-guideline-published,CLEANED,NO FILE,,,,,,,,,,,,,,,,,
2026-04-21,Unexpected contact about your super or SMSF? Check this first,https://www.ato.gov.au/individuals-and-families/super-for-individuals-and-families/self-managed-super-funds-smsf/smsf-newsroom/unexpected-contact-about-your-super-or-smsf-check-this-first,121.md,No,,,,,,,,,,,,,,,,,
2026-04-21,Super funds and CIVs required to lodge RTP schedule for TT26,https://www.ato.gov.au/businesses-and-organisations/business-bulletins-newsroom/super-funds-and-civs-required-to-lodge-rtp-schedule-for-tt26,CLEANED,NO FILE,,,,,,,,,,,,,,,,,
2026-04-20,Increased visibility for trust elections,https://www.ato.gov.au/tax-and-super-professionals/for-tax-professionals/tax-professionals-newsroom/increased-visibility-for-trust-elections,CLEANED,NO FILE,,,,,,,,,,,,,,,,,
2026-04-20,Section D: Declaration and signature – Super funds,https://www.ato.gov.au/forms-and-instructions/reportable-tax-position-schedule-and-instructions-2026/rtp-schedule-instructions-2026-super-funds/section-d-declaration-and-signature-super-funds,CLEANED,NO FILE,,,,,,,,,,,,,,,,,
2026-04-20,How to get the RTP schedule 2026 – Super funds,https://www.ato.gov.au/forms-and-instructions/reportable-tax-position-schedule-and-instructions-2026/rtp-schedule-instructions-2026-super-funds/how-to-get-the-rtp-schedule-2026-super-funds,125.md,Yes,"Compliance, Oversight, and Enforcement Actions",Australian National Scope,0,3,0,0,0,0,7,0.745763,Low,ATO RTP Schedule 2026 Guidance.,ATO published how-to guidance for the RTP Schedule 2026 for super funds.,The page provides steps to access the RTP Schedule 2026 for super funds via the ATO website.,Regulatory implementation relies on timely access to the RTP schedule; organisations should consult the page to ensure compliance with reporting obligations.,,
2026-04-20,RTP schedule instructions 2026 – Super funds,https://www.ato.gov.au/forms-and-instructions/reportable-tax-position-schedule-and-instructions-2026/rtp-schedule-instructions-2026-super-funds,CLEANED,NO FILE,,,,,,,,,,,,,,,,,
2026-04-23,Western Sydney International Airport (WSI) Noise Insulation Program commences,https://www.infrastructure.gov.au/department/media/news/western-sydney-international-airport-wsi-noise-insulation-program-commences,127.md,Yes,"Infrastructure, Project Approvals, and EPBC Developments",Australian National Scope,6,7,6,6,2,6,7,5.59322,Medium,The Australian Government has approved the Western Sydney International Airport Noise Insulation Program to deliver noise treatments to eligible landowners near the Western Sydney International Airport.,The Australian Government will cover the costs of noise treatments.,,,,
2026-04-23,Road safety set to improve across Queensland,https://www.infrastructure.gov.au/department/media/news/road-safety-set-improve-across-queensland,128.md,Yes,Funding and Grant Announcements,Queensland,3,7,6,2,5,5,7,4.779661,Low,Road safety funding boost.,The Australian Government has announced funding of $30.2 million under the 2026–27 Black Spot program to improve road safety at 44 locations in Queensland.,"The program funds 44 Black Spot projects including intersection upgrades, safer pedestrian facilities, road widening and lighting infrastructure.","This funding improves road safety outcomes, supporting safer communities and local resilience by prioritising high-need locations nominated by local stakeholders.",,
2026-04-23,ACE scholarships for teaching in adult and community education,https://djsir.vic.gov.au/news-and-articles/ace-scholarships-for-teaching-in-adult-and-community-education,129.md,Yes,Funding and Grant Announcements,Victoria,6,6,7,6,0,6,4,5.186441,Medium,ACE Scholarships Launched.,The ACE Scholarships Program has been launched by Australian and Victorian Governments to support training for Learn Local teachers.,"Scholarships range from $500 to $20,000 and cover course fees and other expenses for online and on-site courses at partner providers.","The program improves access to education for foundation skills, supporting workforce development and community resilience by enabling more Learn Local teachers to deliver literacy, numeracy and digital skills training.",,
2026-04-22,TAFEs unlocking new opportunities in the care economy,https://djsir.vic.gov.au/news-and-articles/tafes-unlocking-new-opportunities-in-the-care-economy,130.md,Yes,Funding and Grant Announcements,Victoria,6,4,7,6,2,7,8,5.440678,Medium,Care Economy Research Grants.,Holmesglen Institute's Applied Research and Innovation (ARI) Project announced funding to four Victorian TAFEs for applied research to strengthen the care economy.,"The ARI Project is funded with a $2 million investment, enabling partnerships with care providers and organisations to improve training, drive innovation, and tackle workforce shortages.","The funding aims to enhance training, support workforce development, and improve patient and service outcomes across aged care, health, and early childhood sectors, contributing to resilience and quality care delivery.",,
2026-04-21,Food manufacturing giant making new Ballarat flour mill bigger and better,https://djsir.vic.gov.au/news-and-articles/food-manufacturing-giant-making-new-ballarat-flour-mill-bigger-and-better,131.md,No,,,,,,,,,,,,,,,,,
2026-04-21,2025-26 Premier’s Awards for Health and Medical Research winners and finalists announced,https://djsir.vic.gov.au/news-and-articles/2025-26-premiers-awards-for-health-and-medical-research-winners-and-finalists-announced,132.md,Yes,Funding and Grant Announcements,Victoria,4,0,2,2,0,2,7,1.864407,Low,Premier’s Health Research Awards.,The Victorian Government announced the 2025-26 Premier’s Awards for Health and Medical Research to recognise winners and finalists.,"Winners span fields such as maternal health in Aboriginal communities, orthopaedic treatment advances, AI for glaucoma detection, and research on social media's impact on body image.","The awards highlight Victoria’s commitment to world-class medical research, supporting early-career researchers and strengthening the sector’s capability to deliver improved health outcomes and innovations.",,
2026-04-20,Helping young people in out-of-home care into TAFE and university,https://djsir.vic.gov.au/news-and-articles/helping-young-people-in-out-of-home-care-into-tafe-and-university,133.md,Yes,Funding and Grant Announcements,Victoria,7,7,6,7,3,7,8,6.254237,Medium,Raising Expectations Funding Secured.,The Australian Government and Victorian Government will provide more than $2 million to fund the Raising Expectations program to support care-experienced students.,"It will run until 2028 and expand into regional areas, while developing more partnerships with TAFEs and universities across Victoria.","This funding aims to improve access to tertiary education for care-experienced youth, boosting their educational attainment and long-term resilience while strengthening regional education networks.",,
