Date,Title,URL,md_file,ESG_or_not,Story_Type,Jurisdiction,Cross_sector_relevance,Policy_significance,Business_risk_opportunity,Strategic_ESG_signal,Corporate_governance_relevance,Forward_looking_insight,Member Relevance,Rating,Relevance,Output 1,Output 2,Output 3,Output 4,Output 5,Output 6
2026-03-05,New concert series arrives at METRONET stations,https://www.wa.gov.au/government/media-statements/Cook%20Labor%20Government/New-concert-series-arrives-at-METRONET-stations-20260305,96.md,Yes,"Infrastructure, Project Approvals, and EPBC Developments",Western Australia,8,8,7,6,7,6,8,7.067797,High,"The Cook Government has committed to delivering the Station Sounds concert series at four METRONET station precincts in Yanchep, Ellenbrook, Oats Street, and Byford.","The arrangement will feature four free family-friendly outdoor concerts from 5pm to 7pm on 7 March, 14 March, 21 March and 28 March, with food trucks and activities to support activation of public spaces and community hubs.",,,,
2026-03-05,$94 million Roebourne District High School redevelopment complete,https://www.wa.gov.au/government/media-statements/Cook%20Labor%20Government/$94-million-Roebourne-District-High-School-redevelopment-complete-20260305,97.md,Yes,"Infrastructure, Project Approvals, and EPBC Developments",Western Australia,8,8,7,7,7,8,7,7.491525,High,"The Roebourne District High School redevelopment has been completed ahead of schedule in Roebourne, Western Australia.",The four-year $21 million Connected Community School trial will enable families to access community health and social services and aim to improve students' wellbeing and outcomes.,,,,
2026-03-05,Grains genetic research alliance celebrates a decade of success,https://www.wa.gov.au/government/media-statements/Cook%20Labor%20Government/Grains-genetic-research-alliance-celebrates-a-decade-of-success-20260305,98.md,Yes,Funding and Grant Announcements,Western Australia,8,8,9,8,8,8,7,8.135593,High,Grant opportunity – Western Crop Genetics Alliance funding extension.,The Western Crop Genetics Alliance has secured more than $3 million to extend the Alliance for a further 10 years.,Expression of interest is invited from organisations able to contribute to crop pre breeding research and cross sector collaboration,Demonstrate capability in crop pre breeding research.,Scale collaboration with academic and industry partners.,Enable deployment of genetic advances to commercial breeding programs.
2026-03-05,Paid graduate programs now open for new nurses and midwives,https://www.wa.gov.au/government/media-statements/Cook%20Labor%20Government/Paid-graduate-programs-now-open-for-new-nurses-and-midwives--20260305,99.md,Yes,State and Local Government Programs,Western Australia,7,7,7,7,7,8,2,6.983051,Medium,"Western Australia has announced GradConnect 2026, a centralised online recruitment system that offers paid graduate programs for newly qualified nurses and midwives.","“The Cook Government is committed to growing our health workforce and making sure Western Australians can access the care they need, when they need it,” Health Minister Meredith Hammat said.",,,,
2026-03-05,Women shaping the future of community sport,https://www.parliament.vic.gov.au/news/general-news/womeninsport,100.md,Yes,Parliamentary and Political Proceedings,Victoria,6,7,7,7,4,8,2,6.355932,Medium,Victorian Parliament hosts an International Women’s Day event on 5 March 2026 focusing on gender equality in community sport.,,,,,
2026-03-03,Improving community engagement to make better decisions,https://www.parliament.vic.gov.au/news/society/consultreport,101.md,Yes,Parliamentary and Political Proceedings,Victoria,6,7,6,6,7,8,3,6.525424,Medium,Victoria's Parliament Environment Committee is expected to report on the Public Engagement Framework update on 3 March 2026.,,,,,
2026-03-02,Giant leap of learning as civics meets space,https://www.parliament.vic.gov.au/news/general-news/mission-control,102.md,No,,,,,,,,,,0,Low,,,,,,
2026-03-03,Blog Connect and protect: Meet Warren,https://www2.gbrmpa.gov.au/news/connect-and-protect-meet-warren,103.md,Yes,"Environmental Protection, Biodiversity, and Nature Policy",Queensland,9,7,7,7,7,7,7,7.338983,High,"""And I thought, this can’t go on forever – something is not right."" says the interview.","""I designed it to be a collaborative triangle, between citizens, scientists and government managers."" says the interview.",,,,
2026-03-03,APRA statement on gender pay gap,https://www.apra.gov.au/news-and-publications/apra-statement-on-gender-pay-gap,104.md,Yes,Corporate and Institutional ESG Actions,National,8,7,8,8,8,8,6,7.762712,High,"The Australian Prudential Regulation Authority has issued new guidance on gender representation and pay data transparency as part of its ongoing commitment to a diverse, inclusive and equitable workplace.",,,,,
2026-03-02,APRA revokes Bank of Nova Scotia’s authorised deposit-taking institution licence,https://www.apra.gov.au/news-and-publications/apra-revokes-bank-of-nova-scotia%E2%80%99s-authorised-deposit-taking-institution,105.md,Yes,"Compliance, Oversight, and Enforcement Actions",National,6,6,6,2,2,4,9,4.576271,Low,"In line with advice from APRA, APRA has agreed to revoke the Bank of Nova Scotia's licence to operate as an authorised deposit-taking institution.",,,,,
2026-03-02,"Mine Land Rehabilitation Authority (MLRA) Closure -Important announcement from Dr Jen Brereton, CEO of the MLRA",https://www.mineland.vic.gov.au/events/mine-land-rehabilitation-authority-mlra-closure-important-announcement-from-dr-jen-brereton-ceo-of-the-mlra/,106.md,Yes,State and Local Government Programs,Victoria,8,7,7,6,6,8,7,7.016949,High,Victoria has announced the closure of the Mine Land Rehabilitation Authority’s operations.,,,,,
2026-03-09,MRIWA RESEARCH SHOWCASE 2026,https://www.mriwa.wa.gov.au/news-and-events/mriwa-events/mriwa-research-showcase-2026/,107.md,Yes,Consultation and Policy Design Opportunities,Western Australia,9,6,8,8,6,8,8,7.525424,High,MRIWA is consulting on scope expansion into clean energy and emissions reduction for Net Zero Emission Mining.,,,,,
2026-03-05,Supporting Hunter producers through a variable season,https://www.nsw.gov.au/departments-and-agencies/local-land-services/news/supporting-hunter-producers-through-a-variable-season,108.md,Yes,"Reports, Data Releases, and Analytical Insights",NSW,8,7,8,6,2,8,4,6.474576,Medium,"NSW Government Local Land Services' Farming Forecaster program has implications for pasture growth forecasts and feed budgeting, says Hunter Local Land Services.","Producers can make informed decisions around stocking rates and supplementary feeding by combining local weather data, soil moisture and pasture forecasts, says Teresa Hogan, Livestock Officer, Hunter Local Land Services.",,,,
2026-03-05,Synchrotron X-rays reveal pathway to greener fertiliser production,https://www.ansto.gov.au/news/synchrotron-x-rays-reveal-pathway-to-greener-fertiliser-production,109.md,Yes,"Reports, Data Releases, and Analytical Insights",National,9,8,7,7,7,9,9,7.881356,High,"Australia’s national decarbonisation strategy and growing policy focus on green ammonia and fertiliser technologies have implications for emissions intensity in fertiliser production, says Australian Nuclear Science and Technology Organisation.","“Understanding how this complex carbon–nitrogen coupling reaction proceeds at the atomic level, however, required advanced characterisation tools available using ANSTO facilities,” the ANSTO says.",,,,
2026-03-04,"More than 7,800 homes declared State significant",https://www.planning.nsw.gov.au/news/more-than-7800-homes-declared-state-significant,110.md,Yes,"Infrastructure, Project Approvals, and EPBC Developments",NSW,8,7,7,6,6,7,7,6.864407,Medium,"Seventeen projects have been declared State Significant Development following recommendations from the Housing Delivery Authority in New South Wales, with 13 in metropolitan Sydney and four in regional New South Wales.","If all are lodged and approved, this could create more than 7,800 homes including affordable housing across New South Wales.",,,,
2026-03-02,Speeding up the planning system to get shovels in the ground sooner,https://www.planning.nsw.gov.au/news/speeding-up-the-planning-system-to-get-shovels-in-the-ground-sooner,111.md,Yes,Legislative and Statutory Developments,NSW,8,8,7,7,7,7,7,7.338983,High,Statutory development – Planning reforms.,The NSW Minns government has announced second proclamation implementing planning reforms to accelerate assessments.,"The Planning Systems Reform Act 2025 enables fast-tracked pathways across NSW, targeted assessments for low-risk developments subject to strategic planning and community consultation, with exceptions where environmental impacts exist.",The changes take effect on 21 March 2026. Officials say targeted pathways could cut timelines by up to 50 per cent for qualifying low-risk projects. The reforms also introduce 14-day approvals for minor DA modifications and halve active planning circulars to reduce confusion.,,
2026-03-05,Federal Court Star Entertainment judgment,https://www.aicd.com.au/news-media/media-releases/2026/federal-court-star-entertainment-judgment.html,112.md,Yes,"Compliance, Oversight, and Enforcement Actions",National,8,8,7,7,8,8,5,7.576271,High,"In line with advice from the Australian Securities and Investments Commission, ASIC has not pursued charges concerning the directors in relation to breaches of the duty of care and diligence in oversight of non-financial risk.",,,,,
2026-03-03,AICD Gender Diversity Snapshot,https://www.aicd.com.au/news-media/media-releases/2026/aicd-gender-diversity-snapshot.html,113.md,Yes,Corporate and Institutional ESG Actions,National,9,8,8,8,9,8,3,8.152542,High,AICD has issued a report on gender diversity on ASX boards.,,,,,
2026-03-06,Television interview - Sky Newsday,https://www.pm.gov.au/media/television-interview-sky-newsday-0,114.md,No,,,,,,,,,,0,Low,,,,,,
2026-03-05,"Press conference - Parliament House, Canberra",https://www.pm.gov.au/media/press-conference-parliament-house-canberra-45,115.md,Yes,"Ministerial, Diplomatic, and International Engagements",International,8,7,7,8,7,8,9,7.542373,High,"Prime Minister of Canada Mark Carney has delivered a statement in Canberra to the Australian Parliament, focusing on energy, critical minerals, defence, AI and investment.",,,,,
2026-03-05,Australia-Canada Joint Statement,https://www.pm.gov.au/media/australia-canada-joint-statement,116.md,Yes,"Ministerial, Diplomatic, and International Engagements",International,9,8,8,8,8,8,8,8.169492,High,"The Prime Minister of Australia, the Honourable Anthony Albanese MP, has delivered a statement in Canberra to the Prime Minister of Canada, focusing on shared democratic values, open and prosperous Indo-Pacific region, economic leadership and regulatory cooperation, collaboration on energy, climate, AI safety, defence and security, critical minerals, disaster resilience, space and polar science partnerships.",,,,,
2026-03-05,Welcome to the Prime Minister of Canada,https://www.pm.gov.au/media/welcome-prime-minister-canada,117.md,No,,,,,,,,,,0,Low,,,,,,
2026-03-05,"Opening remarks - Parliament House, Canberra",https://www.pm.gov.au/media/opening-remarks-parliament-house-canberra-2,118.md,Yes,"Ministerial, Diplomatic, and International Engagements",International,9,7,7,6,7,7,7,7.186441,High,"PRIME MINISTER OF AUSTRALIA ANTHONY ALBANESE has delivered a speech to the Canadian delegation, focusing on cooperation across economic, defence, social and environmental relationships, climate change, disaster response and firefighting cooperation, technology governance and social cohesion.",,,,,
2026-03-04,Retirement of Pat Turner AM,https://www.pm.gov.au/media/retirement-pat-turner-am,119.md,Yes,"Community, First Nations, and Social Licence Initiatives",National,7,8,8,8,8,6,2,7.322034,High,"The Australian Government has acknowledged Pat Turner AM’s leadership under the National Agreement on Closing the Gap, which aims to improve life outcomes for First Nations people and ensure partnerships between governments and First Nations community-controlled organisations.",,,,,
2026-03-04,Why we're building high speed rail,https://www.pm.gov.au/media/why-were-building-high-speed-rail,120.md,Yes,"Infrastructure, Project Approvals, and EPBC Developments",National,9,8,9,8,8,8,9,8.372881,High,The government has legislated the High Speed Rail Authority to develop the business case and has moved the Sydney to Newcastle stage into the development phase in Australia.,"The project will generate around $250 billion in economic activity, create 99,000 jobs and 160,000 new households in the Hunter region.",,,,
2026-03-02,Television interview - ABC 7.30,https://www.pm.gov.au/media/television-interview-abc-730-16,121.md,Yes,"Ministerial, Diplomatic, and International Engagements",National,2,7,6,6,4,6,2,5.050847,Medium,"Prime Minister Anthony Albanese has given a speech address, focusing on stopping Iran getting nuclear weapons, regional peace and security, human rights and democracy, and the regime's overseas aggression.",,,,,
2026-03-06,"Women on the front line, communities in the lead: drought resilience takes root in Southern Africa",https://www.unccd.int/news-stories/stories/women-front-line-communities-lead-drought-resilience-takes-root-southern,122.md,Yes,"Environmental Protection, Biodiversity, and Nature Policy",International,9,9,9,8,9,9,7,8.779661,High,"“Women and local communities are already on the front line of drought. When they lead the solutions — supported by secure land tenure together with access to finance and investment-ready plans — resilience becomes real: it protects food and incomes today and restores land for generations to come,” says Louise Baker, Managing Director of the Global Mechanism of the UNCCD.","“The GRDSA Project does not finance investments directly. Instead, it focuses on project preparation so countries can later mobilize additional public and private finance, building on existing national policies, drought monitoring systems and vulnerability assessments rather than duplicating them,” the GRDSA Project says.",,,,
2026-03-02,Webinar: Higher Education Outcomes,https://www.jobsandskills.gov.au/news/webinar-higher-education-outcomes,123.md,Yes,"Reports, Data Releases, and Analytical Insights",National,8,6,5,2,1,4,7,4.525424,Low,"The Higher Education Outcomes report has implications for graduate employment and income metrics, says Jobs and Skills Australia.",The Jobs and Skills Australia says the administrative data enhances evidence-based workforce planning by clarifying discipline-linked employment and income outcomes.,,,,
2026-03-02,Upgraded RLMI gives strongest insight yet into regional labour markets,https://www.jobsandskills.gov.au/news/upgraded-rlmi-gives-strongest-insight-yet-regional-labour-markets,124.md,Yes,"Reports, Data Releases, and Analytical Insights",National,8,5,6,6,2,6,2,5.423729,Medium,"The December 2025 Regional Labour Market Index upgrade has implications for regional labour market monitoring and policy assessment, says the Labour Market Statistics Office.","The upgrade expands indicators and reveals regional divides, underscoring the need for targeted regional policies.",,,,
2026-03-06,Torres Strait prepares for H5 bird flu,https://www.dcceew.gov.au/about/news/torres-strait-prepares-h5-bird-flu,125.md,Yes,Funding and Grant Announcements,Queensland,9,8,9,8,8,8,4,8.20339,High,Grant opportunity – invasive species eradication and avian influenza preparedness in Torres Strait.,"The project has been funded with more than $1.5 million to eradicate rodents from Warul Kawa and bolster preparedness for H5 avian influenza, led by Traditional Owners and using drone-assisted baiting.","Applicants are invited to contribute evidence-based, community-led conservation projects aligned with invasive species control and biosecurity",demonstrate community-led governance and partnerships with Traditional Owners.,deploy drone-assisted baiting and monitoring to eradicate invasive rats.,scale biodiversity benefits and resilience against H5 avian influenza.
2026-03-06,Australia and Canada sign first clean energy partnership,https://www.dcceew.gov.au/about/news/australia-canada-sign-first-clean-energy-partnership,126.md,Yes,"Ministerial, Diplomatic, and International Engagements",International,9,9,9,8,7,9,9,8.542373,High,"Minister for Climate Change and Energy Chris Bowen has delivered a statement to Canada’s High Commissioner to Australia H.E. Dr Julie Sunday, focusing on trade, investment, standards and supply chains; grid modernisation and resilience; energy and hard-to-abate sectors; indigenous engagement; climate change adaptation.",,,,,
2026-03-04,Clean energy advice for First Nations peoples,https://www.dcceew.gov.au/about/news/clean-energy-advice-first-nations-peoples,127.md,Yes,Funding and Grant Announcements,National,9,8,7,8,6,7,7,7.508475,High,Grant opportunity – First Nations Clean Energy Advice Grants.,"The Australian Government has allocated over $39 million across 3 years to build skills, confidence and knowledge in clean energy, with Round 1 Advice Grants totalling $8.6 million.",Explore eligibility criteria and how to apply,Enable First Nations communities to access expert advice and support for clean energy projects.,Deploy grants for training planning and professional advice to build skills and confidence.,Promote community leadership and equitable partnerships under the First Nations Clean Energy Strategy.
2026-03-03,World Wildlife Day: protecting native plants,https://www.dcceew.gov.au/about/news/world-wildlife-day-protecting-native-plants,128.md,Yes,Funding and Grant Announcements,National,9,9,9,9,7,7,4,8.220339,High,Grant opportunity – Protecting threatened native plants under the Saving Native Species program.,The Australian Government has invested more than $700 million to protect threatened native plants.,"It invites projects that align with seed collection, genetic diversity, habitat protection, and ecosystem restoration",Collect and store seeds to safeguard genetic diversity.,Grow cuttings to improve genetic diversity.,"Repair fencing and manage weeds, feral animals and habitat restoration."
2026-03-02,Have your say on the new national H2 Regulatory Guidebook for Pipelines,https://www.dcceew.gov.au/about/news/hys-new-national-h2-regulatory-guidebook-pipelines,129.md,Yes,Consultation and Policy Design Opportunities,National,7,8,7,6,8,7,8,7.20339,High,National Hydrogen Regulatory Guidebook: Pipelines is consulting on guidance for pipelines under the hydrogen regulatory framework that aims to clarify regulatory obligations and support industry growth.,Submissions are due by 5:00 pm (AEST) on Monday 13 April 2026.,,,,
2026-03-04,Securing long-term investment in northern Australia,https://www.naif.gov.au/media-centre/securing-long-term-investment-in-northern-australia/,130.md,Yes,Legislative and Statutory Developments,National,6,8,6,6,7,8,8,6.864407,Medium,Statutory development – NAIF extension.,The government has introduced the Northern Australia Infrastructure Facility Amendment Bill 2026 to extend NAIF's investment period.,"Instrument: Northern Australia Infrastructure Facility Amendment Bill 2026 extends the NAIF investment period to 30 June 2036, with joint ministerial responsibility and a review pathway.","As of early March 2026, NAIF has delivered more than $4 billion of commitments and holds a $7 billion envelope; monitoring suggests reviews will commence after 30 June 2029 and 30 June 2034, with potential further consideration beyond 2036.",,
2026-03-02,New NAIF CEO Neil MacDonald Commences Role Based in Cairns,https://www.naif.gov.au/media-centre/new-naif-ceo-neil-macdonald-commences-role-based-in-cairns/,131.md,No,,,,,,,,,,0,Low,,,,,,
2026-03-05,Catalyzing Investments to Scale Up Climate-Resilient Agriculture: India Landscape Accelerator Launch,https://www.wbcsd.org/news/catalyzing-investments-to-scale-up-climate-resilient-agriculture-india-landscape-accelerator-launch/,132.md,Yes,Corporate and Institutional ESG Actions,International,9,8,9,8,8,9,7,8.457627,High,"WBCSD, within the COP28 Action Agenda on Regenerative Landscapes (AARL), has launched the ""India Landscape Accelerator"" on climate-resilient agriculture.",,,,,
2026-03-04,How internal carbon pricing can support capital allocation and risk management,https://www.wbcsd.org/news/how-internal-carbon-pricing-can-support-capital-allocation-and-risk-management/,133.md,Yes,Corporate and Institutional ESG Actions,International,8,9,9,9,9,8,8,8.644068,High,"WBCSD has issued updated guidance on ""Internal Carbon Pricing"" by its Corporate Performance & Accountability and Climate teams.",The guidance recommends embedding carbon costs into financial decision‑making and escalating internal carbon price paths for long‑lived investments.,,,,
2026-03-05,WTO members conclude month-long reform discussions in Geneva,https://www.wto.org/english/news_e/news26_e/refrm_05mar26_306_e.htm,134.md,No,,,,,,,,,,0,Low,,,,,,
2026-03-06,"Chair of agriculture talks circulates revised draft text, as MC14 outline emerges",https://www.wto.org/english/news_e/news26_e/agng_06mar26_309_e.htm,135.md,No,,,,,,,,,,0,Low,,,,,,
2026-03-06,DG Okonjo-Iweala urges members to explore new ways to revitalize WTO at South-South event,https://www.wto.org/english/news_e/news26_e/devel_06mar26_308_e.htm,136.md,No,,,,,,,,,,0,Low,,,,,,
2026-03-06,"Ahead of Women’s Day, WEIDE Fund announces US$ 1.76-million grants to women-led businesses",https://www.wto.org/english/news_e/news26_e/women_06mar26_305_e.htm,137.md,No,,,,,,,,,,0,Low,,,,,,
2026-03-06,"EU contributes EUR 75,000 to support LDC participation at MC14",https://www.wto.org/english/news_e/pres26_e/pr991_301_e.htm,138.md,No,,,,,,,,,,0,Low,,,,,,
2026-03-05,"EU contributes EUR 1 million to strengthen trade capacity in developing economies, LDCs",https://www.wto.org/english/news_e/pres26_e/pr990_300_e.htm,139.md,No,,,,,,,,,,0,Low,,,,,,
2026-03-04,"Government Procurement Committee discusses GPA implementation, progress in accessions",https://www.wto.org/english/news_e/news26_e/gpro_04mar26_307_e.htm,140.md,No,,,,,,,,,,0,Low,,,,,,
2026-03-04,"Heads of WTO, EIB sign landmark agreement to boost trade and investment",https://www.wto.org/english/news_e/news26_e/serv_04mar26_303_e.htm,141.md,Yes,"Ministerial, Diplomatic, and International Engagements",International,9,8,8,7,8,8,7,7.983051,High,"WTO Secretariat and the European Investment Bank (EIB) Group has signed a Memorandum of Understanding in March to enhance sustainable trade and investment worldwide, to policymakers, focusing on regulatory environment, unlock investment and development opportunities.",,,,,
2026-03-03,WTO members consider new e-commerce proposal and previous submissions ahead of MC14,https://www.wto.org/english/news_e/news26_e/ecwp_03mar26_304_e.htm,142.md,No,,,,,,,,,,0,Low,,,,,,
2026-03-03,"WTO members review five regional trade agreements, discuss transparency issues",https://www.wto.org/english/news_e/news26_e/rta_03mar26_299_e.htm,143.md,No,,,,,,,,,,0,Low,,,,,,
2026-03-02,"WTO MSME Group welcomes expansion, highlights successful entrepreneurs and MC14 plans",https://www.wto.org/english/news_e/news26_e/igmsm_02mar26_302_e.htm,144.md,No,,,,,,,,,,0,Low,,,,,,
2026-03-04,In Memoriam: Rafeeuddin Ahmed,https://www.untourism.int/news/in-memoriam-rafeeuddin-ahmed,145.md,No,,,,,,,,,,0,Low,,,,,,
2026-03-04,UN Tourism and TUI Care Foundation join hands to support Rural Artists and Artisans Across Africa,https://www.untourism.int/news/un-tourism-and-tui-care-foundation-join-hands-to-support-rural-artists-and-artisans-across-africa,146.md,Yes,Funding and Grant Announcements,International,9,8,8,9,6,8,6,7.949153,High,Grant opportunity – Tourism for Rural Development Small Grants Programme.,Five African NGOs have been selected under the Tourism for Rural Development Small Grants Programme.,Applications are invited from grassroots non-profit organisations delivering community-led rural tourism development in Africa,empower local artisans and boost income in rural communities.,strengthen market access and value chains for grassroots organisations.,prioritise women and youth-led cooperatives and inclusive participation.
2026-03-05,State of the energy transition: Your technology playbook,https://www.csiro.au/en/news/All/Articles/2026/March/State-of-the-Energy-Transition,147.md,Yes,"Reports, Data Releases, and Analytical Insights",National,9,8,9,8,7,8,8,8.186441,High,"Australia's net-zero by 2050 target has implications for cross-sector decarbonisation metrics and energy-system planning, says the Commonwealth Scientific and Industrial Research Organisation (CSIRO).","""The energy transition is extremely complex,"" the CSIRO says.",,,,
2026-03-05,Taking quantum science to the outback,https://www.csiro.au/en/news/All/Articles/2026/March/Remote-schools-quantum-visit,148.md,Yes,"Community, First Nations, and Social Licence Initiatives",Western Australia,6,7,7,7,1,7,6,5.881356,Medium,"CSIRO has announced outcomes under CSIRO’s STEM Professionals in Schools program, which aims to ensure inclusive participation for remote Western Desert communities such as M’Bunghara.",,,,,
