Date,Title,URL,md_file,ESG_or_not,Story_Type,Jurisdiction,Cross_sector_relevance,Policy_significance,Business_risk_opportunity,Strategic_ESG_signal,Corporate_governance_relevance,Forward_looking_insight,Member Relevance,Rating,Relevance,Output 1,Output 2,Output 3,Output 4,Output 5,Output 6
2026-04-23,Reliability Panel prioritises stability for consumers with proposed change to reliability standard for 2028-2032,https://www.aemc.gov.au/news-centre/media-releases/reliability-panel-prioritises-stability-consumers-proposed-change-reliability-standard-2028-2032,1.md,Yes,Legislative and Statutory Developments,Australian National Scope,7,8,7,4,7,6,8,6.59322,Medium,Reliability Standard Relaxed.,"The Reliability Panel recommends a small cut to the 2028–2032 reliability standard, with no change to market price settings.","For 1 July 2028–30 June 2032, the standard would move to 0.003 per cent USE (about 16 minutes average outage), with no changes to the MPC, CPT, MFP or APC.",The change is designed to protect households and businesses by keeping price signals stable while reflecting what customers value in reliability. It seeks to maintain strong reliability without large cost increases for consumers.,,
2026-04-22,Network pricing reform could cut household electricity bills and deliver $6 billion in system savings,https://www.aemc.gov.au/news-centre/media-releases/network-pricing-reform-could-cut-household-electricity-bills-and-deliver-6-billion-system-savings,2.md,Yes,"Reports, Data Releases, and Analytical Insights",Australian National Scope,8,7,8,6,7,7,8,7.220339,High,"Network pricing reform has implications for household electricity bills and costs, with $6 billion savings over 15 years and a $40–$80 per household reduction by 2040, says AEMC.","""Getting network pricing right creates the foundation for a smarter energy market,"" the AEMC says.","""By 2040, that translates to a reduction of $40 to $80 per household per year on electricity bills,"" the AEMC says.",,,
2026-04-22,AEMC proposes enhanced distribution network planning to support local energy solutions,https://www.aemc.gov.au/news-centre/media-releases/aemc-proposes-enhanced-distribution-network-planning-support-local-energy-solutions,3.md,Yes,Legislative and Statutory Developments,Australian National Scope,9,8,8,8,7,8,8,8.016949,High,AEMC Proposes Enhanced Planning.,The AEMC drafts a rule to modernise distribution network planning amid rising consumer energy resources.,"It introduces a new distribution network development plan and a data reporting framework to improve visibility of the low-voltage network and support local energy solutions, with submissions due 4 June 2026.","The rule aims to boost transparency and proactive planning, which could lower network costs and enable local energy solutions such as EV chargers and community batteries. It supports consumer outcomes and aligns with the National CER Roadmap.",,
2026-04-24,"Workshop helps untie knots of power, protection and representation",https://www.parliament.vic.gov.au/news/general-news/pacific-women,4.md,Yes,Parliamentary and Political Proceedings,Victoria,6,6,8,7,5,6,1,6.169492,Medium,Pacific Women MPs Workshop.,A three-day Women’s Talanoa Workshop brought Pacific women MPs together with Victorian and NSW counterparts.,"Sessions covered digital safety, media handling, and leadership skills to promote women’s visibility and sustain representation in Pacific parliaments.","The event reinforces cross-jurisdictional learning on inclusive governance, emphasising online safety and media literacy as enabling factors for women’s empowerment and more diverse leadership across small island states.",,
2026-04-17,Parents warn public schools have 'become the charity' as funding shortfalls bite,https://www.parliament.vic.gov.au/news/general-news/school-funding,5.md,Yes,Parliamentary and Political Proceedings,Victoria,5,7,6,6,4,6,2,5.559322,Medium,Funding delays trigger school fundraiser crisis.,A parliamentary inquiry is examining the impact of delaying Victoria's public school funding to 75% of the Schooling Resource Standard.,"The government delayed increasing funding until 2031, reducing previously committed funding by $2.4 billion.","The testimonies highlight how funding gaps affect school capacity, facilities, and staff workloads, underscoring concerns about equity and the sustainability of essential education services in a government-funded system.",,
2026-04-22,Small places with fresh spaces for our tiniest communities,https://www.rdv.vic.gov.au/news/small-places-with-fresh-spaces-for-our-tiniest-communities,6.md,Yes,Funding and Grant Announcements,Victoria,6,6,7,7,3,6,6,5.864407,Medium,Tiny Towns Fund Upgrades.,Victoria's Tiny Towns Fund announced funding to upgrade Burrumbeet Hall and Cardigan Reserve for community events and gatherings.,"The program has provided grants of between $5,000 and $50,000 to help regional towns connect, boost tourism and support local workers during project development.","The upgrades enhance accessibility and create more welcoming, multi-use spaces, supporting community resilience and local economies.",,
2026-04-23,EU adopts 20th package of sanctions against Russia,https://ec.europa.eu/commission/presscorner/detail/en/ip_26_869,CLEANED,NO FILE,,,,,,,,,,,,,,,,,
2026-04-22,Commission recommendation to facilitate Power Purchase Agreement take-up,https://energy.ec.europa.eu/news/commission-recommendation-facilitate-power-purchase-agreement-take-2026-04-22_en,8.md,Yes,Legislative and Statutory Developments,International,8,8,8,7,7,7,9,7.576271,High,EU Recommends Removing PPA Barriers.,The European Commission publishes a Recommendation to remove barriers to power purchase agreements.,"The Recommendation targets PPAs and other energy purchase agreements, including heat, biogas, and hydrogen, addressing access for small buyers, risk guarantees, accounting rules, and guarantees of origin.","This aims to unlock private investment in clean energy by reducing regulatory and non-regulatory barriers, promoting stable prices for consumers, and speeding the deployment of new installations.",,
2026-04-22,"Commission proposes actions to protect Europeans from the fossil energy crisis and accelerate the shift to clean, homegrown energy",https://ec.europa.eu/commission/presscorner/detail/en/ip_26_629,CLEANED,NO FILE,,,,,,,,,,,,,,,,,
2026-04-22,Remarks by Executive Vice-President Ribera and Commissioner Jørgensen at the press conference on AccelerateEU,https://ec.europa.eu/commission/presscorner/detail/en/speech_26_863,CLEANED,NO FILE,,,,,,,,,,,,,,,,,
2026-04-22,"LIFE Calls for proposals 2026: €601.5 million for a greener, more competitive Europe",https://cinea.ec.europa.eu/news-events/news/life-calls-proposals-2026-eu6015-million-greener-more-competitive-europe-2026-04-22_en,11.md,Yes,Funding and Grant Announcements,International,9,9,9,9,6,8,7,8.322034,High,EU LIFE Calls for Proposals 2026.,"The European Union's LIFE Programme has launched the 2026 Calls for proposals to support innovative, autonomous and resilient Europe.","Funding totals €601.5 million for 2026 across SAPs, OPs, CSAs, PLPs, SNaPs/SIPs, with eligibility open to EU-based entities or associated countries.","This funding aims to bolster nature restoration, circular economy, climate action, energy resilience and cleaner energy, expanding access to grants for projects that deliver tangible environmental and energy system benefits across Europe.",,
2026-04-21,Eurostat: Significant increase in fuel prices in March 2026,https://ec.europa.eu/eurostat/en/web/products-eurostat-news/w/ddn-20260421-1,12.md,No,,,,,,,,,,,,,,,,,
2026-04-21,Introducing the 2026 cohort of Young Energy Ambassadors,https://energy.ec.europa.eu/news/introducing-2026-cohort-young-energy-ambassadors-2026-04-21_en,13.md,Yes,Corporate and Institutional ESG Actions,International,7,7,6,8,6,8,9,7.050847,High,"The European Commission has launched the 2026 cohort of ""Young Energy Ambassadors"" to support Europe’s clean energy transition.",,,,,
2026-04-20,In focus: EU energy security explained,https://energy.ec.europa.eu/news/focus-eu-energy-security-explained-2026-04-20_en,14.md,Yes,"Reports, Data Releases, and Analytical Insights",International,8,8,8,8,8,7,8,7.847458,High,"EU energy security policy on maintaining at least 90 days of oil stocks has implications for oil stock adequacy in member states, says the Directorate-General for Energy.","The Directorate-General for Energy explains that diversification of supplies, storage and interconnections strengthens resilience and shields households and essential services from disruptions.","In 2025, LNG accounted for 45% of EU gas imports, the Directorate-General for Energy says.",,,
2026-04-17,Commissioner Jørgensen in Spain to discuss ways to tackle the energy and housing crises,https://energy.ec.europa.eu/news/commissioner-jorgensen-spain-discuss-ways-tackle-energy-and-housing-crises-2026-04-17_en,15.md,Yes,"Ministerial, Diplomatic, and International Engagements",International,6,7,7,6,6,6,8,6.40678,Medium,Spain housing and energy talks.,"Commissioner Dan Jørgensen engaged with Prime Minister Pedro Sánchez and other Spanish authorities in Madrid to discuss energy security, affordability, and housing.",Commitment includes advancing the Affordable Housing Act framework to tackle short-term rental impacts and promote housing affordability in EU areas under stress.,"The visit underlines EU action linking energy security, affordable housing, and youth engagement, with potential implications for EU housing policy, investment signals, and cross-border cooperation on urban resilience.",,
2026-04-24,Speech to Australian Government Data Summit,https://www.ato.gov.au/media-centre/speech-to-australian-government-data-summit,CLEANED,NO FILE,,,,,,,,,,,,,,,,,
2026-04-22,Anzac Day 2026,https://nt.gov.au/news/2026/anzac-day-2026,17.md,No,,,,,,,,,,,,,,,,,
2026-04-22,Joint media release: Securing more fuel and fertiliser,https://minister.agriculture.gov.au/collins/media-releases/securing-more-fuel-and-fertiliser,18.md,Yes,Funding and Grant Announcements,Australian National Scope,8,7,6,5,6,4,7,6.084746,Medium,Fuel and Fertiliser Secured.,The Albanese Government announced funding to secure additional diesel and fertiliser for Australian farmers and transport sectors.,"Approximately 300 million litres of diesel are secured in the last seven days, with partnerships to secure more shipments and price risk support to stabilise imports for current and upcoming seasons.","Keeps essential fuel and fertiliser supplies flowing, supporting farm productivity, transport robustness, and regional resilience amid disruption from the Middle East conflict.",,
2026-04-20,Joint media release: Now available: $6.15 billion to back Australian industry and shore up supply chains,https://minister.agriculture.gov.au/collins/media-releases/now-available-615-billion-back-australian-industry-and-shore-supply-chains,19.md,Yes,Funding and Grant Announcements,Australian National Scope,9,8,9,8,6,8,8,8.033898,High,National Reconstruction Fund Boost.,The Albanese Government announced funding through the National Reconstruction Fund to strengthen critical supply chains.,"It makes $6.15 billion available, including $1 billion in zero‑interest Economic Resilience Program loans, $5 billion Net Zero Fund, and $150 million Forestry Growth Fund.","Applications are open as part of fast-tracked funding aimed at securing local jobs, building domestic supply chains and supporting sustainable manufacturing.",,
2026-04-17,Joint media release: Securing more fertiliser for Australian farmers,https://minister.agriculture.gov.au/collins/media-releases/securing-more-fertiliser-for-australian-farmers,20.md,Yes,"Ministerial, Diplomatic, and International Engagements",Australian National Scope,8,7,7,6,8,6,6,6.983051,Medium,Fertiliser deal with Indonesia.,"Australia and Indonesia have finalised a deal to supply 250,000 tonnes of urea to Australian farmers for the current season.","The arrangement between Incitec Pivot Fertilisers and PT Pupuk Indonesia, supported by the Australian and Indonesian governments, locks in additional fertiliser supply to support farming and planting decisions this season.","This initiative strengthens food and energy security in the region, demonstrates close Australia-Indonesia partnership, and supports resilient supply chains and regional cooperation on food production.",,
2026-04-23,CBAM: How to make decarbonisation efforts pay off,https://taxation-customs.ec.europa.eu/carbon-border-adjustment-mechanism/carbon-border-adjustment-mechanism-how-make-decarbonisation-efforts-pay-2026-05-07_en,21.md,Yes,Consultation and Policy Design Opportunities,International,7,8,8,8,6,6,5,7.118644,High,CBAM webinar for exporters.,The CBAM team invites exporters to join the webinar on making decarbonisation pay off.,"It covers CBAM methodology, navigating requirements, and translating low-carbon investments into competitive advantage; questions should be submitted by 3 May, with registration by 5 May.","This briefing helps ESG practitioners, investors, and policy leads understand CBAM implications for compliance, market access, and strategic planning in Europe, and highlights opportunities to align decarbonisation efforts with competitive positioning.",,
2026-04-17,Meet Australia’s 2025 Biosecurity Top Dog,https://www.agriculture.gov.au/about/news/meet-australias-2025-biosecurity-top-dog,22.md,Yes,"Environmental Protection, Biodiversity, and Nature Policy",Australian National Scope,6,7,9,6,2,1,7,5.338983,Medium,Detector Dog Top Dog.,Australia strengthens border biosecurity through award-winning detector dogs and trained handlers.,"In 2025, Ghost intercepted 3,202 biosecurity risk items, contributing to the interception of over 45,500 items nationwide at international airports and mail centres.","The programme highlights the importance of detector dogs in protecting the environment, agriculture and communities by preventing pests and diseases from entering the country.",,
2026-04-24,Applications for the meat inspector traineeship are now open!,https://www.agriculture.gov.au/about/news/applications-meat-inspector-traineeship-now-open,23.md,Yes,Funding and Grant Announcements,Australian National Scope,6,6,7,6,4,4,3,5.457627,Medium,Meat Inspector Traineeship Opens.,"The Australian Government's Department of Agriculture, Fisheries and Forestry opened applications for a meat inspector traineeship to support safe meat exports.","Trainees receive hands-on training toward a Certificate IV in Meat Safety Inspections, with competitive salary, 15.4% superannuation, and generous leave entitlements.","The program emphasises health and safety and supports career pathways for First Nations peoples, contributing to workforce diversity and resilient food safety in Australia.",,
2026-04-24,Experienced leader takes helm of Safe Food Queensland,https://statements.qld.gov.au/statements/104950,24.md,Yes,Corporate and Institutional ESG Actions,Queensland,6,6,6,5,8,5,5,5.966102,Medium,The Queensland Government has announced the appointment of Lisa Palu as head of Safe Food Queensland board.,,,,,
2026-04-24,Crisafulli Government delivering eight Neuro Wellness Hubs in regional Queensland,https://statements.qld.gov.au/statements/104945,25.md,Yes,"Infrastructure, Project Approvals, and EPBC Developments",Queensland,2,7,7,6,6,5,4,5.440678,Medium,The Crisafulli Government has approved the establishment of a coordinated network of eight regional Neuro Wellness Hubs across Queensland.,More than 1.3 million Queenslanders will benefit from eight new Neuro Wellness Hubs.,,,,
2026-04-24,Statement from the Attorney-General,https://statements.qld.gov.au/statements/104946,26.md,Yes,Parliamentary and Political Proceedings,Queensland,3,7,1,0,2,0,0,2.169492,Low,Sentence upheld in murder case.,"Queensland Attorney-General welcomed the decision to dismiss the appeal and affirmed the government’s tougher Adult Crime, Adult Time reforms.",The government says the case illustrates the need for harsher penalties for serious crimes and reinforces laws designed to keep offenders in adult jurisdiction.,"This update signals ongoing political emphasis on crime reform as an ESG concern, affecting community safety, legal standards, and investor perceptions of policy stability in Queensland.",,
2026-04-24,Crisafulli Government helping power the future with Australia-first facility in Townsville,https://statements.qld.gov.au/statements/104941,27.md,Yes,"Infrastructure, Project Approvals, and EPBC Developments",Queensland,9,8,8,6,7,9,9,7.898305,High,The Queensland Government has streamlined approvals to support Graphinex’s facility in Townsville.,Delivering the potential for more than 200 new regional Queensland jobs.,,,,
2026-04-24,London and Canberra calling: Inaugural Westminster Prize launches,https://statements.qld.gov.au/statements/104937,28.md,No,,,,,,,,,,,,,,,,,
2026-04-24,Crisafulli Government takes key step to fast-track the Taroom Trough,https://statements.qld.gov.au/statements/104942,29.md,Yes,"Infrastructure, Project Approvals, and EPBC Developments",Queensland,6,7,7,4,7,4,7,5.915254,Medium,"The Taroom Trough Development Plan Works Amendment Regulation 2026 has been approved, enabling assessment, development and delivery of the Taroom Trough to be streamlined.",The amendments empower the Coordinator-General to drive whole-of-government planning and stakeholder engagement.,,,,
2026-04-23,"A safer, more reliable journey delivered for Mount Warren Park residents",https://statements.qld.gov.au/statements/104938,30.md,Yes,"Infrastructure, Project Approvals, and EPBC Developments",Queensland,7,6,7,6,2,5,7,5.610169,Medium,"The Albanese and Crisafulli Governments have completed the duplication of Beaudesert-Beenleigh Road at Mount Warren Park, delivering a safer, more efficient journey for Logan motorists and commuters.","The $20 million jointly funded upgrade, with $10 million from each government, has delivered a four-lane corridor plus new footpaths, shared paths, dedicated on-road bicycle lanes, drainage improvements and a noise barrier to boost flood resilience and local connectivity.",,,,
2026-04-23,"Crisafulli Government expands landmark Adult Crime, Adult Time",https://statements.qld.gov.au/statements/104935,31.md,Yes,Legislative and Statutory Developments,Queensland,6,8,6,5,7,2,2,5.59322,Medium,Queensland Expands Adult Crime.,"The Crisafulli Government passes Expanding Adult Crime, Adult Time and Taking a Strong Stance on Drugs and Antisocial Behaviour Bill 2026.","Twelve new offences are added, police gain powers to ban offenders in four CBDs and designated precincts, and almost 4,700 youths are charged over 22,800 offences.","The reforms aim to reduce victimisation and reoffending through health-based interventions for low-risk offenders and 12 months rehabilitation on release, with early indicators showing a 7.2% fall in crime victims in 2025.",,
2026-04-23,Safety upgrade on Bruce Highway at Tully to begin ahead of schedule,https://statements.qld.gov.au/statements/104936,32.md,No,,,,,,,,,,,,,,,,,
2026-04-23,Bruce Highway safety upgrade underway for 22 kilometres in Central Queensland,https://statements.qld.gov.au/statements/104932,33.md,Yes,"Infrastructure, Project Approvals, and EPBC Developments",Queensland,6,6,7,6,2,6,8,5.627119,Medium,The Queensland Government has approved planning for safety upgrades on the Bruce Highway between Rockhampton and St Lawrence as part of the Bruce Highway Targeted Safety Program.,"The works will deliver road widening, wide centre line treatments, audio‑tactile line marking, pavement strengthening and drainage upgrades to improve safety and reliability for Central Queenslanders now and in the future.",,,,
2026-04-22,Crisafulli Government future-proofing water security in Longreach,https://statements.qld.gov.au/statements/104929,34.md,Yes,"Infrastructure, Project Approvals, and EPBC Developments",Queensland,8,6,7,4,7,7,7,6.542373,Medium,The Crisafulli Government has granted a new 500 ML water licence to Longreach Regional Council.,"It will enable the council to use five upgraded weirs on the Thomson River, boosting water storage and supply, supported by a $7 million investment.",,,,
2026-04-22,New Coomera Hospital reaches important redesign milestone,https://statements.qld.gov.au/statements/104928,35.md,Yes,"Infrastructure, Project Approvals, and EPBC Developments",Queensland,7,6,7,7,8,6,8,6.864407,Medium,"The Crisafulli Government has completed the Concept Design phase for the Coomera Hospital, part of the Hospital Rescue Plan.","Stage 1 will deliver a fully operational 400-bed hospital by 2031, with structural provisions to add 200 beds by 2032 and the worksite is expected to generate around 1,000 workers on site at peak.",,,,
2026-04-22,Investing in results to revive Southeast Asia’s Forests,https://www.greenclimate.fund/news/investing-results-revive-southeast-asia-s-forests,36.md,Yes,Funding and Grant Announcements,International,8,8,8,8,8,8,8,8,High,Forest funding accelerates REDD+.,GCF announced results-based payments to Lao PDR and Viet Nam to support forest protection under REDD+.,"More than USD 130 million has been approved for results-based payments, with 61.5 million to Lao PDR and 72 million to Viet Nam, implemented by JICA to strengthen national forest management.","The funding reinforces country ownership, rewards verified results, and channels finance back into protecting forests and building resilience against deforestation.",,
2026-04-23,Stronger together: Biodiversity Conventions boost synergy for global impact,https://whc.unesco.org/en/news/2892,37.md,Yes,"Ministerial, Diplomatic, and International Engagements",International,8,8,7,7,6,8,3,7.20339,High,Biodiversity Cooperation Strengthened.,"The Liaison Group of Biodiversity-related Conventions met to discuss practical cooperation on access to finance, capacity-building, and reporting.",They welcomed the entry into force of the BBNJ Agreement and adopted a joint communiqué reaffirming intensified collaboration.,"The alignment with other biodiversity regimes and ongoing site integrations illustrate how World Heritage sites contribute to broader biodiversity goals, supporting sustainable management, and informing policy and investment decisions.",,
2026-04-23,UNESCO statement on Ngorongoro Conservation Area,https://whc.unesco.org/en/news/2891,38.md,Yes,"Environmental Protection, Biodiversity, and Nature Policy",International,8,8,9,8,8,7,7,7.983051,High,World Heritage Policy Update.,UNESCO emphasises rights-based relocation and stakeholder engagement in the Ngorongoro MLUM project.,"It calls for a joint Reactive Monitoring mission, finalising the General Management Plan, completing the Strategic Environmental Assessment, and addressing road upgrades and biodiversity impacts.","The decision underscores that conservation must align with human rights, potentially affecting project timelines and the management framework for Serengeti-related developments and wildlife habitats.",,
2026-04-21,People and nature: UNESCO safeguarding life and heritage,https://whc.unesco.org/en/news/2890,CLEANED,NO FILE,,,,,,,,,,,,,,,,,
2026-04-23,Governor Newsom announces 38 new film projects – from animated features to big budget productions and independents – coming to the Golden State,https://www.gov.ca.gov/2026/04/23/governor-newsom-announces-38-new-film-projects-from-animated-features-to-big-budget-productions-and-independents-coming-to-the-golden-state/,40.md,Yes,"Infrastructure, Project Approvals, and EPBC Developments",International,7,8,6,6,6,6,4,6.440678,Medium,The California Film Commission has awarded tax credits to 38 film projects under the expanded Film & Television Tax Credit Program in California.,"The awards are expected to generate about $554 million in qualified spending and support 21,504 cast and crew jobs across California.",,,,
2026-04-23,"Welcome to California, Bed, Bath & Beyond!",https://www.gov.ca.gov/2026/04/23/welcome-to-california-bed-bath-beyond/,41.md,No,,,,,,,,,,,,,,,,,
2026-04-23,"Governor, First Partner statement on the passing of Michael Tilson Thomas",https://www.gov.ca.gov/2026/04/23/governor-first-partner-statement-on-the-passing-of-michael-tilson-thomas/,CLEANED,NO FILE,,,,,,,,,,,,,,,,,
2026-04-23,Governor Newsom proclaims Workers’ Memorial Day,https://www.gov.ca.gov/2026/04/23/governor-newsom-proclaims-workers-memorial-day/,CLEANED,NO FILE,,,,,,,,,,,,,,,,,
2026-04-22,Governor Newsom announces appointments 4.22.26,https://www.gov.ca.gov/2026/04/22/governor-newsom-announces-appointments-4-22-26/,44.md,Yes,Parliamentary and Political Proceedings,International,4,2,2,2,7,1,4,3.016949,Low,Governor Announces Appointments.,Governor Newsom announced several appointments to state boards and commissions.,"Appointments include the California Water Commission, Veterinary Medical Board, California Acupuncture Board and Optometry boards, with some requiring Senate confirmation.","The appointments expand governance capacity in water, veterinary and health professions, reinforcing state oversight and professional standards within a broader ESG governance framework.",,
2026-04-20,ABS calls for Norfolk Islanders to fill 2026 Census jobs,https://www.abs.gov.au/media-centre/media-releases/abs-calls-norfolk-islanders-fill-2026-census-jobs,45.md,No,,,,,,,,,,,,,,,,,
2026-04-20,ABS begins nationwide Field Officer recruitment for the 2026 Census,https://www.abs.gov.au/media-centre/media-releases/abs-begins-nationwide-field-officer-recruitment-2026-census,46.md,No,,,,,,,,,,,,,,,,,
